No.     Time           Source                Destination           Protocol Length Info
    375 1.444338000    host                  0.0                   USB      64     SET ADDRESS Request

Frame 375: 64 bytes on wire (512 bits), 64 bytes captured (512 bits) on interface 0
    Interface id: 0
    Encapsulation type: USB packets with Linux header and padding (115)
    Arrival Time: Feb 22, 2015 16:00:18.122757000 SAST
    [Time shift for this packet: 0.000000000 seconds]
    Epoch Time: 1424613618.122757000 seconds
    [Time delta from previous captured frame: 0.000041000 seconds]
    [Time delta from previous displayed frame: 0.000000000 seconds]
    [Time since reference or first frame: 1.444338000 seconds]
    Frame Number: 375
    Frame Length: 64 bytes (512 bits)
    Capture Length: 64 bytes (512 bits)
    [Frame is marked: False]
    [Frame is ignored: False]
    [Protocols in frame: usb]
USB URB
    URB id: 0xffff8803e5aa49c0
    URB type: URB_SUBMIT ('S')
    URB transfer type: URB_CONTROL (0x02)
    Endpoint: 0x00, Direction: OUT
        0... .... = Direction: OUT (0)
        .000 0000 = Endpoint value: 0
    Device: 0
    URB bus id: 2
    Device setup request: relevant (0)
    Data: present (0)
    URB sec: 1424613618
    URB usec: 122757
    URB status: Operation now in progress (-EINPROGRESS) (-115)
    URB length [bytes]: 0
    Data length [bytes]: 0
    [Response in: 376]
URB setup
    bmRequestType: 0x00
        0... .... = Direction: Host-to-device
        .00. .... = Type: Standard (0x00)
        ...0 0000 = Recipient: Device (0x00)
    bRequest: SET ADDRESS (5)
    Device: 39
    wIndex: 0
    wLength: 0

0000  c0 49 aa e5 03 88 ff ff 53 02 00 00 02 00 00 00   .I......S.......
0010  f2 e0 e9 54 00 00 00 00 85 df 01 00 8d ff ff ff   ...T............
0020  00 00 00 00 00 00 00 00 00 05 27 00 00 00 00 00   ..........'.....
0030  00 00 00 00 00 00 00 00 00 00 00 00 00 00 00 00   ................

No.     Time           Source                Destination           Protocol Length Info
    377 1.464271000    host                  39.0                  USB      64     GET DESCRIPTOR Request DEVICE

Frame 377: 64 bytes on wire (512 bits), 64 bytes captured (512 bits) on interface 0
    Interface id: 0
    Encapsulation type: USB packets with Linux header and padding (115)
    Arrival Time: Feb 22, 2015 16:00:18.142690000 SAST
    [Time shift for this packet: 0.000000000 seconds]
    Epoch Time: 1424613618.142690000 seconds
    [Time delta from previous captured frame: 0.019650000 seconds]
    [Time delta from previous displayed frame: 0.019933000 seconds]
    [Time since reference or first frame: 1.464271000 seconds]
    Frame Number: 377
    Frame Length: 64 bytes (512 bits)
    Capture Length: 64 bytes (512 bits)
    [Frame is marked: False]
    [Frame is ignored: False]
    [Protocols in frame: usb]
USB URB
    URB id: 0xffff880220b5a600
    URB type: URB_SUBMIT ('S')
    URB transfer type: URB_CONTROL (0x02)
    Endpoint: 0x80, Direction: IN
        1... .... = Direction: IN (1)
        .000 0000 = Endpoint value: 0
    Device: 39
    URB bus id: 2
    Device setup request: relevant (0)
    Data: not present ('<')
    URB sec: 1424613618
    URB usec: 142690
    URB status: Operation now in progress (-EINPROGRESS) (-115)
    URB length [bytes]: 18
    Data length [bytes]: 0
    [Response in: 378]
URB setup
    bmRequestType: 0x80
        1... .... = Direction: Device-to-host
        .00. .... = Type: Standard (0x00)
        ...0 0000 = Recipient: Device (0x00)
    bRequest: GET DESCRIPTOR (6)
    Descriptor Index: 0x00
    bDescriptorType: DEVICE (1)
    Language Id: no language specified (0x0000)
    wLength: 18

0000  00 a6 b5 20 02 88 ff ff 53 02 80 27 02 00 00 3c   ... ....S..'...<
0010  f2 e0 e9 54 00 00 00 00 62 2d 02 00 8d ff ff ff   ...T....b-......
0020  12 00 00 00 00 00 00 00 80 06 00 01 00 00 12 00   ................
0030  00 00 00 00 00 00 00 00 00 02 00 00 00 00 00 00   ................

No.     Time           Source                Destination           Protocol Length Info
    378 1.464452000    39.0                  host                  USB      82     GET DESCRIPTOR Response DEVICE

Frame 378: 82 bytes on wire (656 bits), 82 bytes captured (656 bits) on interface 0
    Interface id: 0
    Encapsulation type: USB packets with Linux header and padding (115)
    Arrival Time: Feb 22, 2015 16:00:18.142871000 SAST
    [Time shift for this packet: 0.000000000 seconds]
    Epoch Time: 1424613618.142871000 seconds
    [Time delta from previous captured frame: 0.000181000 seconds]
    [Time delta from previous displayed frame: 0.000181000 seconds]
    [Time since reference or first frame: 1.464452000 seconds]
    Frame Number: 378
    Frame Length: 82 bytes (656 bits)
    Capture Length: 82 bytes (656 bits)
    [Frame is marked: False]
    [Frame is ignored: False]
    [Protocols in frame: usb]
USB URB
    URB id: 0xffff880220b5a600
    URB type: URB_COMPLETE ('C')
    URB transfer type: URB_CONTROL (0x02)
    Endpoint: 0x80, Direction: IN
        1... .... = Direction: IN (1)
        .000 0000 = Endpoint value: 0
    Device: 39
    URB bus id: 2
    Device setup request: not relevant ('-')
    Data: present (0)
    URB sec: 1424613618
    URB usec: 142871
    URB status: Success (0)
    URB length [bytes]: 18
    Data length [bytes]: 18
    [Request in: 377]
    [Time from request: 0.000181000 seconds]
    [bInterfaceClass: Unknown (0xffff)]
DEVICE DESCRIPTOR
    bLength: 18
    bDescriptorType: DEVICE (1)
    bcdUSB: 0x0110
    bDeviceClass: Device (0x00)
    bDeviceSubClass: 0
    bDeviceProtocol: 0 (Use class code info from Interface Descriptors)
    bMaxPacketSize0: 64
    idVendor: STMicroelectronics (0x0483)
    idProduct: STM32F407 (0x5740)
    bcdDevice: 0x0200
    iManufacturer: 1
    iProduct: 2
    iSerialNumber: 3
    bNumConfigurations: 1

0000  00 a6 b5 20 02 88 ff ff 43 02 80 27 02 00 2d 00   ... ....C..'..-.
0010  f2 e0 e9 54 00 00 00 00 17 2e 02 00 00 00 00 00   ...T............
0020  12 00 00 00 12 00 00 00 00 00 00 00 00 00 00 00   ................
0030  00 00 00 00 00 00 00 00 00 02 00 00 00 00 00 00   ................
0040  12 01 10 01 00 00 00 40 83 04 40 57 00 02 01 02   .......@..@W....
0050  03 01                                             ..

No.     Time           Source                Destination           Protocol Length Info
    379 1.464496000    host                  39.0                  USB      64     GET DESCRIPTOR Request CONFIGURATION

Frame 379: 64 bytes on wire (512 bits), 64 bytes captured (512 bits) on interface 0
    Interface id: 0
    Encapsulation type: USB packets with Linux header and padding (115)
    Arrival Time: Feb 22, 2015 16:00:18.142915000 SAST
    [Time shift for this packet: 0.000000000 seconds]
    Epoch Time: 1424613618.142915000 seconds
    [Time delta from previous captured frame: 0.000044000 seconds]
    [Time delta from previous displayed frame: 0.000044000 seconds]
    [Time since reference or first frame: 1.464496000 seconds]
    Frame Number: 379
    Frame Length: 64 bytes (512 bits)
    Capture Length: 64 bytes (512 bits)
    [Frame is marked: False]
    [Frame is ignored: False]
    [Protocols in frame: usb]
USB URB
    URB id: 0xffff880220b5a600
    URB type: URB_SUBMIT ('S')
    URB transfer type: URB_CONTROL (0x02)
    Endpoint: 0x80, Direction: IN
        1... .... = Direction: IN (1)
        .000 0000 = Endpoint value: 0
    Device: 39
    URB bus id: 2
    Device setup request: relevant (0)
    Data: not present ('<')
    URB sec: 1424613618
    URB usec: 142915
    URB status: Operation now in progress (-EINPROGRESS) (-115)
    URB length [bytes]: 9
    Data length [bytes]: 0
    [Response in: 380]
URB setup
    bmRequestType: 0x80
        1... .... = Direction: Device-to-host
        .00. .... = Type: Standard (0x00)
        ...0 0000 = Recipient: Device (0x00)
    bRequest: GET DESCRIPTOR (6)
    Descriptor Index: 0x00
    bDescriptorType: CONFIGURATION (2)
    Language Id: no language specified (0x0000)
    wLength: 9

0000  00 a6 b5 20 02 88 ff ff 53 02 80 27 02 00 00 3c   ... ....S..'...<
0010  f2 e0 e9 54 00 00 00 00 43 2e 02 00 8d ff ff ff   ...T....C.......
0020  09 00 00 00 00 00 00 00 80 06 00 02 00 00 09 00   ................
0030  00 00 00 00 00 00 00 00 00 02 00 00 00 00 00 00   ................

No.     Time           Source                Destination           Protocol Length Info
    380 1.464729000    39.0                  host                  USB      73     GET DESCRIPTOR Response CONFIGURATION

Frame 380: 73 bytes on wire (584 bits), 73 bytes captured (584 bits) on interface 0
    Interface id: 0
    Encapsulation type: USB packets with Linux header and padding (115)
    Arrival Time: Feb 22, 2015 16:00:18.143148000 SAST
    [Time shift for this packet: 0.000000000 seconds]
    Epoch Time: 1424613618.143148000 seconds
    [Time delta from previous captured frame: 0.000233000 seconds]
    [Time delta from previous displayed frame: 0.000233000 seconds]
    [Time since reference or first frame: 1.464729000 seconds]
    Frame Number: 380
    Frame Length: 73 bytes (584 bits)
    Capture Length: 73 bytes (584 bits)
    [Frame is marked: False]
    [Frame is ignored: False]
    [Protocols in frame: usb]
USB URB
    URB id: 0xffff880220b5a600
    URB type: URB_COMPLETE ('C')
    URB transfer type: URB_CONTROL (0x02)
    Endpoint: 0x80, Direction: IN
        1... .... = Direction: IN (1)
        .000 0000 = Endpoint value: 0
    Device: 39
    URB bus id: 2
    Device setup request: not relevant ('-')
    Data: present (0)
    URB sec: 1424613618
    URB usec: 143148
    URB status: Success (0)
    URB length [bytes]: 9
    Data length [bytes]: 9
    [Request in: 379]
    [Time from request: 0.000233000 seconds]
    [bInterfaceClass: Unknown (0xffff)]
CONFIGURATION DESCRIPTOR
    bLength: 9
    bDescriptorType: CONFIGURATION (2)
    wTotalLength: 67
    bNumInterfaces: 2
    bConfigurationValue: 1
    iConfiguration: 0
    Configuration bmAttributes: 0xc0  SELF-POWERED  NO REMOTE-WAKEUP
        1... .... = Must be 1: Must be 1 for USB 1.1 and higher
        .1.. .... = Self-Powered: This device is SELF-POWERED
        ..0. .... = Remote Wakeup: This device does NOT support remote wakeup
    bMaxPower: 50  (100mA)

0000  00 a6 b5 20 02 88 ff ff 43 02 80 27 02 00 2d 00   ... ....C..'..-.
0010  f2 e0 e9 54 00 00 00 00 2c 2f 02 00 00 00 00 00   ...T....,/......
0020  09 00 00 00 09 00 00 00 00 00 00 00 00 00 00 00   ................
0030  00 00 00 00 00 00 00 00 00 02 00 00 00 00 00 00   ................
0040  09 02 43 00 02 01 00 c0 32                        ..C.....2

No.     Time           Source                Destination           Protocol Length Info
    381 1.464771000    host                  39.0                  USB      64     GET DESCRIPTOR Request CONFIGURATION

Frame 381: 64 bytes on wire (512 bits), 64 bytes captured (512 bits) on interface 0
    Interface id: 0
    Encapsulation type: USB packets with Linux header and padding (115)
    Arrival Time: Feb 22, 2015 16:00:18.143190000 SAST
    [Time shift for this packet: 0.000000000 seconds]
    Epoch Time: 1424613618.143190000 seconds
    [Time delta from previous captured frame: 0.000042000 seconds]
    [Time delta from previous displayed frame: 0.000042000 seconds]
    [Time since reference or first frame: 1.464771000 seconds]
    Frame Number: 381
    Frame Length: 64 bytes (512 bits)
    Capture Length: 64 bytes (512 bits)
    [Frame is marked: False]
    [Frame is ignored: False]
    [Protocols in frame: usb]
USB URB
    URB id: 0xffff880220b5a600
    URB type: URB_SUBMIT ('S')
    URB transfer type: URB_CONTROL (0x02)
    Endpoint: 0x80, Direction: IN
        1... .... = Direction: IN (1)
        .000 0000 = Endpoint value: 0
    Device: 39
    URB bus id: 2
    Device setup request: relevant (0)
    Data: not present ('<')
    URB sec: 1424613618
    URB usec: 143190
    URB status: Operation now in progress (-EINPROGRESS) (-115)
    URB length [bytes]: 67
    Data length [bytes]: 0
    [Response in: 382]
URB setup
    bmRequestType: 0x80
        1... .... = Direction: Device-to-host
        .00. .... = Type: Standard (0x00)
        ...0 0000 = Recipient: Device (0x00)
    bRequest: GET DESCRIPTOR (6)
    Descriptor Index: 0x00
    bDescriptorType: CONFIGURATION (2)
    Language Id: no language specified (0x0000)
    wLength: 67

0000  00 a6 b5 20 02 88 ff ff 53 02 80 27 02 00 00 3c   ... ....S..'...<
0010  f2 e0 e9 54 00 00 00 00 56 2f 02 00 8d ff ff ff   ...T....V/......
0020  43 00 00 00 00 00 00 00 80 06 00 02 00 00 43 00   C.............C.
0030  00 00 00 00 00 00 00 00 00 02 00 00 00 00 00 00   ................

No.     Time           Source                Destination           Protocol Length Info
    382 1.465120000    39.0                  host                  USB      131    GET DESCRIPTOR Response CONFIGURATION

Frame 382: 131 bytes on wire (1048 bits), 131 bytes captured (1048 bits) on interface 0
    Interface id: 0
    Encapsulation type: USB packets with Linux header and padding (115)
    Arrival Time: Feb 22, 2015 16:00:18.143539000 SAST
    [Time shift for this packet: 0.000000000 seconds]
    Epoch Time: 1424613618.143539000 seconds
    [Time delta from previous captured frame: 0.000349000 seconds]
    [Time delta from previous displayed frame: 0.000349000 seconds]
    [Time since reference or first frame: 1.465120000 seconds]
    Frame Number: 382
    Frame Length: 131 bytes (1048 bits)
    Capture Length: 131 bytes (1048 bits)
    [Frame is marked: False]
    [Frame is ignored: False]
    [Protocols in frame: usb]
USB URB
    URB id: 0xffff880220b5a600
    URB type: URB_COMPLETE ('C')
    URB transfer type: URB_CONTROL (0x02)
    Endpoint: 0x80, Direction: IN
        1... .... = Direction: IN (1)
        .000 0000 = Endpoint value: 0
    Device: 39
    URB bus id: 2
    Device setup request: not relevant ('-')
    Data: present (0)
    URB sec: 1424613618
    URB usec: 143539
    URB status: Success (0)
    URB length [bytes]: 67
    Data length [bytes]: 67
    [Request in: 381]
    [Time from request: 0.000349000 seconds]
    [bInterfaceClass: Unknown (0xffff)]
CONFIGURATION DESCRIPTOR
    bLength: 9
    bDescriptorType: CONFIGURATION (2)
    wTotalLength: 67
    bNumInterfaces: 2
    bConfigurationValue: 1
    iConfiguration: 0
    Configuration bmAttributes: 0xc0  SELF-POWERED  NO REMOTE-WAKEUP
        1... .... = Must be 1: Must be 1 for USB 1.1 and higher
        .1.. .... = Self-Powered: This device is SELF-POWERED
        ..0. .... = Remote Wakeup: This device does NOT support remote wakeup
    bMaxPower: 50  (100mA)
INTERFACE DESCRIPTOR (0.0): class Communications and CDC Control
    bLength: 9
    bDescriptorType: INTERFACE (4)
    bInterfaceNumber: 0
    bAlternateSetting: 0
    bNumEndpoints: 1
    bInterfaceClass: Communications and CDC Control (0x02)
    bInterfaceSubClass: 0x02
    bInterfaceProtocol: 0x01
    iInterface: 0
UNKNOWN DESCRIPTOR
    bLength: 5
    bDescriptorType: Unknown (36)
UNKNOWN DESCRIPTOR
    bLength: 5
    bDescriptorType: Unknown (36)
UNKNOWN DESCRIPTOR
    bLength: 4
    bDescriptorType: Unknown (36)
UNKNOWN DESCRIPTOR
    bLength: 5
    bDescriptorType: Unknown (36)
ENDPOINT DESCRIPTOR
    bLength: 7
    bDescriptorType: ENDPOINT (5)
    bEndpointAddress: 0x82  IN  Endpoint:2
        1... .... = Direction: IN Endpoint
        .... 0010 = Endpoint Number: 0x02
    bmAttributes: 0x03
        .... ..11 = Transfertype: Interrupt-Transfer (0x03)
        .... 00.. = Synchronisationtype: No Sync (0x00)
        ..00 .... = Behaviourtype: Data-Endpoint (0x00)
    wMaxPacketSize: 8
        ...0 0... .... .... = Transactions per microframe: 1 (0)
        .... ..00 0000 1000 = Maximum Packet Size: 8
    bInterval: 16
INTERFACE DESCRIPTOR (1.0): class CDC-Data
    bLength: 9
    bDescriptorType: INTERFACE (4)
    bInterfaceNumber: 1
    bAlternateSetting: 0
    bNumEndpoints: 2
    bInterfaceClass: CDC-Data (0x0a)
    bInterfaceSubClass: 0x00
    bInterfaceProtocol: 0x00
    iInterface: 0
ENDPOINT DESCRIPTOR
    bLength: 7
    bDescriptorType: ENDPOINT (5)
    bEndpointAddress: 0x01  OUT  Endpoint:1
        0... .... = Direction: OUT Endpoint
        .... 0001 = Endpoint Number: 0x01
    bmAttributes: 0x02
        .... ..10 = Transfertype: Bulk-Transfer (0x02)
        .... 00.. = Synchronisationtype: No Sync (0x00)
        ..00 .... = Behaviourtype: Data-Endpoint (0x00)
    wMaxPacketSize: 64
        .... ..00 0100 0000 = Maximum Packet Size: 64
    bInterval: 0
ENDPOINT DESCRIPTOR
    bLength: 7
    bDescriptorType: ENDPOINT (5)
    bEndpointAddress: 0x81  IN  Endpoint:1
        1... .... = Direction: IN Endpoint
        .... 0001 = Endpoint Number: 0x01
    bmAttributes: 0x02
        .... ..10 = Transfertype: Bulk-Transfer (0x02)
        .... 00.. = Synchronisationtype: No Sync (0x00)
        ..00 .... = Behaviourtype: Data-Endpoint (0x00)
    wMaxPacketSize: 64
        .... ..00 0100 0000 = Maximum Packet Size: 64
    bInterval: 0

0000  00 a6 b5 20 02 88 ff ff 43 02 80 27 02 00 2d 00   ... ....C..'..-.
0010  f2 e0 e9 54 00 00 00 00 b3 30 02 00 00 00 00 00   ...T.....0......
0020  43 00 00 00 43 00 00 00 00 00 00 00 00 00 00 00   C...C...........
0030  00 00 00 00 00 00 00 00 00 02 00 00 00 00 00 00   ................
0040  09 02 43 00 02 01 00 c0 32 09 04 00 00 01 02 02   ..C.....2.......
0050  01 00 05 24 00 10 01 05 24 01 00 01 04 24 02 02   ...$....$....$..
0060  05 24 06 00 01 07 05 82 03 08 00 10 09 04 01 00   .$..............
0070  02 0a 00 00 00 07 05 01 02 40 00 00 07 05 81 02   .........@......
0080  40 00 00                                          @..

No.     Time           Source                Destination           Protocol Length Info
    383 1.465166000    host                  39.0                  USB      64     GET DESCRIPTOR Request STRING

Frame 383: 64 bytes on wire (512 bits), 64 bytes captured (512 bits) on interface 0
    Interface id: 0
    Encapsulation type: USB packets with Linux header and padding (115)
    Arrival Time: Feb 22, 2015 16:00:18.143585000 SAST
    [Time shift for this packet: 0.000000000 seconds]
    Epoch Time: 1424613618.143585000 seconds
    [Time delta from previous captured frame: 0.000046000 seconds]
    [Time delta from previous displayed frame: 0.000046000 seconds]
    [Time since reference or first frame: 1.465166000 seconds]
    Frame Number: 383
    Frame Length: 64 bytes (512 bits)
    Capture Length: 64 bytes (512 bits)
    [Frame is marked: False]
    [Frame is ignored: False]
    [Protocols in frame: usb]
USB URB
    URB id: 0xffff880220b5a600
    URB type: URB_SUBMIT ('S')
    URB transfer type: URB_CONTROL (0x02)
    Endpoint: 0x80, Direction: IN
        1... .... = Direction: IN (1)
        .000 0000 = Endpoint value: 0
    Device: 39
    URB bus id: 2
    Device setup request: relevant (0)
    Data: not present ('<')
    URB sec: 1424613618
    URB usec: 143585
    URB status: Operation now in progress (-EINPROGRESS) (-115)
    URB length [bytes]: 255
    Data length [bytes]: 0
    [Response in: 384]
URB setup
    bmRequestType: 0x80
        1... .... = Direction: Device-to-host
        .00. .... = Type: Standard (0x00)
        ...0 0000 = Recipient: Device (0x00)
    bRequest: GET DESCRIPTOR (6)
    Descriptor Index: 0x00
    bDescriptorType: STRING (3)
    Language Id: no language specified (0x0000)
    wLength: 255

0000  00 a6 b5 20 02 88 ff ff 53 02 80 27 02 00 00 3c   ... ....S..'...<
0010  f2 e0 e9 54 00 00 00 00 e1 30 02 00 8d ff ff ff   ...T.....0......
0020  ff 00 00 00 00 00 00 00 80 06 00 03 00 00 ff 00   ................
0030  00 00 00 00 00 00 00 00 00 02 00 00 00 00 00 00   ................

No.     Time           Source                Destination           Protocol Length Info
    384 1.465331000    39.0                  host                  USB      68     GET DESCRIPTOR Response STRING

Frame 384: 68 bytes on wire (544 bits), 68 bytes captured (544 bits) on interface 0
    Interface id: 0
    Encapsulation type: USB packets with Linux header and padding (115)
    Arrival Time: Feb 22, 2015 16:00:18.143750000 SAST
    [Time shift for this packet: 0.000000000 seconds]
    Epoch Time: 1424613618.143750000 seconds
    [Time delta from previous captured frame: 0.000165000 seconds]
    [Time delta from previous displayed frame: 0.000165000 seconds]
    [Time since reference or first frame: 1.465331000 seconds]
    Frame Number: 384
    Frame Length: 68 bytes (544 bits)
    Capture Length: 68 bytes (544 bits)
    [Frame is marked: False]
    [Frame is ignored: False]
    [Protocols in frame: usb]
USB URB
    URB id: 0xffff880220b5a600
    URB type: URB_COMPLETE ('C')
    URB transfer type: URB_CONTROL (0x02)
    Endpoint: 0x80, Direction: IN
        1... .... = Direction: IN (1)
        .000 0000 = Endpoint value: 0
    Device: 39
    URB bus id: 2
    Device setup request: not relevant ('-')
    Data: present (0)
    URB sec: 1424613618
    URB usec: 143750
    URB status: Success (0)
    URB length [bytes]: 4
    Data length [bytes]: 4
    [Request in: 383]
    [Time from request: 0.000165000 seconds]
    [bInterfaceClass: Unknown (0xffff)]
STRING DESCRIPTOR
    bLength: 4
    bDescriptorType: STRING (3)
    wLANGID: English (United States) (0x0409)

0000  00 a6 b5 20 02 88 ff ff 43 02 80 27 02 00 2d 00   ... ....C..'..-.
0010  f2 e0 e9 54 00 00 00 00 86 31 02 00 00 00 00 00   ...T.....1......
0020  04 00 00 00 04 00 00 00 00 00 00 00 00 00 00 00   ................
0030  00 00 00 00 00 00 00 00 00 02 00 00 00 00 00 00   ................
0040  04 03 09 04                                       ....

No.     Time           Source                Destination           Protocol Length Info
    385 1.465373000    host                  39.0                  USB      64     GET DESCRIPTOR Request STRING

Frame 385: 64 bytes on wire (512 bits), 64 bytes captured (512 bits) on interface 0
    Interface id: 0
    Encapsulation type: USB packets with Linux header and padding (115)
    Arrival Time: Feb 22, 2015 16:00:18.143792000 SAST
    [Time shift for this packet: 0.000000000 seconds]
    Epoch Time: 1424613618.143792000 seconds
    [Time delta from previous captured frame: 0.000042000 seconds]
    [Time delta from previous displayed frame: 0.000042000 seconds]
    [Time since reference or first frame: 1.465373000 seconds]
    Frame Number: 385
    Frame Length: 64 bytes (512 bits)
    Capture Length: 64 bytes (512 bits)
    [Frame is marked: False]
    [Frame is ignored: False]
    [Protocols in frame: usb]
USB URB
    URB id: 0xffff880220b5a600
    URB type: URB_SUBMIT ('S')
    URB transfer type: URB_CONTROL (0x02)
    Endpoint: 0x80, Direction: IN
        1... .... = Direction: IN (1)
        .000 0000 = Endpoint value: 0
    Device: 39
    URB bus id: 2
    Device setup request: relevant (0)
    Data: not present ('<')
    URB sec: 1424613618
    URB usec: 143792
    URB status: Operation now in progress (-EINPROGRESS) (-115)
    URB length [bytes]: 255
    Data length [bytes]: 0
    [Response in: 386]
URB setup
    bmRequestType: 0x80
        1... .... = Direction: Device-to-host
        .00. .... = Type: Standard (0x00)
        ...0 0000 = Recipient: Device (0x00)
    bRequest: GET DESCRIPTOR (6)
    Descriptor Index: 0x02
    bDescriptorType: STRING (3)
    Language Id: English (United States) (0x0409)
    wLength: 255

0000  00 a6 b5 20 02 88 ff ff 53 02 80 27 02 00 00 3c   ... ....S..'...<
0010  f2 e0 e9 54 00 00 00 00 b0 31 02 00 8d ff ff ff   ...T.....1......
0020  ff 00 00 00 00 00 00 00 80 06 02 03 09 04 ff 00   ................
0030  00 00 00 00 00 00 00 00 00 02 00 00 00 00 00 00   ................

No.     Time           Source                Destination           Protocol Length Info
    386 1.465750000    39.0                  host                  USB      130    GET DESCRIPTOR Response STRING

Frame 386: 130 bytes on wire (1040 bits), 130 bytes captured (1040 bits) on interface 0
    Interface id: 0
    Encapsulation type: USB packets with Linux header and padding (115)
    Arrival Time: Feb 22, 2015 16:00:18.144169000 SAST
    [Time shift for this packet: 0.000000000 seconds]
    Epoch Time: 1424613618.144169000 seconds
    [Time delta from previous captured frame: 0.000377000 seconds]
    [Time delta from previous displayed frame: 0.000377000 seconds]
    [Time since reference or first frame: 1.465750000 seconds]
    Frame Number: 386
    Frame Length: 130 bytes (1040 bits)
    Capture Length: 130 bytes (1040 bits)
    [Frame is marked: False]
    [Frame is ignored: False]
    [Protocols in frame: usb]
USB URB
    URB id: 0xffff880220b5a600
    URB type: URB_COMPLETE ('C')
    URB transfer type: URB_CONTROL (0x02)
    Endpoint: 0x80, Direction: IN
        1... .... = Direction: IN (1)
        .000 0000 = Endpoint value: 0
    Device: 39
    URB bus id: 2
    Device setup request: not relevant ('-')
    Data: present (0)
    URB sec: 1424613618
    URB usec: 144169
    URB status: Success (0)
    URB length [bytes]: 66
    Data length [bytes]: 66
    [Request in: 385]
    [Time from request: 0.000377000 seconds]
    [bInterfaceClass: Unknown (0xffff)]
STRING DESCRIPTOR
    bLength: 66
    bDescriptorType: STRING (3)
    bString: STM32 Virtual ComPort in FS Mode

0000  00 a6 b5 20 02 88 ff ff 43 02 80 27 02 00 2d 00   ... ....C..'..-.
0010  f2 e0 e9 54 00 00 00 00 29 33 02 00 00 00 00 00   ...T....)3......
0020  42 00 00 00 42 00 00 00 00 00 00 00 00 00 00 00   B...B...........
0030  00 00 00 00 00 00 00 00 00 02 00 00 00 00 00 00   ................
0040  42 03 53 00 54 00 4d 00 33 00 32 00 20 00 56 00   B.S.T.M.3.2. .V.
0050  69 00 72 00 74 00 75 00 61 00 6c 00 20 00 43 00   i.r.t.u.a.l. .C.
0060  6f 00 6d 00 50 00 6f 00 72 00 74 00 20 00 69 00   o.m.P.o.r.t. .i.
0070  6e 00 20 00 46 00 53 00 20 00 4d 00 6f 00 64 00   n. .F.S. .M.o.d.
0080  65 00                                             e.

No.     Time           Source                Destination           Protocol Length Info
    387 1.465793000    host                  39.0                  USB      64     GET DESCRIPTOR Request STRING

Frame 387: 64 bytes on wire (512 bits), 64 bytes captured (512 bits) on interface 0
    Interface id: 0
    Encapsulation type: USB packets with Linux header and padding (115)
    Arrival Time: Feb 22, 2015 16:00:18.144212000 SAST
    [Time shift for this packet: 0.000000000 seconds]
    Epoch Time: 1424613618.144212000 seconds
    [Time delta from previous captured frame: 0.000043000 seconds]
    [Time delta from previous displayed frame: 0.000043000 seconds]
    [Time since reference or first frame: 1.465793000 seconds]
    Frame Number: 387
    Frame Length: 64 bytes (512 bits)
    Capture Length: 64 bytes (512 bits)
    [Frame is marked: False]
    [Frame is ignored: False]
    [Protocols in frame: usb]
USB URB
    URB id: 0xffff880220b5a600
    URB type: URB_SUBMIT ('S')
    URB transfer type: URB_CONTROL (0x02)
    Endpoint: 0x80, Direction: IN
        1... .... = Direction: IN (1)
        .000 0000 = Endpoint value: 0
    Device: 39
    URB bus id: 2
    Device setup request: relevant (0)
    Data: not present ('<')
    URB sec: 1424613618
    URB usec: 144212
    URB status: Operation now in progress (-EINPROGRESS) (-115)
    URB length [bytes]: 255
    Data length [bytes]: 0
    [Response in: 388]
URB setup
    bmRequestType: 0x80
        1... .... = Direction: Device-to-host
        .00. .... = Type: Standard (0x00)
        ...0 0000 = Recipient: Device (0x00)
    bRequest: GET DESCRIPTOR (6)
    Descriptor Index: 0x01
    bDescriptorType: STRING (3)
    Language Id: English (United States) (0x0409)
    wLength: 255

0000  00 a6 b5 20 02 88 ff ff 53 02 80 27 02 00 00 3c   ... ....S..'...<
0010  f2 e0 e9 54 00 00 00 00 54 33 02 00 8d ff ff ff   ...T....T3......
0020  ff 00 00 00 00 00 00 00 80 06 01 03 09 04 ff 00   ................
0030  00 00 00 00 00 00 00 00 00 02 00 00 00 00 00 00   ................

No.     Time           Source                Destination           Protocol Length Info
    388 1.466089000    39.0                  host                  USB      102    GET DESCRIPTOR Response STRING

Frame 388: 102 bytes on wire (816 bits), 102 bytes captured (816 bits) on interface 0
    Interface id: 0
    Encapsulation type: USB packets with Linux header and padding (115)
    Arrival Time: Feb 22, 2015 16:00:18.144508000 SAST
    [Time shift for this packet: 0.000000000 seconds]
    Epoch Time: 1424613618.144508000 seconds
    [Time delta from previous captured frame: 0.000296000 seconds]
    [Time delta from previous displayed frame: 0.000296000 seconds]
    [Time since reference or first frame: 1.466089000 seconds]
    Frame Number: 388
    Frame Length: 102 bytes (816 bits)
    Capture Length: 102 bytes (816 bits)
    [Frame is marked: False]
    [Frame is ignored: False]
    [Protocols in frame: usb]
USB URB
    URB id: 0xffff880220b5a600
    URB type: URB_COMPLETE ('C')
    URB transfer type: URB_CONTROL (0x02)
    Endpoint: 0x80, Direction: IN
        1... .... = Direction: IN (1)
        .000 0000 = Endpoint value: 0
    Device: 39
    URB bus id: 2
    Device setup request: not relevant ('-')
    Data: present (0)
    URB sec: 1424613618
    URB usec: 144508
    URB status: Success (0)
    URB length [bytes]: 38
    Data length [bytes]: 38
    [Request in: 387]
    [Time from request: 0.000296000 seconds]
    [bInterfaceClass: Unknown (0xffff)]
STRING DESCRIPTOR
    bLength: 38
    bDescriptorType: STRING (3)
    bString: STMicroelectronics

0000  00 a6 b5 20 02 88 ff ff 43 02 80 27 02 00 2d 00   ... ....C..'..-.
0010  f2 e0 e9 54 00 00 00 00 7c 34 02 00 00 00 00 00   ...T....|4......
0020  26 00 00 00 26 00 00 00 00 00 00 00 00 00 00 00   &...&...........
0030  00 00 00 00 00 00 00 00 00 02 00 00 00 00 00 00   ................
0040  26 03 53 00 54 00 4d 00 69 00 63 00 72 00 6f 00   &.S.T.M.i.c.r.o.
0050  65 00 6c 00 65 00 63 00 74 00 72 00 6f 00 6e 00   e.l.e.c.t.r.o.n.
0060  69 00 63 00 73 00                                 i.c.s.

No.     Time           Source                Destination           Protocol Length Info
    389 1.466131000    host                  39.0                  USB      64     GET DESCRIPTOR Request STRING

Frame 389: 64 bytes on wire (512 bits), 64 bytes captured (512 bits) on interface 0
    Interface id: 0
    Encapsulation type: USB packets with Linux header and padding (115)
    Arrival Time: Feb 22, 2015 16:00:18.144550000 SAST
    [Time shift for this packet: 0.000000000 seconds]
    Epoch Time: 1424613618.144550000 seconds
    [Time delta from previous captured frame: 0.000042000 seconds]
    [Time delta from previous displayed frame: 0.000042000 seconds]
    [Time since reference or first frame: 1.466131000 seconds]
    Frame Number: 389
    Frame Length: 64 bytes (512 bits)
    Capture Length: 64 bytes (512 bits)
    [Frame is marked: False]
    [Frame is ignored: False]
    [Protocols in frame: usb]
USB URB
    URB id: 0xffff880220b5a600
    URB type: URB_SUBMIT ('S')
    URB transfer type: URB_CONTROL (0x02)
    Endpoint: 0x80, Direction: IN
        1... .... = Direction: IN (1)
        .000 0000 = Endpoint value: 0
    Device: 39
    URB bus id: 2
    Device setup request: relevant (0)
    Data: not present ('<')
    URB sec: 1424613618
    URB usec: 144550
    URB status: Operation now in progress (-EINPROGRESS) (-115)
    URB length [bytes]: 255
    Data length [bytes]: 0
    [Response in: 390]
URB setup
    bmRequestType: 0x80
        1... .... = Direction: Device-to-host
        .00. .... = Type: Standard (0x00)
        ...0 0000 = Recipient: Device (0x00)
    bRequest: GET DESCRIPTOR (6)
    Descriptor Index: 0x03
    bDescriptorType: STRING (3)
    Language Id: English (United States) (0x0409)
    wLength: 255

0000  00 a6 b5 20 02 88 ff ff 53 02 80 27 02 00 00 3c   ... ....S..'...<
0010  f2 e0 e9 54 00 00 00 00 a6 34 02 00 8d ff ff ff   ...T.....4......
0020  ff 00 00 00 00 00 00 00 80 06 03 03 09 04 ff 00   ................
0030  00 00 00 00 00 00 00 00 00 02 00 00 00 00 00 00   ................

No.     Time           Source                Destination           Protocol Length Info
    390 1.466313000    39.0                  host                  USB      90     GET DESCRIPTOR Response STRING

Frame 390: 90 bytes on wire (720 bits), 90 bytes captured (720 bits) on interface 0
    Interface id: 0
    Encapsulation type: USB packets with Linux header and padding (115)
    Arrival Time: Feb 22, 2015 16:00:18.144732000 SAST
    [Time shift for this packet: 0.000000000 seconds]
    Epoch Time: 1424613618.144732000 seconds
    [Time delta from previous captured frame: 0.000182000 seconds]
    [Time delta from previous displayed frame: 0.000182000 seconds]
    [Time since reference or first frame: 1.466313000 seconds]
    Frame Number: 390
    Frame Length: 90 bytes (720 bits)
    Capture Length: 90 bytes (720 bits)
    [Frame is marked: False]
    [Frame is ignored: False]
    [Protocols in frame: usb]
USB URB
    URB id: 0xffff880220b5a600
    URB type: URB_COMPLETE ('C')
    URB transfer type: URB_CONTROL (0x02)
    Endpoint: 0x80, Direction: IN
        1... .... = Direction: IN (1)
        .000 0000 = Endpoint value: 0
    Device: 39
    URB bus id: 2
    Device setup request: not relevant ('-')
    Data: present (0)
    URB sec: 1424613618
    URB usec: 144732
    URB status: Success (0)
    URB length [bytes]: 26
    Data length [bytes]: 26
    [Request in: 389]
    [Time from request: 0.000182000 seconds]
    [bInterfaceClass: Unknown (0xffff)]
STRING DESCRIPTOR
    bLength: 26
    bDescriptorType: STRING (3)
    bString: 00000000001B

0000  00 a6 b5 20 02 88 ff ff 43 02 80 27 02 00 2d 00   ... ....C..'..-.
0010  f2 e0 e9 54 00 00 00 00 5c 35 02 00 00 00 00 00   ...T....\5......
0020  1a 00 00 00 1a 00 00 00 00 00 00 00 00 00 00 00   ................
0030  00 00 00 00 00 00 00 00 00 02 00 00 00 00 00 00   ................
0040  1a 03 30 00 30 00 30 00 30 00 30 00 30 00 30 00   ..0.0.0.0.0.0.0.
0050  30 00 30 00 30 00 31 00 42 00                     0.0.0.1.B.

No.     Time           Source                Destination           Protocol Length Info
    391 1.466555000    host                  39.0                  USB      64     SET CONFIGURATION Request

Frame 391: 64 bytes on wire (512 bits), 64 bytes captured (512 bits) on interface 0
    Interface id: 0
    Encapsulation type: USB packets with Linux header and padding (115)
    Arrival Time: Feb 22, 2015 16:00:18.144974000 SAST
    [Time shift for this packet: 0.000000000 seconds]
    Epoch Time: 1424613618.144974000 seconds
    [Time delta from previous captured frame: 0.000242000 seconds]
    [Time delta from previous displayed frame: 0.000242000 seconds]
    [Time since reference or first frame: 1.466555000 seconds]
    Frame Number: 391
    Frame Length: 64 bytes (512 bits)
    Capture Length: 64 bytes (512 bits)
    [Frame is marked: False]
    [Frame is ignored: False]
    [Protocols in frame: usb]
USB URB
    URB id: 0xffff880220b5a900
    URB type: URB_SUBMIT ('S')
    URB transfer type: URB_CONTROL (0x02)
    Endpoint: 0x00, Direction: OUT
        0... .... = Direction: OUT (0)
        .000 0000 = Endpoint value: 0
    Device: 39
    URB bus id: 2
    Device setup request: relevant (0)
    Data: present (0)
    URB sec: 1424613618
    URB usec: 144974
    URB status: Operation now in progress (-EINPROGRESS) (-115)
    URB length [bytes]: 0
    Data length [bytes]: 0
    [Response in: 392]
URB setup
    bmRequestType: 0x00
        0... .... = Direction: Host-to-device
        .00. .... = Type: Standard (0x00)
        ...0 0000 = Recipient: Device (0x00)
    bRequest: SET CONFIGURATION (9)
    bConfigurationValue: 1
    wIndex: 0
    wLength: 0

0000  00 a9 b5 20 02 88 ff ff 53 02 00 27 02 00 00 00   ... ....S..'....
0010  f2 e0 e9 54 00 00 00 00 4e 36 02 00 8d ff ff ff   ...T....N6......
0020  00 00 00 00 00 00 00 00 00 09 01 00 00 00 00 00   ................
0030  00 00 00 00 00 00 00 00 00 00 00 00 00 00 00 00   ................

No.     Time           Source                Destination           Protocol Length Info
    392 1.466795000    39.0                  host                  USB      64     SET CONFIGURATION Response

Frame 392: 64 bytes on wire (512 bits), 64 bytes captured (512 bits) on interface 0
    Interface id: 0
    Encapsulation type: USB packets with Linux header and padding (115)
    Arrival Time: Feb 22, 2015 16:00:18.145214000 SAST
    [Time shift for this packet: 0.000000000 seconds]
    Epoch Time: 1424613618.145214000 seconds
    [Time delta from previous captured frame: 0.000240000 seconds]
    [Time delta from previous displayed frame: 0.000240000 seconds]
    [Time since reference or first frame: 1.466795000 seconds]
    Frame Number: 392
    Frame Length: 64 bytes (512 bits)
    Capture Length: 64 bytes (512 bits)
    [Frame is marked: False]
    [Frame is ignored: False]
    [Protocols in frame: usb]
USB URB
    URB id: 0xffff880220b5a900
    URB type: URB_COMPLETE ('C')
    URB transfer type: URB_CONTROL (0x02)
    Endpoint: 0x00, Direction: OUT
        0... .... = Direction: OUT (0)
        .000 0000 = Endpoint value: 0
    Device: 39
    URB bus id: 2
    Device setup request: not relevant ('-')
    Data: not present ('>')
    URB sec: 1424613618
    URB usec: 145214
    URB status: Success (0)
    URB length [bytes]: 0
    Data length [bytes]: 0
    [Request in: 391]
    [Time from request: 0.000240000 seconds]
    [bInterfaceClass: Unknown (0xffff)]

0000  00 a9 b5 20 02 88 ff ff 43 02 00 27 02 00 2d 3e   ... ....C..'..->
0010  f2 e0 e9 54 00 00 00 00 3e 37 02 00 00 00 00 00   ...T....>7......
0020  00 00 00 00 00 00 00 00 00 00 00 00 00 00 00 00   ................
0030  00 00 00 00 00 00 00 00 00 00 00 00 00 00 00 00   ................

No.     Time           Source                Destination           Protocol Length Info
    393 1.466904000    host                  39.0                  USB      64     URB_CONTROL out

Frame 393: 64 bytes on wire (512 bits), 64 bytes captured (512 bits) on interface 0
    Interface id: 0
    Encapsulation type: USB packets with Linux header and padding (115)
    Arrival Time: Feb 22, 2015 16:00:18.145323000 SAST
    [Time shift for this packet: 0.000000000 seconds]
    Epoch Time: 1424613618.145323000 seconds
    [Time delta from previous captured frame: 0.000109000 seconds]
    [Time delta from previous displayed frame: 0.000109000 seconds]
    [Time since reference or first frame: 1.466904000 seconds]
    Frame Number: 393
    Frame Length: 64 bytes (512 bits)
    Capture Length: 64 bytes (512 bits)
    [Frame is marked: False]
    [Frame is ignored: False]
    [Protocols in frame: usb]
USB URB
    URB id: 0xffff8801c36b1c00
    URB type: URB_SUBMIT ('S')
    URB transfer type: URB_CONTROL (0x02)
    Endpoint: 0x00, Direction: OUT
        0... .... = Direction: OUT (0)
        .000 0000 = Endpoint value: 0
    Device: 39
    URB bus id: 2
    Device setup request: relevant (0)
    Data: present (0)
    URB sec: 1424613618
    URB usec: 145323
    URB status: Operation now in progress (-EINPROGRESS) (-115)
    URB length [bytes]: 0
    Data length [bytes]: 0
    [Response in: 394]
    [bInterfaceClass: Communications and CDC Control (0x02)]
URB setup
    bmRequestType: 0x21
        0... .... = Direction: Host-to-device
        .01. .... = Type: Class (0x01)
        ...0 0001 = Recipient: Interface (0x01)
    bRequest: 34
    wValue: 0x0000
    wIndex: 0
    wLength: 0

0000  00 1c 6b c3 01 88 ff ff 53 02 00 27 02 00 00 00   ..k.....S..'....
0010  f2 e0 e9 54 00 00 00 00 ab 37 02 00 8d ff ff ff   ...T.....7......
0020  00 00 00 00 00 00 00 00 21 22 00 00 00 00 00 00   ........!"......
0030  00 00 00 00 00 00 00 00 00 00 00 00 00 00 00 00   ................

No.     Time           Source                Destination           Protocol Length Info
    394 1.467043000    39.0                  host                  USB      64     URB_CONTROL out

Frame 394: 64 bytes on wire (512 bits), 64 bytes captured (512 bits) on interface 0
    Interface id: 0
    Encapsulation type: USB packets with Linux header and padding (115)
    Arrival Time: Feb 22, 2015 16:00:18.145462000 SAST
    [Time shift for this packet: 0.000000000 seconds]
    Epoch Time: 1424613618.145462000 seconds
    [Time delta from previous captured frame: 0.000139000 seconds]
    [Time delta from previous displayed frame: 0.000139000 seconds]
    [Time since reference or first frame: 1.467043000 seconds]
    Frame Number: 394
    Frame Length: 64 bytes (512 bits)
    Capture Length: 64 bytes (512 bits)
    [Frame is marked: False]
    [Frame is ignored: False]
    [Protocols in frame: usb]
USB URB
    URB id: 0xffff8801c36b1c00
    URB type: URB_COMPLETE ('C')
    URB transfer type: URB_CONTROL (0x02)
    Endpoint: 0x00, Direction: OUT
        0... .... = Direction: OUT (0)
        .000 0000 = Endpoint value: 0
    Device: 39
    URB bus id: 2
    Device setup request: not relevant ('-')
    Data: not present ('>')
    URB sec: 1424613618
    URB usec: 145462
    URB status: Success (0)
    URB length [bytes]: 0
    Data length [bytes]: 0
    [Request in: 393]
    [Time from request: 0.000139000 seconds]
    [bInterfaceClass: Communications and CDC Control (0x02)]

0000  00 1c 6b c3 01 88 ff ff 43 02 00 27 02 00 2d 3e   ..k.....C..'..->
0010  f2 e0 e9 54 00 00 00 00 36 38 02 00 00 00 00 00   ...T....68......
0020  00 00 00 00 00 00 00 00 00 00 00 00 00 00 00 00   ................
0030  00 00 00 00 00 00 00 00 00 00 00 00 00 00 00 00   ................

No.     Time           Source                Destination           Protocol Length Info
    395 1.467064000    host                  39.0                  USB      71     URB_CONTROL out

Frame 395: 71 bytes on wire (568 bits), 71 bytes captured (568 bits) on interface 0
    Interface id: 0
    Encapsulation type: USB packets with Linux header and padding (115)
    Arrival Time: Feb 22, 2015 16:00:18.145483000 SAST
    [Time shift for this packet: 0.000000000 seconds]
    Epoch Time: 1424613618.145483000 seconds
    [Time delta from previous captured frame: 0.000021000 seconds]
    [Time delta from previous displayed frame: 0.000021000 seconds]
    [Time since reference or first frame: 1.467064000 seconds]
    Frame Number: 395
    Frame Length: 71 bytes (568 bits)
    Capture Length: 71 bytes (568 bits)
    [Frame is marked: False]
    [Frame is ignored: False]
    [Protocols in frame: usb]
USB URB
    URB id: 0xffff8801c36b1c00
    URB type: URB_SUBMIT ('S')
    URB transfer type: URB_CONTROL (0x02)
    Endpoint: 0x00, Direction: OUT
        0... .... = Direction: OUT (0)
        .000 0000 = Endpoint value: 0
    Device: 39
    URB bus id: 2
    Device setup request: relevant (0)
    Data: present (0)
    URB sec: 1424613618
    URB usec: 145483
    URB status: Operation now in progress (-EINPROGRESS) (-115)
    URB length [bytes]: 7
    Data length [bytes]: 7
    [Response in: 396]
    [bInterfaceClass: Communications and CDC Control (0x02)]
URB setup
    bmRequestType: 0x21
        0... .... = Direction: Host-to-device
        .01. .... = Type: Class (0x01)
        ...0 0001 = Recipient: Interface (0x01)
    bRequest: 32
    wValue: 0x0000
    wIndex: 0
    wLength: 7
Leftover Capture Data: 80250000000008

0000  00 1c 6b c3 01 88 ff ff 53 02 00 27 02 00 00 00   ..k.....S..'....
0010  f2 e0 e9 54 00 00 00 00 4b 38 02 00 8d ff ff ff   ...T....K8......
0020  07 00 00 00 07 00 00 00 21 20 00 00 00 00 07 00   ........! ......
0030  00 00 00 00 00 00 00 00 00 00 00 00 00 00 00 00   ................
0040  80 25 00 00 00 00 08                              .%.....

No.     Time           Source                Destination           Protocol Length Info
    396 1.467307000    39.0                  host                  USB      64     URB_CONTROL out

Frame 396: 64 bytes on wire (512 bits), 64 bytes captured (512 bits) on interface 0
    Interface id: 0
    Encapsulation type: USB packets with Linux header and padding (115)
    Arrival Time: Feb 22, 2015 16:00:18.145726000 SAST
    [Time shift for this packet: 0.000000000 seconds]
    Epoch Time: 1424613618.145726000 seconds
    [Time delta from previous captured frame: 0.000243000 seconds]
    [Time delta from previous displayed frame: 0.000243000 seconds]
    [Time since reference or first frame: 1.467307000 seconds]
    Frame Number: 396
    Frame Length: 64 bytes (512 bits)
    Capture Length: 64 bytes (512 bits)
    [Frame is marked: False]
    [Frame is ignored: False]
    [Protocols in frame: usb]
USB URB
    URB id: 0xffff8801c36b1c00
    URB type: URB_COMPLETE ('C')
    URB transfer type: URB_CONTROL (0x02)
    Endpoint: 0x00, Direction: OUT
        0... .... = Direction: OUT (0)
        .000 0000 = Endpoint value: 0
    Device: 39
    URB bus id: 2
    Device setup request: not relevant ('-')
    Data: not present ('>')
    URB sec: 1424613618
    URB usec: 145726
    URB status: Success (0)
    URB length [bytes]: 7
    Data length [bytes]: 0
    [Request in: 395]
    [Time from request: 0.000243000 seconds]
    [bInterfaceClass: Communications and CDC Control (0x02)]

0000  00 1c 6b c3 01 88 ff ff 43 02 00 27 02 00 2d 3e   ..k.....C..'..->
0010  f2 e0 e9 54 00 00 00 00 3e 39 02 00 00 00 00 00   ...T....>9......
0020  07 00 00 00 00 00 00 00 00 00 00 00 00 00 00 00   ................
0030  00 00 00 00 00 00 00 00 00 00 00 00 00 00 00 00   ................

No.     Time           Source                Destination           Protocol Length Info
    399 1.485517000    host                  39.2                  USB      64     URB_INTERRUPT in

Frame 399: 64 bytes on wire (512 bits), 64 bytes captured (512 bits) on interface 0
    Interface id: 0
    Encapsulation type: USB packets with Linux header and padding (115)
    Arrival Time: Feb 22, 2015 16:00:18.163936000 SAST
    [Time shift for this packet: 0.000000000 seconds]
    Epoch Time: 1424613618.163936000 seconds
    [Time delta from previous captured frame: 0.017847000 seconds]
    [Time delta from previous displayed frame: 0.018210000 seconds]
    [Time since reference or first frame: 1.485517000 seconds]
    Frame Number: 399
    Frame Length: 64 bytes (512 bits)
    Capture Length: 64 bytes (512 bits)
    [Frame is marked: False]
    [Frame is ignored: False]
    [Protocols in frame: usb]
USB URB
    URB id: 0xffff880220b5a240
    URB type: URB_SUBMIT ('S')
    URB transfer type: URB_INTERRUPT (0x01)
    Endpoint: 0x82, Direction: IN
        1... .... = Direction: IN (1)
        .000 0010 = Endpoint value: 2
    Device: 39
    URB bus id: 2
    Device setup request: not relevant ('-')
    Data: not present ('<')
    URB sec: 1424613618
    URB usec: 163936
    URB status: Operation now in progress (-EINPROGRESS) (-115)
    URB length [bytes]: 8
    Data length [bytes]: 0
    [Response in: 1824]
    [bInterfaceClass: Communications and CDC Control (0x02)]

0000  40 a2 b5 20 02 88 ff ff 53 01 82 27 02 00 2d 3c   @.. ....S..'..-<
0010  f2 e0 e9 54 00 00 00 00 60 80 02 00 8d ff ff ff   ...T....`.......
0020  08 00 00 00 00 00 00 00 00 00 00 00 00 00 00 00   ................
0030  10 00 00 00 00 00 00 00 04 02 00 00 00 00 00 00   ................

No.     Time           Source                Destination           Protocol Length Info
    400 1.485533000    host                  39.0                  USB      64     URB_CONTROL out

Frame 400: 64 bytes on wire (512 bits), 64 bytes captured (512 bits) on interface 0
    Interface id: 0
    Encapsulation type: USB packets with Linux header and padding (115)
    Arrival Time: Feb 22, 2015 16:00:18.163952000 SAST
    [Time shift for this packet: 0.000000000 seconds]
    Epoch Time: 1424613618.163952000 seconds
    [Time delta from previous captured frame: 0.000016000 seconds]
    [Time delta from previous displayed frame: 0.000016000 seconds]
    [Time since reference or first frame: 1.485533000 seconds]
    Frame Number: 400
    Frame Length: 64 bytes (512 bits)
    Capture Length: 64 bytes (512 bits)
    [Frame is marked: False]
    [Frame is ignored: False]
    [Protocols in frame: usb]
USB URB
    URB id: 0xffff8801a8d2e840
    URB type: URB_SUBMIT ('S')
    URB transfer type: URB_CONTROL (0x02)
    Endpoint: 0x00, Direction: OUT
        0... .... = Direction: OUT (0)
        .000 0000 = Endpoint value: 0
    Device: 39
    URB bus id: 2
    Device setup request: relevant (0)
    Data: present (0)
    URB sec: 1424613618
    URB usec: 163952
    URB status: Operation now in progress (-EINPROGRESS) (-115)
    URB length [bytes]: 0
    Data length [bytes]: 0
    [Response in: 401]
    [bInterfaceClass: Communications and CDC Control (0x02)]
URB setup
    bmRequestType: 0x21
        0... .... = Direction: Host-to-device
        .01. .... = Type: Class (0x01)
        ...0 0001 = Recipient: Interface (0x01)
    bRequest: 34
    wValue: 0x0003
    wIndex: 0
    wLength: 0

0000  40 e8 d2 a8 01 88 ff ff 53 02 00 27 02 00 00 00   @.......S..'....
0010  f2 e0 e9 54 00 00 00 00 70 80 02 00 8d ff ff ff   ...T....p.......
0020  00 00 00 00 00 00 00 00 21 22 03 00 00 00 00 00   ........!"......
0030  00 00 00 00 00 00 00 00 00 00 00 00 00 00 00 00   ................

No.     Time           Source                Destination           Protocol Length Info
    401 1.485671000    39.0                  host                  USB      64     URB_CONTROL out

Frame 401: 64 bytes on wire (512 bits), 64 bytes captured (512 bits) on interface 0
    Interface id: 0
    Encapsulation type: USB packets with Linux header and padding (115)
    Arrival Time: Feb 22, 2015 16:00:18.164090000 SAST
    [Time shift for this packet: 0.000000000 seconds]
    Epoch Time: 1424613618.164090000 seconds
    [Time delta from previous captured frame: 0.000138000 seconds]
    [Time delta from previous displayed frame: 0.000138000 seconds]
    [Time since reference or first frame: 1.485671000 seconds]
    Frame Number: 401
    Frame Length: 64 bytes (512 bits)
    Capture Length: 64 bytes (512 bits)
    [Frame is marked: False]
    [Frame is ignored: False]
    [Protocols in frame: usb]
USB URB
    URB id: 0xffff8801a8d2e840
    URB type: URB_COMPLETE ('C')
    URB transfer type: URB_CONTROL (0x02)
    Endpoint: 0x00, Direction: OUT
        0... .... = Direction: OUT (0)
        .000 0000 = Endpoint value: 0
    Device: 39
    URB bus id: 2
    Device setup request: not relevant ('-')
    Data: not present ('>')
    URB sec: 1424613618
    URB usec: 164090
    URB status: Success (0)
    URB length [bytes]: 0
    Data length [bytes]: 0
    [Request in: 400]
    [Time from request: 0.000138000 seconds]
    [bInterfaceClass: Communications and CDC Control (0x02)]

0000  40 e8 d2 a8 01 88 ff ff 43 02 00 27 02 00 2d 3e   @.......C..'..->
0010  f2 e0 e9 54 00 00 00 00 fa 80 02 00 00 00 00 00   ...T............
0020  00 00 00 00 00 00 00 00 00 00 00 00 00 00 00 00   ................
0030  00 00 00 00 00 00 00 00 00 00 00 00 00 00 00 00   ................

No.     Time           Source                Destination           Protocol Length Info
    402 1.485678000    host                  39.1                  USB      64     URB_BULK in

Frame 402: 64 bytes on wire (512 bits), 64 bytes captured (512 bits) on interface 0
    Interface id: 0
    Encapsulation type: USB packets with Linux header and padding (115)
    Arrival Time: Feb 22, 2015 16:00:18.164097000 SAST
    [Time shift for this packet: 0.000000000 seconds]
    Epoch Time: 1424613618.164097000 seconds
    [Time delta from previous captured frame: 0.000007000 seconds]
    [Time delta from previous displayed frame: 0.000007000 seconds]
    [Time since reference or first frame: 1.485678000 seconds]
    Frame Number: 402
    Frame Length: 64 bytes (512 bits)
    Capture Length: 64 bytes (512 bits)
    [Frame is marked: False]
    [Frame is ignored: False]
    [Protocols in frame: usb]
USB URB
    URB id: 0xffff88041783b9c0
    URB type: URB_SUBMIT ('S')
    URB transfer type: URB_BULK (0x03)
    Endpoint: 0x81, Direction: IN
        1... .... = Direction: IN (1)
        .000 0001 = Endpoint value: 1
    Device: 39
    URB bus id: 2
    Device setup request: not relevant ('-')
    Data: not present ('<')
    URB sec: 1424613618
    URB usec: 164097
    URB status: Operation now in progress (-EINPROGRESS) (-115)
    URB length [bytes]: 128
    Data length [bytes]: 0
    [bInterfaceClass: CDC-Data (0x0a)]

0000  c0 b9 83 17 04 88 ff ff 53 03 81 27 02 00 2d 3c   ........S..'..-<
0010  f2 e0 e9 54 00 00 00 00 01 81 02 00 8d ff ff ff   ...T............
0020  80 00 00 00 00 00 00 00 00 00 00 00 00 00 00 00   ................
0030  00 00 00 00 00 00 00 00 04 02 00 00 00 00 00 00   ................

No.     Time           Source                Destination           Protocol Length Info
    403 1.485680000    host                  39.1                  USB      64     URB_BULK in

Frame 403: 64 bytes on wire (512 bits), 64 bytes captured (512 bits) on interface 0
    Interface id: 0
    Encapsulation type: USB packets with Linux header and padding (115)
    Arrival Time: Feb 22, 2015 16:00:18.164099000 SAST
    [Time shift for this packet: 0.000000000 seconds]
    Epoch Time: 1424613618.164099000 seconds
    [Time delta from previous captured frame: 0.000002000 seconds]
    [Time delta from previous displayed frame: 0.000002000 seconds]
    [Time since reference or first frame: 1.485680000 seconds]
    Frame Number: 403
    Frame Length: 64 bytes (512 bits)
    Capture Length: 64 bytes (512 bits)
    [Frame is marked: False]
    [Frame is ignored: False]
    [Protocols in frame: usb]
USB URB
    URB id: 0xffff88041783b780
    URB type: URB_SUBMIT ('S')
    URB transfer type: URB_BULK (0x03)
    Endpoint: 0x81, Direction: IN
        1... .... = Direction: IN (1)
        .000 0001 = Endpoint value: 1
    Device: 39
    URB bus id: 2
    Device setup request: not relevant ('-')
    Data: not present ('<')
    URB sec: 1424613618
    URB usec: 164099
    URB status: Operation now in progress (-EINPROGRESS) (-115)
    URB length [bytes]: 128
    Data length [bytes]: 0
    [bInterfaceClass: CDC-Data (0x0a)]

0000  80 b7 83 17 04 88 ff ff 53 03 81 27 02 00 2d 3c   ........S..'..-<
0010  f2 e0 e9 54 00 00 00 00 03 81 02 00 8d ff ff ff   ...T............
0020  80 00 00 00 00 00 00 00 00 00 00 00 00 00 00 00   ................
0030  00 00 00 00 00 00 00 00 04 02 00 00 00 00 00 00   ................

No.     Time           Source                Destination           Protocol Length Info
    404 1.485680000    host                  39.1                  USB      64     URB_BULK in

Frame 404: 64 bytes on wire (512 bits), 64 bytes captured (512 bits) on interface 0
    Interface id: 0
    Encapsulation type: USB packets with Linux header and padding (115)
    Arrival Time: Feb 22, 2015 16:00:18.164099000 SAST
    [Time shift for this packet: 0.000000000 seconds]
    Epoch Time: 1424613618.164099000 seconds
    [Time delta from previous captured frame: 0.000000000 seconds]
    [Time delta from previous displayed frame: 0.000000000 seconds]
    [Time since reference or first frame: 1.485680000 seconds]
    Frame Number: 404
    Frame Length: 64 bytes (512 bits)
    Capture Length: 64 bytes (512 bits)
    [Frame is marked: False]
    [Frame is ignored: False]
    [Protocols in frame: usb]
USB URB
    URB id: 0xffff8801c36f8600
    URB type: URB_SUBMIT ('S')
    URB transfer type: URB_BULK (0x03)
    Endpoint: 0x81, Direction: IN
        1... .... = Direction: IN (1)
        .000 0001 = Endpoint value: 1
    Device: 39
    URB bus id: 2
    Device setup request: not relevant ('-')
    Data: not present ('<')
    URB sec: 1424613618
    URB usec: 164099
    URB status: Operation now in progress (-EINPROGRESS) (-115)
    URB length [bytes]: 128
    Data length [bytes]: 0
    [bInterfaceClass: CDC-Data (0x0a)]

0000  00 86 6f c3 01 88 ff ff 53 03 81 27 02 00 2d 3c   ..o.....S..'..-<
0010  f2 e0 e9 54 00 00 00 00 03 81 02 00 8d ff ff ff   ...T............
0020  80 00 00 00 00 00 00 00 00 00 00 00 00 00 00 00   ................
0030  00 00 00 00 00 00 00 00 04 02 00 00 00 00 00 00   ................

No.     Time           Source                Destination           Protocol Length Info
    405 1.485681000    host                  39.1                  USB      64     URB_BULK in

Frame 405: 64 bytes on wire (512 bits), 64 bytes captured (512 bits) on interface 0
    Interface id: 0
    Encapsulation type: USB packets with Linux header and padding (115)
    Arrival Time: Feb 22, 2015 16:00:18.164100000 SAST
    [Time shift for this packet: 0.000000000 seconds]
    Epoch Time: 1424613618.164100000 seconds
    [Time delta from previous captured frame: 0.000001000 seconds]
    [Time delta from previous displayed frame: 0.000001000 seconds]
    [Time since reference or first frame: 1.485681000 seconds]
    Frame Number: 405
    Frame Length: 64 bytes (512 bits)
    Capture Length: 64 bytes (512 bits)
    [Frame is marked: False]
    [Frame is ignored: False]
    [Protocols in frame: usb]
USB URB
    URB id: 0xffff8801c36f8a80
    URB type: URB_SUBMIT ('S')
    URB transfer type: URB_BULK (0x03)
    Endpoint: 0x81, Direction: IN
        1... .... = Direction: IN (1)
        .000 0001 = Endpoint value: 1
    Device: 39
    URB bus id: 2
    Device setup request: not relevant ('-')
    Data: not present ('<')
    URB sec: 1424613618
    URB usec: 164100
    URB status: Operation now in progress (-EINPROGRESS) (-115)
    URB length [bytes]: 128
    Data length [bytes]: 0
    [bInterfaceClass: CDC-Data (0x0a)]

0000  80 8a 6f c3 01 88 ff ff 53 03 81 27 02 00 2d 3c   ..o.....S..'..-<
0010  f2 e0 e9 54 00 00 00 00 04 81 02 00 8d ff ff ff   ...T............
0020  80 00 00 00 00 00 00 00 00 00 00 00 00 00 00 00   ................
0030  00 00 00 00 00 00 00 00 04 02 00 00 00 00 00 00   ................

No.     Time           Source                Destination           Protocol Length Info
    406 1.485681000    host                  39.1                  USB      64     URB_BULK in

Frame 406: 64 bytes on wire (512 bits), 64 bytes captured (512 bits) on interface 0
    Interface id: 0
    Encapsulation type: USB packets with Linux header and padding (115)
    Arrival Time: Feb 22, 2015 16:00:18.164100000 SAST
    [Time shift for this packet: 0.000000000 seconds]
    Epoch Time: 1424613618.164100000 seconds
    [Time delta from previous captured frame: 0.000000000 seconds]
    [Time delta from previous displayed frame: 0.000000000 seconds]
    [Time since reference or first frame: 1.485681000 seconds]
    Frame Number: 406
    Frame Length: 64 bytes (512 bits)
    Capture Length: 64 bytes (512 bits)
    [Frame is marked: False]
    [Frame is ignored: False]
    [Protocols in frame: usb]
USB URB
    URB id: 0xffff8801c36f8180
    URB type: URB_SUBMIT ('S')
    URB transfer type: URB_BULK (0x03)
    Endpoint: 0x81, Direction: IN
        1... .... = Direction: IN (1)
        .000 0001 = Endpoint value: 1
    Device: 39
    URB bus id: 2
    Device setup request: not relevant ('-')
    Data: not present ('<')
    URB sec: 1424613618
    URB usec: 164100
    URB status: Operation now in progress (-EINPROGRESS) (-115)
    URB length [bytes]: 128
    Data length [bytes]: 0
    [bInterfaceClass: CDC-Data (0x0a)]

0000  80 81 6f c3 01 88 ff ff 53 03 81 27 02 00 2d 3c   ..o.....S..'..-<
0010  f2 e0 e9 54 00 00 00 00 04 81 02 00 8d ff ff ff   ...T............
0020  80 00 00 00 00 00 00 00 00 00 00 00 00 00 00 00   ................
0030  00 00 00 00 00 00 00 00 04 02 00 00 00 00 00 00   ................

No.     Time           Source                Destination           Protocol Length Info
    407 1.485682000    host                  39.1                  USB      64     URB_BULK in

Frame 407: 64 bytes on wire (512 bits), 64 bytes captured (512 bits) on interface 0
    Interface id: 0
    Encapsulation type: USB packets with Linux header and padding (115)
    Arrival Time: Feb 22, 2015 16:00:18.164101000 SAST
    [Time shift for this packet: 0.000000000 seconds]
    Epoch Time: 1424613618.164101000 seconds
    [Time delta from previous captured frame: 0.000001000 seconds]
    [Time delta from previous displayed frame: 0.000001000 seconds]
    [Time since reference or first frame: 1.485682000 seconds]
    Frame Number: 407
    Frame Length: 64 bytes (512 bits)
    Capture Length: 64 bytes (512 bits)
    [Frame is marked: False]
    [Frame is ignored: False]
    [Protocols in frame: usb]
USB URB
    URB id: 0xffff8801c36f86c0
    URB type: URB_SUBMIT ('S')
    URB transfer type: URB_BULK (0x03)
    Endpoint: 0x81, Direction: IN
        1... .... = Direction: IN (1)
        .000 0001 = Endpoint value: 1
    Device: 39
    URB bus id: 2
    Device setup request: not relevant ('-')
    Data: not present ('<')
    URB sec: 1424613618
    URB usec: 164101
    URB status: Operation now in progress (-EINPROGRESS) (-115)
    URB length [bytes]: 128
    Data length [bytes]: 0
    [bInterfaceClass: CDC-Data (0x0a)]

0000  c0 86 6f c3 01 88 ff ff 53 03 81 27 02 00 2d 3c   ..o.....S..'..-<
0010  f2 e0 e9 54 00 00 00 00 05 81 02 00 8d ff ff ff   ...T............
0020  80 00 00 00 00 00 00 00 00 00 00 00 00 00 00 00   ................
0030  00 00 00 00 00 00 00 00 04 02 00 00 00 00 00 00   ................

No.     Time           Source                Destination           Protocol Length Info
    408 1.485682000    host                  39.1                  USB      64     URB_BULK in

Frame 408: 64 bytes on wire (512 bits), 64 bytes captured (512 bits) on interface 0
    Interface id: 0
    Encapsulation type: USB packets with Linux header and padding (115)
    Arrival Time: Feb 22, 2015 16:00:18.164101000 SAST
    [Time shift for this packet: 0.000000000 seconds]
    Epoch Time: 1424613618.164101000 seconds
    [Time delta from previous captured frame: 0.000000000 seconds]
    [Time delta from previous displayed frame: 0.000000000 seconds]
    [Time since reference or first frame: 1.485682000 seconds]
    Frame Number: 408
    Frame Length: 64 bytes (512 bits)
    Capture Length: 64 bytes (512 bits)
    [Frame is marked: False]
    [Frame is ignored: False]
    [Protocols in frame: usb]
USB URB
    URB id: 0xffff8801c36f8480
    URB type: URB_SUBMIT ('S')
    URB transfer type: URB_BULK (0x03)
    Endpoint: 0x81, Direction: IN
        1... .... = Direction: IN (1)
        .000 0001 = Endpoint value: 1
    Device: 39
    URB bus id: 2
    Device setup request: not relevant ('-')
    Data: not present ('<')
    URB sec: 1424613618
    URB usec: 164101
    URB status: Operation now in progress (-EINPROGRESS) (-115)
    URB length [bytes]: 128
    Data length [bytes]: 0
    [bInterfaceClass: CDC-Data (0x0a)]

0000  80 84 6f c3 01 88 ff ff 53 03 81 27 02 00 2d 3c   ..o.....S..'..-<
0010  f2 e0 e9 54 00 00 00 00 05 81 02 00 8d ff ff ff   ...T............
0020  80 00 00 00 00 00 00 00 00 00 00 00 00 00 00 00   ................
0030  00 00 00 00 00 00 00 00 04 02 00 00 00 00 00 00   ................

No.     Time           Source                Destination           Protocol Length Info
    409 1.485682000    host                  39.1                  USB      64     URB_BULK in

Frame 409: 64 bytes on wire (512 bits), 64 bytes captured (512 bits) on interface 0
    Interface id: 0
    Encapsulation type: USB packets with Linux header and padding (115)
    Arrival Time: Feb 22, 2015 16:00:18.164101000 SAST
    [Time shift for this packet: 0.000000000 seconds]
    Epoch Time: 1424613618.164101000 seconds
    [Time delta from previous captured frame: 0.000000000 seconds]
    [Time delta from previous displayed frame: 0.000000000 seconds]
    [Time since reference or first frame: 1.485682000 seconds]
    Frame Number: 409
    Frame Length: 64 bytes (512 bits)
    Capture Length: 64 bytes (512 bits)
    [Frame is marked: False]
    [Frame is ignored: False]
    [Protocols in frame: usb]
USB URB
    URB id: 0xffff8801c36f8840
    URB type: URB_SUBMIT ('S')
    URB transfer type: URB_BULK (0x03)
    Endpoint: 0x81, Direction: IN
        1... .... = Direction: IN (1)
        .000 0001 = Endpoint value: 1
    Device: 39
    URB bus id: 2
    Device setup request: not relevant ('-')
    Data: not present ('<')
    URB sec: 1424613618
    URB usec: 164101
    URB status: Operation now in progress (-EINPROGRESS) (-115)
    URB length [bytes]: 128
    Data length [bytes]: 0
    [bInterfaceClass: CDC-Data (0x0a)]

0000  40 88 6f c3 01 88 ff ff 53 03 81 27 02 00 2d 3c   @.o.....S..'..-<
0010  f2 e0 e9 54 00 00 00 00 05 81 02 00 8d ff ff ff   ...T............
0020  80 00 00 00 00 00 00 00 00 00 00 00 00 00 00 00   ................
0030  00 00 00 00 00 00 00 00 04 02 00 00 00 00 00 00   ................

No.     Time           Source                Destination           Protocol Length Info
    410 1.485683000    host                  39.1                  USB      64     URB_BULK in

Frame 410: 64 bytes on wire (512 bits), 64 bytes captured (512 bits) on interface 0
    Interface id: 0
    Encapsulation type: USB packets with Linux header and padding (115)
    Arrival Time: Feb 22, 2015 16:00:18.164102000 SAST
    [Time shift for this packet: 0.000000000 seconds]
    Epoch Time: 1424613618.164102000 seconds
    [Time delta from previous captured frame: 0.000001000 seconds]
    [Time delta from previous displayed frame: 0.000001000 seconds]
    [Time since reference or first frame: 1.485683000 seconds]
    Frame Number: 410
    Frame Length: 64 bytes (512 bits)
    Capture Length: 64 bytes (512 bits)
    [Frame is marked: False]
    [Frame is ignored: False]
    [Protocols in frame: usb]
USB URB
    URB id: 0xffff8801c36f8000
    URB type: URB_SUBMIT ('S')
    URB transfer type: URB_BULK (0x03)
    Endpoint: 0x81, Direction: IN
        1... .... = Direction: IN (1)
        .000 0001 = Endpoint value: 1
    Device: 39
    URB bus id: 2
    Device setup request: not relevant ('-')
    Data: not present ('<')
    URB sec: 1424613618
    URB usec: 164102
    URB status: Operation now in progress (-EINPROGRESS) (-115)
    URB length [bytes]: 128
    Data length [bytes]: 0
    [bInterfaceClass: CDC-Data (0x0a)]

0000  00 80 6f c3 01 88 ff ff 53 03 81 27 02 00 2d 3c   ..o.....S..'..-<
0010  f2 e0 e9 54 00 00 00 00 06 81 02 00 8d ff ff ff   ...T............
0020  80 00 00 00 00 00 00 00 00 00 00 00 00 00 00 00   ................
0030  00 00 00 00 00 00 00 00 04 02 00 00 00 00 00 00   ................

No.     Time           Source                Destination           Protocol Length Info
    411 1.485683000    host                  39.1                  USB      64     URB_BULK in

Frame 411: 64 bytes on wire (512 bits), 64 bytes captured (512 bits) on interface 0
    Interface id: 0
    Encapsulation type: USB packets with Linux header and padding (115)
    Arrival Time: Feb 22, 2015 16:00:18.164102000 SAST
    [Time shift for this packet: 0.000000000 seconds]
    Epoch Time: 1424613618.164102000 seconds
    [Time delta from previous captured frame: 0.000000000 seconds]
    [Time delta from previous displayed frame: 0.000000000 seconds]
    [Time since reference or first frame: 1.485683000 seconds]
    Frame Number: 411
    Frame Length: 64 bytes (512 bits)
    Capture Length: 64 bytes (512 bits)
    [Frame is marked: False]
    [Frame is ignored: False]
    [Protocols in frame: usb]
USB URB
    URB id: 0xffff8801c36f80c0
    URB type: URB_SUBMIT ('S')
    URB transfer type: URB_BULK (0x03)
    Endpoint: 0x81, Direction: IN
        1... .... = Direction: IN (1)
        .000 0001 = Endpoint value: 1
    Device: 39
    URB bus id: 2
    Device setup request: not relevant ('-')
    Data: not present ('<')
    URB sec: 1424613618
    URB usec: 164102
    URB status: Operation now in progress (-EINPROGRESS) (-115)
    URB length [bytes]: 128
    Data length [bytes]: 0
    [bInterfaceClass: CDC-Data (0x0a)]

0000  c0 80 6f c3 01 88 ff ff 53 03 81 27 02 00 2d 3c   ..o.....S..'..-<
0010  f2 e0 e9 54 00 00 00 00 06 81 02 00 8d ff ff ff   ...T............
0020  80 00 00 00 00 00 00 00 00 00 00 00 00 00 00 00   ................
0030  00 00 00 00 00 00 00 00 04 02 00 00 00 00 00 00   ................

No.     Time           Source                Destination           Protocol Length Info
    412 1.485684000    host                  39.1                  USB      64     URB_BULK in

Frame 412: 64 bytes on wire (512 bits), 64 bytes captured (512 bits) on interface 0
    Interface id: 0
    Encapsulation type: USB packets with Linux header and padding (115)
    Arrival Time: Feb 22, 2015 16:00:18.164103000 SAST
    [Time shift for this packet: 0.000000000 seconds]
    Epoch Time: 1424613618.164103000 seconds
    [Time delta from previous captured frame: 0.000001000 seconds]
    [Time delta from previous displayed frame: 0.000001000 seconds]
    [Time since reference or first frame: 1.485684000 seconds]
    Frame Number: 412
    Frame Length: 64 bytes (512 bits)
    Capture Length: 64 bytes (512 bits)
    [Frame is marked: False]
    [Frame is ignored: False]
    [Protocols in frame: usb]
USB URB
    URB id: 0xffff8801c36f89c0
    URB type: URB_SUBMIT ('S')
    URB transfer type: URB_BULK (0x03)
    Endpoint: 0x81, Direction: IN
        1... .... = Direction: IN (1)
        .000 0001 = Endpoint value: 1
    Device: 39
    URB bus id: 2
    Device setup request: not relevant ('-')
    Data: not present ('<')
    URB sec: 1424613618
    URB usec: 164103
    URB status: Operation now in progress (-EINPROGRESS) (-115)
    URB length [bytes]: 128
    Data length [bytes]: 0
    [bInterfaceClass: CDC-Data (0x0a)]

0000  c0 89 6f c3 01 88 ff ff 53 03 81 27 02 00 2d 3c   ..o.....S..'..-<
0010  f2 e0 e9 54 00 00 00 00 07 81 02 00 8d ff ff ff   ...T............
0020  80 00 00 00 00 00 00 00 00 00 00 00 00 00 00 00   ................
0030  00 00 00 00 00 00 00 00 04 02 00 00 00 00 00 00   ................

No.     Time           Source                Destination           Protocol Length Info
    413 1.485684000    host                  39.1                  USB      64     URB_BULK in

Frame 413: 64 bytes on wire (512 bits), 64 bytes captured (512 bits) on interface 0
    Interface id: 0
    Encapsulation type: USB packets with Linux header and padding (115)
    Arrival Time: Feb 22, 2015 16:00:18.164103000 SAST
    [Time shift for this packet: 0.000000000 seconds]
    Epoch Time: 1424613618.164103000 seconds
    [Time delta from previous captured frame: 0.000000000 seconds]
    [Time delta from previous displayed frame: 0.000000000 seconds]
    [Time since reference or first frame: 1.485684000 seconds]
    Frame Number: 413
    Frame Length: 64 bytes (512 bits)
    Capture Length: 64 bytes (512 bits)
    [Frame is marked: False]
    [Frame is ignored: False]
    [Protocols in frame: usb]
USB URB
    URB id: 0xffff8801c36f8e40
    URB type: URB_SUBMIT ('S')
    URB transfer type: URB_BULK (0x03)
    Endpoint: 0x81, Direction: IN
        1... .... = Direction: IN (1)
        .000 0001 = Endpoint value: 1
    Device: 39
    URB bus id: 2
    Device setup request: not relevant ('-')
    Data: not present ('<')
    URB sec: 1424613618
    URB usec: 164103
    URB status: Operation now in progress (-EINPROGRESS) (-115)
    URB length [bytes]: 128
    Data length [bytes]: 0
    [bInterfaceClass: CDC-Data (0x0a)]

0000  40 8e 6f c3 01 88 ff ff 53 03 81 27 02 00 2d 3c   @.o.....S..'..-<
0010  f2 e0 e9 54 00 00 00 00 07 81 02 00 8d ff ff ff   ...T............
0020  80 00 00 00 00 00 00 00 00 00 00 00 00 00 00 00   ................
0030  00 00 00 00 00 00 00 00 04 02 00 00 00 00 00 00   ................

No.     Time           Source                Destination           Protocol Length Info
    414 1.485685000    host                  39.1                  USB      64     URB_BULK in

Frame 414: 64 bytes on wire (512 bits), 64 bytes captured (512 bits) on interface 0
    Interface id: 0
    Encapsulation type: USB packets with Linux header and padding (115)
    Arrival Time: Feb 22, 2015 16:00:18.164104000 SAST
    [Time shift for this packet: 0.000000000 seconds]
    Epoch Time: 1424613618.164104000 seconds
    [Time delta from previous captured frame: 0.000001000 seconds]
    [Time delta from previous displayed frame: 0.000001000 seconds]
    [Time since reference or first frame: 1.485685000 seconds]
    Frame Number: 414
    Frame Length: 64 bytes (512 bits)
    Capture Length: 64 bytes (512 bits)
    [Frame is marked: False]
    [Frame is ignored: False]
    [Protocols in frame: usb]
USB URB
    URB id: 0xffff8801c36f8300
    URB type: URB_SUBMIT ('S')
    URB transfer type: URB_BULK (0x03)
    Endpoint: 0x81, Direction: IN
        1... .... = Direction: IN (1)
        .000 0001 = Endpoint value: 1
    Device: 39
    URB bus id: 2
    Device setup request: not relevant ('-')
    Data: not present ('<')
    URB sec: 1424613618
    URB usec: 164104
    URB status: Operation now in progress (-EINPROGRESS) (-115)
    URB length [bytes]: 128
    Data length [bytes]: 0
    [bInterfaceClass: CDC-Data (0x0a)]

0000  00 83 6f c3 01 88 ff ff 53 03 81 27 02 00 2d 3c   ..o.....S..'..-<
0010  f2 e0 e9 54 00 00 00 00 08 81 02 00 8d ff ff ff   ...T............
0020  80 00 00 00 00 00 00 00 00 00 00 00 00 00 00 00   ................
0030  00 00 00 00 00 00 00 00 04 02 00 00 00 00 00 00   ................

No.     Time           Source                Destination           Protocol Length Info
    415 1.485685000    host                  39.1                  USB      64     URB_BULK in

Frame 415: 64 bytes on wire (512 bits), 64 bytes captured (512 bits) on interface 0
    Interface id: 0
    Encapsulation type: USB packets with Linux header and padding (115)
    Arrival Time: Feb 22, 2015 16:00:18.164104000 SAST
    [Time shift for this packet: 0.000000000 seconds]
    Epoch Time: 1424613618.164104000 seconds
    [Time delta from previous captured frame: 0.000000000 seconds]
    [Time delta from previous displayed frame: 0.000000000 seconds]
    [Time since reference or first frame: 1.485685000 seconds]
    Frame Number: 415
    Frame Length: 64 bytes (512 bits)
    Capture Length: 64 bytes (512 bits)
    [Frame is marked: False]
    [Frame is ignored: False]
    [Protocols in frame: usb]
USB URB
    URB id: 0xffff8801c36f8c00
    URB type: URB_SUBMIT ('S')
    URB transfer type: URB_BULK (0x03)
    Endpoint: 0x81, Direction: IN
        1... .... = Direction: IN (1)
        .000 0001 = Endpoint value: 1
    Device: 39
    URB bus id: 2
    Device setup request: not relevant ('-')
    Data: not present ('<')
    URB sec: 1424613618
    URB usec: 164104
    URB status: Operation now in progress (-EINPROGRESS) (-115)
    URB length [bytes]: 128
    Data length [bytes]: 0
    [bInterfaceClass: CDC-Data (0x0a)]

0000  00 8c 6f c3 01 88 ff ff 53 03 81 27 02 00 2d 3c   ..o.....S..'..-<
0010  f2 e0 e9 54 00 00 00 00 08 81 02 00 8d ff ff ff   ...T............
0020  80 00 00 00 00 00 00 00 00 00 00 00 00 00 00 00   ................
0030  00 00 00 00 00 00 00 00 04 02 00 00 00 00 00 00   ................

No.     Time           Source                Destination           Protocol Length Info
    416 1.485686000    host                  39.1                  USB      64     URB_BULK in

Frame 416: 64 bytes on wire (512 bits), 64 bytes captured (512 bits) on interface 0
    Interface id: 0
    Encapsulation type: USB packets with Linux header and padding (115)
    Arrival Time: Feb 22, 2015 16:00:18.164105000 SAST
    [Time shift for this packet: 0.000000000 seconds]
    Epoch Time: 1424613618.164105000 seconds
    [Time delta from previous captured frame: 0.000001000 seconds]
    [Time delta from previous displayed frame: 0.000001000 seconds]
    [Time since reference or first frame: 1.485686000 seconds]
    Frame Number: 416
    Frame Length: 64 bytes (512 bits)
    Capture Length: 64 bytes (512 bits)
    [Frame is marked: False]
    [Frame is ignored: False]
    [Protocols in frame: usb]
USB URB
    URB id: 0xffff8802c1cd1b40
    URB type: URB_SUBMIT ('S')
    URB transfer type: URB_BULK (0x03)
    Endpoint: 0x81, Direction: IN
        1... .... = Direction: IN (1)
        .000 0001 = Endpoint value: 1
    Device: 39
    URB bus id: 2
    Device setup request: not relevant ('-')
    Data: not present ('<')
    URB sec: 1424613618
    URB usec: 164105
    URB status: Operation now in progress (-EINPROGRESS) (-115)
    URB length [bytes]: 128
    Data length [bytes]: 0
    [bInterfaceClass: CDC-Data (0x0a)]

0000  40 1b cd c1 02 88 ff ff 53 03 81 27 02 00 2d 3c   @.......S..'..-<
0010  f2 e0 e9 54 00 00 00 00 09 81 02 00 8d ff ff ff   ...T............
0020  80 00 00 00 00 00 00 00 00 00 00 00 00 00 00 00   ................
0030  00 00 00 00 00 00 00 00 04 02 00 00 00 00 00 00   ................

No.     Time           Source                Destination           Protocol Length Info
    417 1.485686000    host                  39.1                  USB      64     URB_BULK in

Frame 417: 64 bytes on wire (512 bits), 64 bytes captured (512 bits) on interface 0
    Interface id: 0
    Encapsulation type: USB packets with Linux header and padding (115)
    Arrival Time: Feb 22, 2015 16:00:18.164105000 SAST
    [Time shift for this packet: 0.000000000 seconds]
    Epoch Time: 1424613618.164105000 seconds
    [Time delta from previous captured frame: 0.000000000 seconds]
    [Time delta from previous displayed frame: 0.000000000 seconds]
    [Time since reference or first frame: 1.485686000 seconds]
    Frame Number: 417
    Frame Length: 64 bytes (512 bits)
    Capture Length: 64 bytes (512 bits)
    [Frame is marked: False]
    [Frame is ignored: False]
    [Protocols in frame: usb]
USB URB
    URB id: 0xffff8802c1cd1a80
    URB type: URB_SUBMIT ('S')
    URB transfer type: URB_BULK (0x03)
    Endpoint: 0x81, Direction: IN
        1... .... = Direction: IN (1)
        .000 0001 = Endpoint value: 1
    Device: 39
    URB bus id: 2
    Device setup request: not relevant ('-')
    Data: not present ('<')
    URB sec: 1424613618
    URB usec: 164105
    URB status: Operation now in progress (-EINPROGRESS) (-115)
    URB length [bytes]: 128
    Data length [bytes]: 0
    [bInterfaceClass: CDC-Data (0x0a)]

0000  80 1a cd c1 02 88 ff ff 53 03 81 27 02 00 2d 3c   ........S..'..-<
0010  f2 e0 e9 54 00 00 00 00 09 81 02 00 8d ff ff ff   ...T............
0020  80 00 00 00 00 00 00 00 00 00 00 00 00 00 00 00   ................
0030  00 00 00 00 00 00 00 00 04 02 00 00 00 00 00 00   ................

No.     Time           Source                Destination           Protocol Length Info
    418 1.485695000    host                  39.0                  USB      71     URB_CONTROL out

Frame 418: 71 bytes on wire (568 bits), 71 bytes captured (568 bits) on interface 0
    Interface id: 0
    Encapsulation type: USB packets with Linux header and padding (115)
    Arrival Time: Feb 22, 2015 16:00:18.164114000 SAST
    [Time shift for this packet: 0.000000000 seconds]
    Epoch Time: 1424613618.164114000 seconds
    [Time delta from previous captured frame: 0.000009000 seconds]
    [Time delta from previous displayed frame: 0.000009000 seconds]
    [Time since reference or first frame: 1.485695000 seconds]
    Frame Number: 418
    Frame Length: 71 bytes (568 bits)
    Capture Length: 71 bytes (568 bits)
    [Frame is marked: False]
    [Frame is ignored: False]
    [Protocols in frame: usb]
USB URB
    URB id: 0xffff8801a8d2ec00
    URB type: URB_SUBMIT ('S')
    URB transfer type: URB_CONTROL (0x02)
    Endpoint: 0x00, Direction: OUT
        0... .... = Direction: OUT (0)
        .000 0000 = Endpoint value: 0
    Device: 39
    URB bus id: 2
    Device setup request: relevant (0)
    Data: present (0)
    URB sec: 1424613618
    URB usec: 164114
    URB status: Operation now in progress (-EINPROGRESS) (-115)
    URB length [bytes]: 7
    Data length [bytes]: 7
    [Response in: 419]
    [bInterfaceClass: Communications and CDC Control (0x02)]
URB setup
    bmRequestType: 0x21
        0... .... = Direction: Host-to-device
        .01. .... = Type: Class (0x01)
        ...0 0001 = Recipient: Interface (0x01)
    bRequest: 32
    wValue: 0x0000
    wIndex: 0
    wLength: 7
Leftover Capture Data: 00e10000000008

0000  00 ec d2 a8 01 88 ff ff 53 02 00 27 02 00 00 00   ........S..'....
0010  f2 e0 e9 54 00 00 00 00 12 81 02 00 8d ff ff ff   ...T............
0020  07 00 00 00 07 00 00 00 21 20 00 00 00 00 07 00   ........! ......
0030  00 00 00 00 00 00 00 00 00 00 00 00 00 00 00 00   ................
0040  00 e1 00 00 00 00 08                              .......

No.     Time           Source                Destination           Protocol Length Info
    419 1.485921000    39.0                  host                  USB      64     URB_CONTROL out

Frame 419: 64 bytes on wire (512 bits), 64 bytes captured (512 bits) on interface 0
    Interface id: 0
    Encapsulation type: USB packets with Linux header and padding (115)
    Arrival Time: Feb 22, 2015 16:00:18.164340000 SAST
    [Time shift for this packet: 0.000000000 seconds]
    Epoch Time: 1424613618.164340000 seconds
    [Time delta from previous captured frame: 0.000226000 seconds]
    [Time delta from previous displayed frame: 0.000226000 seconds]
    [Time since reference or first frame: 1.485921000 seconds]
    Frame Number: 419
    Frame Length: 64 bytes (512 bits)
    Capture Length: 64 bytes (512 bits)
    [Frame is marked: False]
    [Frame is ignored: False]
    [Protocols in frame: usb]
USB URB
    URB id: 0xffff8801a8d2ec00
    URB type: URB_COMPLETE ('C')
    URB transfer type: URB_CONTROL (0x02)
    Endpoint: 0x00, Direction: OUT
        0... .... = Direction: OUT (0)
        .000 0000 = Endpoint value: 0
    Device: 39
    URB bus id: 2
    Device setup request: not relevant ('-')
    Data: not present ('>')
    URB sec: 1424613618
    URB usec: 164340
    URB status: Success (0)
    URB length [bytes]: 7
    Data length [bytes]: 0
    [Request in: 418]
    [Time from request: 0.000226000 seconds]
    [bInterfaceClass: Communications and CDC Control (0x02)]

0000  00 ec d2 a8 01 88 ff ff 43 02 00 27 02 00 2d 3e   ........C..'..->
0010  f2 e0 e9 54 00 00 00 00 f4 81 02 00 00 00 00 00   ...T............
0020  07 00 00 00 00 00 00 00 00 00 00 00 00 00 00 00   ................
0030  00 00 00 00 00 00 00 00 00 00 00 00 00 00 00 00   ................

No.     Time           Source                Destination           Protocol Length Info
    420 1.485961000    host                  39.0                  USB      64     URB_CONTROL out

Frame 420: 64 bytes on wire (512 bits), 64 bytes captured (512 bits) on interface 0
    Interface id: 0
    Encapsulation type: USB packets with Linux header and padding (115)
    Arrival Time: Feb 22, 2015 16:00:18.164380000 SAST
    [Time shift for this packet: 0.000000000 seconds]
    Epoch Time: 1424613618.164380000 seconds
    [Time delta from previous captured frame: 0.000040000 seconds]
    [Time delta from previous displayed frame: 0.000040000 seconds]
    [Time since reference or first frame: 1.485961000 seconds]
    Frame Number: 420
    Frame Length: 64 bytes (512 bits)
    Capture Length: 64 bytes (512 bits)
    [Frame is marked: False]
    [Frame is ignored: False]
    [Protocols in frame: usb]
USB URB
    URB id: 0xffff8801a8d2ec00
    URB type: URB_SUBMIT ('S')
    URB transfer type: URB_CONTROL (0x02)
    Endpoint: 0x00, Direction: OUT
        0... .... = Direction: OUT (0)
        .000 0000 = Endpoint value: 0
    Device: 39
    URB bus id: 2
    Device setup request: relevant (0)
    Data: present (0)
    URB sec: 1424613618
    URB usec: 164380
    URB status: Operation now in progress (-EINPROGRESS) (-115)
    URB length [bytes]: 0
    Data length [bytes]: 0
    [Response in: 421]
    [bInterfaceClass: Communications and CDC Control (0x02)]
URB setup
    bmRequestType: 0x21
        0... .... = Direction: Host-to-device
        .01. .... = Type: Class (0x01)
        ...0 0001 = Recipient: Interface (0x01)
    bRequest: 34
    wValue: 0x0002
    wIndex: 0
    wLength: 0

0000  00 ec d2 a8 01 88 ff ff 53 02 00 27 02 00 00 00   ........S..'....
0010  f2 e0 e9 54 00 00 00 00 1c 82 02 00 8d ff ff ff   ...T............
0020  00 00 00 00 00 00 00 00 21 22 02 00 00 00 00 00   ........!"......
0030  00 00 00 00 00 00 00 00 00 00 00 00 00 00 00 00   ................

No.     Time           Source                Destination           Protocol Length Info
    421 1.486042000    39.0                  host                  USB      64     URB_CONTROL out

Frame 421: 64 bytes on wire (512 bits), 64 bytes captured (512 bits) on interface 0
    Interface id: 0
    Encapsulation type: USB packets with Linux header and padding (115)
    Arrival Time: Feb 22, 2015 16:00:18.164461000 SAST
    [Time shift for this packet: 0.000000000 seconds]
    Epoch Time: 1424613618.164461000 seconds
    [Time delta from previous captured frame: 0.000081000 seconds]
    [Time delta from previous displayed frame: 0.000081000 seconds]
    [Time since reference or first frame: 1.486042000 seconds]
    Frame Number: 421
    Frame Length: 64 bytes (512 bits)
    Capture Length: 64 bytes (512 bits)
    [Frame is marked: False]
    [Frame is ignored: False]
    [Protocols in frame: usb]
USB URB
    URB id: 0xffff8801a8d2ec00
    URB type: URB_COMPLETE ('C')
    URB transfer type: URB_CONTROL (0x02)
    Endpoint: 0x00, Direction: OUT
        0... .... = Direction: OUT (0)
        .000 0000 = Endpoint value: 0
    Device: 39
    URB bus id: 2
    Device setup request: not relevant ('-')
    Data: not present ('>')
    URB sec: 1424613618
    URB usec: 164461
    URB status: Success (0)
    URB length [bytes]: 0
    Data length [bytes]: 0
    [Request in: 420]
    [Time from request: 0.000081000 seconds]
    [bInterfaceClass: Communications and CDC Control (0x02)]

0000  00 ec d2 a8 01 88 ff ff 43 02 00 27 02 00 2d 3e   ........C..'..->
0010  f2 e0 e9 54 00 00 00 00 6d 82 02 00 00 00 00 00   ...T....m.......
0020  00 00 00 00 00 00 00 00 00 00 00 00 00 00 00 00   ................
0030  00 00 00 00 00 00 00 00 00 00 00 00 00 00 00 00   ................

No.     Time           Source                Destination           Protocol Length Info
    426 1.586196000    host                  39.0                  USB      64     URB_CONTROL out

Frame 426: 64 bytes on wire (512 bits), 64 bytes captured (512 bits) on interface 0
    Interface id: 0
    Encapsulation type: USB packets with Linux header and padding (115)
    Arrival Time: Feb 22, 2015 16:00:18.264615000 SAST
    [Time shift for this packet: 0.000000000 seconds]
    Epoch Time: 1424613618.264615000 seconds
    [Time delta from previous captured frame: 0.008186000 seconds]
    [Time delta from previous displayed frame: 0.100154000 seconds]
    [Time since reference or first frame: 1.586196000 seconds]
    Frame Number: 426
    Frame Length: 64 bytes (512 bits)
    Capture Length: 64 bytes (512 bits)
    [Frame is marked: False]
    [Frame is ignored: False]
    [Protocols in frame: usb]
USB URB
    URB id: 0xffff8801a8d2e000
    URB type: URB_SUBMIT ('S')
    URB transfer type: URB_CONTROL (0x02)
    Endpoint: 0x00, Direction: OUT
        0... .... = Direction: OUT (0)
        .000 0000 = Endpoint value: 0
    Device: 39
    URB bus id: 2
    Device setup request: relevant (0)
    Data: present (0)
    URB sec: 1424613618
    URB usec: 264615
    URB status: Operation now in progress (-EINPROGRESS) (-115)
    URB length [bytes]: 0
    Data length [bytes]: 0
    [Response in: 427]
    [bInterfaceClass: Communications and CDC Control (0x02)]
URB setup
    bmRequestType: 0x21
        0... .... = Direction: Host-to-device
        .01. .... = Type: Class (0x01)
        ...0 0001 = Recipient: Interface (0x01)
    bRequest: 34
    wValue: 0x0003
    wIndex: 0
    wLength: 0

0000  00 e0 d2 a8 01 88 ff ff 53 02 00 27 02 00 00 00   ........S..'....
0010  f2 e0 e9 54 00 00 00 00 a7 09 04 00 8d ff ff ff   ...T............
0020  00 00 00 00 00 00 00 00 21 22 03 00 00 00 00 00   ........!"......
0030  00 00 00 00 00 00 00 00 00 00 00 00 00 00 00 00   ................

No.     Time           Source                Destination           Protocol Length Info
    427 1.586357000    39.0                  host                  USB      64     URB_CONTROL out

Frame 427: 64 bytes on wire (512 bits), 64 bytes captured (512 bits) on interface 0
    Interface id: 0
    Encapsulation type: USB packets with Linux header and padding (115)
    Arrival Time: Feb 22, 2015 16:00:18.264776000 SAST
    [Time shift for this packet: 0.000000000 seconds]
    Epoch Time: 1424613618.264776000 seconds
    [Time delta from previous captured frame: 0.000161000 seconds]
    [Time delta from previous displayed frame: 0.000161000 seconds]
    [Time since reference or first frame: 1.586357000 seconds]
    Frame Number: 427
    Frame Length: 64 bytes (512 bits)
    Capture Length: 64 bytes (512 bits)
    [Frame is marked: False]
    [Frame is ignored: False]
    [Protocols in frame: usb]
USB URB
    URB id: 0xffff8801a8d2e000
    URB type: URB_COMPLETE ('C')
    URB transfer type: URB_CONTROL (0x02)
    Endpoint: 0x00, Direction: OUT
        0... .... = Direction: OUT (0)
        .000 0000 = Endpoint value: 0
    Device: 39
    URB bus id: 2
    Device setup request: not relevant ('-')
    Data: not present ('>')
    URB sec: 1424613618
    URB usec: 264776
    URB status: Success (0)
    URB length [bytes]: 0
    Data length [bytes]: 0
    [Request in: 426]
    [Time from request: 0.000161000 seconds]
    [bInterfaceClass: Communications and CDC Control (0x02)]

0000  00 e0 d2 a8 01 88 ff ff 43 02 00 27 02 00 2d 3e   ........C..'..->
0010  f2 e0 e9 54 00 00 00 00 48 0a 04 00 00 00 00 00   ...T....H.......
0020  00 00 00 00 00 00 00 00 00 00 00 00 00 00 00 00   ................
0030  00 00 00 00 00 00 00 00 00 00 00 00 00 00 00 00   ................

No.     Time           Source                Destination           Protocol Length Info
    428 1.586452000    host                  39.1                  Ethernet 65     URB_BULK out[Malformed Packet]

Frame 428: 65 bytes on wire (520 bits), 65 bytes captured (520 bits) on interface 0
    Interface id: 0
    Encapsulation type: USB packets with Linux header and padding (115)
    Arrival Time: Feb 22, 2015 16:00:18.264871000 SAST
    [Time shift for this packet: 0.000000000 seconds]
    Epoch Time: 1424613618.264871000 seconds
    [Time delta from previous captured frame: 0.000095000 seconds]
    [Time delta from previous displayed frame: 0.000095000 seconds]
    [Time since reference or first frame: 1.586452000 seconds]
    Frame Number: 428
    Frame Length: 65 bytes (520 bits)
    Capture Length: 65 bytes (520 bits)
    [Frame is marked: False]
    [Frame is ignored: False]
    [Protocols in frame: usb:eth]
USB URB
    URB id: 0xffff8802c1cd1cc0
    URB type: URB_SUBMIT ('S')
    URB transfer type: URB_BULK (0x03)
    Endpoint: 0x01, Direction: OUT
        0... .... = Direction: OUT (0)
        .000 0001 = Endpoint value: 1
    Device: 39
    URB bus id: 2
    Device setup request: not relevant ('-')
    Data: present (0)
    URB sec: 1424613618
    URB usec: 264871
    URB status: Operation now in progress (-EINPROGRESS) (-115)
    URB length [bytes]: 1
    Data length [bytes]: 1
    [Response in: 429]
    [bInterfaceClass: CDC-Data (0x0a)]
[Malformed Packet: Ethernet]
    [Expert Info (Error/Malformed): Malformed Packet (Exception occurred)]
        [Message: Malformed Packet (Exception occurred)]
        [Severity level: Error]
        [Group: Malformed]

0000  c0 1c cd c1 02 88 ff ff 53 03 01 27 02 00 2d 00   ........S..'..-.
0010  f2 e0 e9 54 00 00 00 00 a7 0a 04 00 8d ff ff ff   ...T............
0020  01 00 00 00 01 00 00 00 00 00 00 00 00 00 00 00   ................
0030  00 00 00 00 00 00 00 00 04 00 00 00 00 00 00 00   ................
0040  41                                                A

No.     Time           Source                Destination           Protocol Length Info
    429 1.586583000    39.1                  host                  USB      64     URB_BULK out

Frame 429: 64 bytes on wire (512 bits), 64 bytes captured (512 bits) on interface 0
    Interface id: 0
    Encapsulation type: USB packets with Linux header and padding (115)
    Arrival Time: Feb 22, 2015 16:00:18.265002000 SAST
    [Time shift for this packet: 0.000000000 seconds]
    Epoch Time: 1424613618.265002000 seconds
    [Time delta from previous captured frame: 0.000131000 seconds]
    [Time delta from previous displayed frame: 0.000131000 seconds]
    [Time since reference or first frame: 1.586583000 seconds]
    Frame Number: 429
    Frame Length: 64 bytes (512 bits)
    Capture Length: 64 bytes (512 bits)
    [Frame is marked: False]
    [Frame is ignored: False]
    [Protocols in frame: usb]
USB URB
    URB id: 0xffff8802c1cd1cc0
    URB type: URB_COMPLETE ('C')
    URB transfer type: URB_BULK (0x03)
    Endpoint: 0x01, Direction: OUT
        0... .... = Direction: OUT (0)
        .000 0001 = Endpoint value: 1
    Device: 39
    URB bus id: 2
    Device setup request: not relevant ('-')
    Data: not present ('>')
    URB sec: 1424613618
    URB usec: 265002
    URB status: Success (0)
    URB length [bytes]: 1
    Data length [bytes]: 0
    [Request in: 428]
    [Time from request: 0.000131000 seconds]
    [bInterfaceClass: CDC-Data (0x0a)]

0000  c0 1c cd c1 02 88 ff ff 43 03 01 27 02 00 2d 3e   ........C..'..->
0010  f2 e0 e9 54 00 00 00 00 2a 0b 04 00 00 00 00 00   ...T....*.......
0020  01 00 00 00 00 00 00 00 00 00 00 00 00 00 00 00   ................
0030  00 00 00 00 00 00 00 00 04 00 00 00 00 00 00 00   ................

No.     Time           Source                Destination           Protocol Length Info
    434 1.686612000    host                  39.1                  Ethernet 65     URB_BULK out[Malformed Packet]

Frame 434: 65 bytes on wire (520 bits), 65 bytes captured (520 bits) on interface 0
    Interface id: 0
    Encapsulation type: USB packets with Linux header and padding (115)
    Arrival Time: Feb 22, 2015 16:00:18.365031000 SAST
    [Time shift for this packet: 0.000000000 seconds]
    Epoch Time: 1424613618.365031000 seconds
    [Time delta from previous captured frame: 0.076605000 seconds]
    [Time delta from previous displayed frame: 0.100029000 seconds]
    [Time since reference or first frame: 1.686612000 seconds]
    Frame Number: 434
    Frame Length: 65 bytes (520 bits)
    Capture Length: 65 bytes (520 bits)
    [Frame is marked: False]
    [Frame is ignored: False]
    [Protocols in frame: usb:eth]
USB URB
    URB id: 0xffff8802c1cd1cc0
    URB type: URB_SUBMIT ('S')
    URB transfer type: URB_BULK (0x03)
    Endpoint: 0x01, Direction: OUT
        0... .... = Direction: OUT (0)
        .000 0001 = Endpoint value: 1
    Device: 39
    URB bus id: 2
    Device setup request: not relevant ('-')
    Data: present (0)
    URB sec: 1424613618
    URB usec: 365031
    URB status: Operation now in progress (-EINPROGRESS) (-115)
    URB length [bytes]: 1
    Data length [bytes]: 1
    [bInterfaceClass: CDC-Data (0x0a)]
[Malformed Packet: Ethernet]
    [Expert Info (Error/Malformed): Malformed Packet (Exception occurred)]
        [Message: Malformed Packet (Exception occurred)]
        [Severity level: Error]
        [Group: Malformed]

0000  c0 1c cd c1 02 88 ff ff 53 03 01 27 02 00 2d 00   ........S..'..-.
0010  f2 e0 e9 54 00 00 00 00 e7 91 05 00 8d ff ff ff   ...T............
0020  01 00 00 00 01 00 00 00 00 00 00 00 00 00 00 00   ................
0030  00 00 00 00 00 00 00 00 04 00 00 00 00 00 00 00   ................
0040  54                                                T

No.     Time           Source                Destination           Protocol Length Info
    435 1.786768000    host                  39.1                  Ethernet 65     URB_BULK out[Malformed Packet]

Frame 435: 65 bytes on wire (520 bits), 65 bytes captured (520 bits) on interface 0
    Interface id: 0
    Encapsulation type: USB packets with Linux header and padding (115)
    Arrival Time: Feb 22, 2015 16:00:18.465187000 SAST
    [Time shift for this packet: 0.000000000 seconds]
    Epoch Time: 1424613618.465187000 seconds
    [Time delta from previous captured frame: 0.100156000 seconds]
    [Time delta from previous displayed frame: 0.100156000 seconds]
    [Time since reference or first frame: 1.786768000 seconds]
    Frame Number: 435
    Frame Length: 65 bytes (520 bits)
    Capture Length: 65 bytes (520 bits)
    [Frame is marked: False]
    [Frame is ignored: False]
    [Protocols in frame: usb:eth]
USB URB
    URB id: 0xffff8802c1cd1540
    URB type: URB_SUBMIT ('S')
    URB transfer type: URB_BULK (0x03)
    Endpoint: 0x01, Direction: OUT
        0... .... = Direction: OUT (0)
        .000 0001 = Endpoint value: 1
    Device: 39
    URB bus id: 2
    Device setup request: not relevant ('-')
    Data: present (0)
    URB sec: 1424613618
    URB usec: 465187
    URB status: Operation now in progress (-EINPROGRESS) (-115)
    URB length [bytes]: 1
    Data length [bytes]: 1
    [Response in: 677]
    [bInterfaceClass: CDC-Data (0x0a)]
[Malformed Packet: Ethernet]
    [Expert Info (Error/Malformed): Malformed Packet (Exception occurred)]
        [Message: Malformed Packet (Exception occurred)]
        [Severity level: Error]
        [Group: Malformed]

0000  40 15 cd c1 02 88 ff ff 53 03 01 27 02 00 2d 00   @.......S..'..-.
0010  f2 e0 e9 54 00 00 00 00 23 19 07 00 8d ff ff ff   ...T....#.......
0020  01 00 00 00 01 00 00 00 00 00 00 00 00 00 00 00   ................
0030  00 00 00 00 00 00 00 00 04 00 00 00 00 00 00 00   ................
0040  0d                                                .

No.     Time           Source                Destination           Protocol Length Info
    676 4.087564000    39.1                  host                  USB      64     URB_BULK out

Frame 676: 64 bytes on wire (512 bits), 64 bytes captured (512 bits) on interface 0
    Interface id: 0
    Encapsulation type: USB packets with Linux header and padding (115)
    Arrival Time: Feb 22, 2015 16:00:20.765983000 SAST
    [Time shift for this packet: 0.000000000 seconds]
    Epoch Time: 1424613620.765983000 seconds
    [Time delta from previous captured frame: 0.037600000 seconds]
    [Time delta from previous displayed frame: 2.300796000 seconds]
    [Time since reference or first frame: 4.087564000 seconds]
    Frame Number: 676
    Frame Length: 64 bytes (512 bits)
    Capture Length: 64 bytes (512 bits)
    [Frame is marked: False]
    [Frame is ignored: False]
    [Protocols in frame: usb]
USB URB
    URB id: 0xffff8802c1cd1cc0
    URB type: URB_COMPLETE ('C')
    URB transfer type: URB_BULK (0x03)
    Endpoint: 0x01, Direction: OUT
        0... .... = Direction: OUT (0)
        .000 0001 = Endpoint value: 1
    Device: 39
    URB bus id: 2
    Device setup request: not relevant ('-')
    Data: not present ('>')
    URB sec: 1424613620
    URB usec: 765983
    URB status: Success (0)
    URB length [bytes]: 1
    Data length [bytes]: 0
    [Request in: 435]
    [Time from request: 2.300796000 seconds]
    [bInterfaceClass: CDC-Data (0x0a)]

0000  c0 1c cd c1 02 88 ff ff 43 03 01 27 02 00 2d 3e   ........C..'..->
0010  f4 e0 e9 54 00 00 00 00 1f b0 0b 00 00 00 00 00   ...T............
0020  01 00 00 00 00 00 00 00 00 00 00 00 00 00 00 00   ................
0030  00 00 00 00 00 00 00 00 04 00 00 00 00 00 00 00   ................

No.     Time           Source                Destination           Protocol Length Info
    677 4.093808000    39.1                  host                  USB      64     URB_BULK out

Frame 677: 64 bytes on wire (512 bits), 64 bytes captured (512 bits) on interface 0
    Interface id: 0
    Encapsulation type: USB packets with Linux header and padding (115)
    Arrival Time: Feb 22, 2015 16:00:20.772227000 SAST
    [Time shift for this packet: 0.000000000 seconds]
    Epoch Time: 1424613620.772227000 seconds
    [Time delta from previous captured frame: 0.006244000 seconds]
    [Time delta from previous displayed frame: 0.006244000 seconds]
    [Time since reference or first frame: 4.093808000 seconds]
    Frame Number: 677
    Frame Length: 64 bytes (512 bits)
    Capture Length: 64 bytes (512 bits)
    [Frame is marked: False]
    [Frame is ignored: False]
    [Protocols in frame: usb]
USB URB
    URB id: 0xffff8802c1cd1540
    URB type: URB_COMPLETE ('C')
    URB transfer type: URB_BULK (0x03)
    Endpoint: 0x01, Direction: OUT
        0... .... = Direction: OUT (0)
        .000 0001 = Endpoint value: 1
    Device: 39
    URB bus id: 2
    Device setup request: not relevant ('-')
    Data: not present ('>')
    URB sec: 1424613620
    URB usec: 772227
    URB status: Success (0)
    URB length [bytes]: 1
    Data length [bytes]: 0
    [Request in: 435]
    [Time from request: 2.307040000 seconds]
    [bInterfaceClass: CDC-Data (0x0a)]

0000  40 15 cd c1 02 88 ff ff 43 03 01 27 02 00 2d 3e   @.......C..'..->
0010  f4 e0 e9 54 00 00 00 00 83 c8 0b 00 00 00 00 00   ...T............
0020  01 00 00 00 00 00 00 00 00 00 00 00 00 00 00 00   ................
0030  00 00 00 00 00 00 00 00 04 00 00 00 00 00 00 00   ................

No.     Time           Source                Destination           Protocol Length Info
    804 4.669372000    host                  39.1                  Ethernet 65     URB_BULK out[Malformed Packet]

Frame 804: 65 bytes on wire (520 bits), 65 bytes captured (520 bits) on interface 0
    Interface id: 0
    Encapsulation type: USB packets with Linux header and padding (115)
    Arrival Time: Feb 22, 2015 16:00:21.347791000 SAST
    [Time shift for this packet: 0.000000000 seconds]
    Epoch Time: 1424613621.347791000 seconds
    [Time delta from previous captured frame: 0.003374000 seconds]
    [Time delta from previous displayed frame: 0.575564000 seconds]
    [Time since reference or first frame: 4.669372000 seconds]
    Frame Number: 804
    Frame Length: 65 bytes (520 bits)
    Capture Length: 65 bytes (520 bits)
    [Frame is marked: False]
    [Frame is ignored: False]
    [Protocols in frame: usb:eth]
USB URB
    URB id: 0xffff8802c1cd1cc0
    URB type: URB_SUBMIT ('S')
    URB transfer type: URB_BULK (0x03)
    Endpoint: 0x01, Direction: OUT
        0... .... = Direction: OUT (0)
        .000 0001 = Endpoint value: 1
    Device: 39
    URB bus id: 2
    Device setup request: not relevant ('-')
    Data: present (0)
    URB sec: 1424613621
    URB usec: 347791
    URB status: Operation now in progress (-EINPROGRESS) (-115)
    URB length [bytes]: 1
    Data length [bytes]: 1
    [Response in: 805]
    [bInterfaceClass: CDC-Data (0x0a)]
[Malformed Packet: Ethernet]
    [Expert Info (Error/Malformed): Malformed Packet (Exception occurred)]
        [Message: Malformed Packet (Exception occurred)]
        [Severity level: Error]
        [Group: Malformed]

0000  c0 1c cd c1 02 88 ff ff 53 03 01 27 02 00 2d 00   ........S..'..-.
0010  f5 e0 e9 54 00 00 00 00 8f 4e 05 00 8d ff ff ff   ...T.....N......
0020  01 00 00 00 01 00 00 00 00 00 00 00 00 00 00 00   ................
0030  00 00 00 00 00 00 00 00 04 00 00 00 00 00 00 00   ................
0040  41                                                A

No.     Time           Source                Destination           Protocol Length Info
    805 4.669546000    39.1                  host                  USB      64     URB_BULK out

Frame 805: 64 bytes on wire (512 bits), 64 bytes captured (512 bits) on interface 0
    Interface id: 0
    Encapsulation type: USB packets with Linux header and padding (115)
    Arrival Time: Feb 22, 2015 16:00:21.347965000 SAST
    [Time shift for this packet: 0.000000000 seconds]
    Epoch Time: 1424613621.347965000 seconds
    [Time delta from previous captured frame: 0.000174000 seconds]
    [Time delta from previous displayed frame: 0.000174000 seconds]
    [Time since reference or first frame: 4.669546000 seconds]
    Frame Number: 805
    Frame Length: 64 bytes (512 bits)
    Capture Length: 64 bytes (512 bits)
    [Frame is marked: False]
    [Frame is ignored: False]
    [Protocols in frame: usb]
USB URB
    URB id: 0xffff8802c1cd1cc0
    URB type: URB_COMPLETE ('C')
    URB transfer type: URB_BULK (0x03)
    Endpoint: 0x01, Direction: OUT
        0... .... = Direction: OUT (0)
        .000 0001 = Endpoint value: 1
    Device: 39
    URB bus id: 2
    Device setup request: not relevant ('-')
    Data: not present ('>')
    URB sec: 1424613621
    URB usec: 347965
    URB status: Success (0)
    URB length [bytes]: 1
    Data length [bytes]: 0
    [Request in: 804]
    [Time from request: 0.000174000 seconds]
    [bInterfaceClass: CDC-Data (0x0a)]

0000  c0 1c cd c1 02 88 ff ff 43 03 01 27 02 00 2d 3e   ........C..'..->
0010  f5 e0 e9 54 00 00 00 00 3d 4f 05 00 00 00 00 00   ...T....=O......
0020  01 00 00 00 00 00 00 00 00 00 00 00 00 00 00 00   ................
0030  00 00 00 00 00 00 00 00 04 00 00 00 00 00 00 00   ................

No.     Time           Source                Destination           Protocol Length Info
    826 4.769539000    host                  39.1                  Ethernet 65     URB_BULK out[Malformed Packet]

Frame 826: 65 bytes on wire (520 bits), 65 bytes captured (520 bits) on interface 0
    Interface id: 0
    Encapsulation type: USB packets with Linux header and padding (115)
    Arrival Time: Feb 22, 2015 16:00:21.447958000 SAST
    [Time shift for this packet: 0.000000000 seconds]
    Epoch Time: 1424613621.447958000 seconds
    [Time delta from previous captured frame: 0.023541000 seconds]
    [Time delta from previous displayed frame: 0.099993000 seconds]
    [Time since reference or first frame: 4.769539000 seconds]
    Frame Number: 826
    Frame Length: 65 bytes (520 bits)
    Capture Length: 65 bytes (520 bits)
    [Frame is marked: False]
    [Frame is ignored: False]
    [Protocols in frame: usb:eth]
USB URB
    URB id: 0xffff8802c1cd1cc0
    URB type: URB_SUBMIT ('S')
    URB transfer type: URB_BULK (0x03)
    Endpoint: 0x01, Direction: OUT
        0... .... = Direction: OUT (0)
        .000 0001 = Endpoint value: 1
    Device: 39
    URB bus id: 2
    Device setup request: not relevant ('-')
    Data: present (0)
    URB sec: 1424613621
    URB usec: 447958
    URB status: Operation now in progress (-EINPROGRESS) (-115)
    URB length [bytes]: 1
    Data length [bytes]: 1
    [Response in: 827]
    [bInterfaceClass: CDC-Data (0x0a)]
[Malformed Packet: Ethernet]
    [Expert Info (Error/Malformed): Malformed Packet (Exception occurred)]
        [Message: Malformed Packet (Exception occurred)]
        [Severity level: Error]
        [Group: Malformed]

0000  c0 1c cd c1 02 88 ff ff 53 03 01 27 02 00 2d 00   ........S..'..-.
0010  f5 e0 e9 54 00 00 00 00 d6 d5 06 00 8d ff ff ff   ...T............
0020  01 00 00 00 01 00 00 00 00 00 00 00 00 00 00 00   ................
0030  00 00 00 00 00 00 00 00 04 00 00 00 00 00 00 00   ................
0040  54                                                T

No.     Time           Source                Destination           Protocol Length Info
    827 4.769687000    39.1                  host                  USB      64     URB_BULK out

Frame 827: 64 bytes on wire (512 bits), 64 bytes captured (512 bits) on interface 0
    Interface id: 0
    Encapsulation type: USB packets with Linux header and padding (115)
    Arrival Time: Feb 22, 2015 16:00:21.448106000 SAST
    [Time shift for this packet: 0.000000000 seconds]
    Epoch Time: 1424613621.448106000 seconds
    [Time delta from previous captured frame: 0.000148000 seconds]
    [Time delta from previous displayed frame: 0.000148000 seconds]
    [Time since reference or first frame: 4.769687000 seconds]
    Frame Number: 827
    Frame Length: 64 bytes (512 bits)
    Capture Length: 64 bytes (512 bits)
    [Frame is marked: False]
    [Frame is ignored: False]
    [Protocols in frame: usb]
USB URB
    URB id: 0xffff8802c1cd1cc0
    URB type: URB_COMPLETE ('C')
    URB transfer type: URB_BULK (0x03)
    Endpoint: 0x01, Direction: OUT
        0... .... = Direction: OUT (0)
        .000 0001 = Endpoint value: 1
    Device: 39
    URB bus id: 2
    Device setup request: not relevant ('-')
    Data: not present ('>')
    URB sec: 1424613621
    URB usec: 448106
    URB status: Success (0)
    URB length [bytes]: 1
    Data length [bytes]: 0
    [Request in: 826]
    [Time from request: 0.000148000 seconds]
    [bInterfaceClass: CDC-Data (0x0a)]

0000  c0 1c cd c1 02 88 ff ff 43 03 01 27 02 00 2d 3e   ........C..'..->
0010  f5 e0 e9 54 00 00 00 00 6a d6 06 00 00 00 00 00   ...T....j.......
0020  01 00 00 00 00 00 00 00 00 00 00 00 00 00 00 00   ................
0030  00 00 00 00 00 00 00 00 04 00 00 00 00 00 00 00   ................

No.     Time           Source                Destination           Protocol Length Info
    846 4.869704000    host                  39.1                  Ethernet 65     URB_BULK out[Malformed Packet]

Frame 846: 65 bytes on wire (520 bits), 65 bytes captured (520 bits) on interface 0
    Interface id: 0
    Encapsulation type: USB packets with Linux header and padding (115)
    Arrival Time: Feb 22, 2015 16:00:21.548123000 SAST
    [Time shift for this packet: 0.000000000 seconds]
    Epoch Time: 1424613621.548123000 seconds
    [Time delta from previous captured frame: 0.003750000 seconds]
    [Time delta from previous displayed frame: 0.100017000 seconds]
    [Time since reference or first frame: 4.869704000 seconds]
    Frame Number: 846
    Frame Length: 65 bytes (520 bits)
    Capture Length: 65 bytes (520 bits)
    [Frame is marked: False]
    [Frame is ignored: False]
    [Protocols in frame: usb:eth]
USB URB
    URB id: 0xffff8802c1cd1cc0
    URB type: URB_SUBMIT ('S')
    URB transfer type: URB_BULK (0x03)
    Endpoint: 0x01, Direction: OUT
        0... .... = Direction: OUT (0)
        .000 0001 = Endpoint value: 1
    Device: 39
    URB bus id: 2
    Device setup request: not relevant ('-')
    Data: present (0)
    URB sec: 1424613621
    URB usec: 548123
    URB status: Operation now in progress (-EINPROGRESS) (-115)
    URB length [bytes]: 1
    Data length [bytes]: 1
    [Response in: 847]
    [bInterfaceClass: CDC-Data (0x0a)]
[Malformed Packet: Ethernet]
    [Expert Info (Error/Malformed): Malformed Packet (Exception occurred)]
        [Message: Malformed Packet (Exception occurred)]
        [Severity level: Error]
        [Group: Malformed]

0000  c0 1c cd c1 02 88 ff ff 53 03 01 27 02 00 2d 00   ........S..'..-.
0010  f5 e0 e9 54 00 00 00 00 1b 5d 08 00 8d ff ff ff   ...T.....]......
0020  01 00 00 00 01 00 00 00 00 00 00 00 00 00 00 00   ................
0030  00 00 00 00 00 00 00 00 04 00 00 00 00 00 00 00   ................
0040  0d                                                .

No.     Time           Source                Destination           Protocol Length Info
    847 4.869779000    39.1                  host                  USB      64     URB_BULK out

Frame 847: 64 bytes on wire (512 bits), 64 bytes captured (512 bits) on interface 0
    Interface id: 0
    Encapsulation type: USB packets with Linux header and padding (115)
    Arrival Time: Feb 22, 2015 16:00:21.548198000 SAST
    [Time shift for this packet: 0.000000000 seconds]
    Epoch Time: 1424613621.548198000 seconds
    [Time delta from previous captured frame: 0.000075000 seconds]
    [Time delta from previous displayed frame: 0.000075000 seconds]
    [Time since reference or first frame: 4.869779000 seconds]
    Frame Number: 847
    Frame Length: 64 bytes (512 bits)
    Capture Length: 64 bytes (512 bits)
    [Frame is marked: False]
    [Frame is ignored: False]
    [Protocols in frame: usb]
USB URB
    URB id: 0xffff8802c1cd1cc0
    URB type: URB_COMPLETE ('C')
    URB transfer type: URB_BULK (0x03)
    Endpoint: 0x01, Direction: OUT
        0... .... = Direction: OUT (0)
        .000 0001 = Endpoint value: 1
    Device: 39
    URB bus id: 2
    Device setup request: not relevant ('-')
    Data: not present ('>')
    URB sec: 1424613621
    URB usec: 548198
    URB status: Success (0)
    URB length [bytes]: 1
    Data length [bytes]: 0
    [Request in: 846]
    [Time from request: 0.000075000 seconds]
    [bInterfaceClass: CDC-Data (0x0a)]

0000  c0 1c cd c1 02 88 ff ff 43 03 01 27 02 00 2d 3e   ........C..'..->
0010  f5 e0 e9 54 00 00 00 00 66 5d 08 00 00 00 00 00   ...T....f]......
0020  01 00 00 00 00 00 00 00 00 00 00 00 00 00 00 00   ................
0030  00 00 00 00 00 00 00 00 04 00 00 00 00 00 00 00   ................

No.     Time           Source                Destination           Protocol Length Info
   1308 7.671618000    host                  39.1                  Ethernet 65     URB_BULK out[Malformed Packet]

Frame 1308: 65 bytes on wire (520 bits), 65 bytes captured (520 bits) on interface 0
    Interface id: 0
    Encapsulation type: USB packets with Linux header and padding (115)
    Arrival Time: Feb 22, 2015 16:00:24.350037000 SAST
    [Time shift for this packet: 0.000000000 seconds]
    Epoch Time: 1424613624.350037000 seconds
    [Time delta from previous captured frame: 0.061638000 seconds]
    [Time delta from previous displayed frame: 2.801839000 seconds]
    [Time since reference or first frame: 7.671618000 seconds]
    Frame Number: 1308
    Frame Length: 65 bytes (520 bits)
    Capture Length: 65 bytes (520 bits)
    [Frame is marked: False]
    [Frame is ignored: False]
    [Protocols in frame: usb:eth]
USB URB
    URB id: 0xffff8802c1cd1cc0
    URB type: URB_SUBMIT ('S')
    URB transfer type: URB_BULK (0x03)
    Endpoint: 0x01, Direction: OUT
        0... .... = Direction: OUT (0)
        .000 0001 = Endpoint value: 1
    Device: 39
    URB bus id: 2
    Device setup request: not relevant ('-')
    Data: present (0)
    URB sec: 1424613624
    URB usec: 350037
    URB status: Operation now in progress (-EINPROGRESS) (-115)
    URB length [bytes]: 1
    Data length [bytes]: 1
    [Response in: 1309]
    [bInterfaceClass: CDC-Data (0x0a)]
[Malformed Packet: Ethernet]
    [Expert Info (Error/Malformed): Malformed Packet (Exception occurred)]
        [Message: Malformed Packet (Exception occurred)]
        [Severity level: Error]
        [Group: Malformed]

0000  c0 1c cd c1 02 88 ff ff 53 03 01 27 02 00 2d 00   ........S..'..-.
0010  f8 e0 e9 54 00 00 00 00 55 57 05 00 8d ff ff ff   ...T....UW......
0020  01 00 00 00 01 00 00 00 00 00 00 00 00 00 00 00   ................
0030  00 00 00 00 00 00 00 00 04 00 00 00 00 00 00 00   ................
0040  41                                                A

No.     Time           Source                Destination           Protocol Length Info
   1309 7.671789000    39.1                  host                  USB      64     URB_BULK out

Frame 1309: 64 bytes on wire (512 bits), 64 bytes captured (512 bits) on interface 0
    Interface id: 0
    Encapsulation type: USB packets with Linux header and padding (115)
    Arrival Time: Feb 22, 2015 16:00:24.350208000 SAST
    [Time shift for this packet: 0.000000000 seconds]
    Epoch Time: 1424613624.350208000 seconds
    [Time delta from previous captured frame: 0.000171000 seconds]
    [Time delta from previous displayed frame: 0.000171000 seconds]
    [Time since reference or first frame: 7.671789000 seconds]
    Frame Number: 1309
    Frame Length: 64 bytes (512 bits)
    Capture Length: 64 bytes (512 bits)
    [Frame is marked: False]
    [Frame is ignored: False]
    [Protocols in frame: usb]
USB URB
    URB id: 0xffff8802c1cd1cc0
    URB type: URB_COMPLETE ('C')
    URB transfer type: URB_BULK (0x03)
    Endpoint: 0x01, Direction: OUT
        0... .... = Direction: OUT (0)
        .000 0001 = Endpoint value: 1
    Device: 39
    URB bus id: 2
    Device setup request: not relevant ('-')
    Data: not present ('>')
    URB sec: 1424613624
    URB usec: 350208
    URB status: Success (0)
    URB length [bytes]: 1
    Data length [bytes]: 0
    [Request in: 1308]
    [Time from request: 0.000171000 seconds]
    [bInterfaceClass: CDC-Data (0x0a)]

0000  c0 1c cd c1 02 88 ff ff 43 03 01 27 02 00 2d 3e   ........C..'..->
0010  f8 e0 e9 54 00 00 00 00 00 58 05 00 00 00 00 00   ...T.....X......
0020  01 00 00 00 00 00 00 00 00 00 00 00 00 00 00 00   ................
0030  00 00 00 00 00 00 00 00 04 00 00 00 00 00 00 00   ................

No.     Time           Source                Destination           Protocol Length Info
   1310 7.771771000    host                  39.1                  Ethernet 65     URB_BULK out[Malformed Packet]

Frame 1310: 65 bytes on wire (520 bits), 65 bytes captured (520 bits) on interface 0
    Interface id: 0
    Encapsulation type: USB packets with Linux header and padding (115)
    Arrival Time: Feb 22, 2015 16:00:24.450190000 SAST
    [Time shift for this packet: 0.000000000 seconds]
    Epoch Time: 1424613624.450190000 seconds
    [Time delta from previous captured frame: 0.099982000 seconds]
    [Time delta from previous displayed frame: 0.099982000 seconds]
    [Time since reference or first frame: 7.771771000 seconds]
    Frame Number: 1310
    Frame Length: 65 bytes (520 bits)
    Capture Length: 65 bytes (520 bits)
    [Frame is marked: False]
    [Frame is ignored: False]
    [Protocols in frame: usb:eth]
USB URB
    URB id: 0xffff8802c1cd1cc0
    URB type: URB_SUBMIT ('S')
    URB transfer type: URB_BULK (0x03)
    Endpoint: 0x01, Direction: OUT
        0... .... = Direction: OUT (0)
        .000 0001 = Endpoint value: 1
    Device: 39
    URB bus id: 2
    Device setup request: not relevant ('-')
    Data: present (0)
    URB sec: 1424613624
    URB usec: 450190
    URB status: Operation now in progress (-EINPROGRESS) (-115)
    URB length [bytes]: 1
    Data length [bytes]: 1
    [Response in: 1311]
    [bInterfaceClass: CDC-Data (0x0a)]
[Malformed Packet: Ethernet]
    [Expert Info (Error/Malformed): Malformed Packet (Exception occurred)]
        [Message: Malformed Packet (Exception occurred)]
        [Severity level: Error]
        [Group: Malformed]

0000  c0 1c cd c1 02 88 ff ff 53 03 01 27 02 00 2d 00   ........S..'..-.
0010  f8 e0 e9 54 00 00 00 00 8e de 06 00 8d ff ff ff   ...T............
0020  01 00 00 00 01 00 00 00 00 00 00 00 00 00 00 00   ................
0030  00 00 00 00 00 00 00 00 04 00 00 00 00 00 00 00   ................
0040  54                                                T

No.     Time           Source                Destination           Protocol Length Info
   1311 7.771917000    39.1                  host                  USB      64     URB_BULK out

Frame 1311: 64 bytes on wire (512 bits), 64 bytes captured (512 bits) on interface 0
    Interface id: 0
    Encapsulation type: USB packets with Linux header and padding (115)
    Arrival Time: Feb 22, 2015 16:00:24.450336000 SAST
    [Time shift for this packet: 0.000000000 seconds]
    Epoch Time: 1424613624.450336000 seconds
    [Time delta from previous captured frame: 0.000146000 seconds]
    [Time delta from previous displayed frame: 0.000146000 seconds]
    [Time since reference or first frame: 7.771917000 seconds]
    Frame Number: 1311
    Frame Length: 64 bytes (512 bits)
    Capture Length: 64 bytes (512 bits)
    [Frame is marked: False]
    [Frame is ignored: False]
    [Protocols in frame: usb]
USB URB
    URB id: 0xffff8802c1cd1cc0
    URB type: URB_COMPLETE ('C')
    URB transfer type: URB_BULK (0x03)
    Endpoint: 0x01, Direction: OUT
        0... .... = Direction: OUT (0)
        .000 0001 = Endpoint value: 1
    Device: 39
    URB bus id: 2
    Device setup request: not relevant ('-')
    Data: not present ('>')
    URB sec: 1424613624
    URB usec: 450336
    URB status: Success (0)
    URB length [bytes]: 1
    Data length [bytes]: 0
    [Request in: 1310]
    [Time from request: 0.000146000 seconds]
    [bInterfaceClass: CDC-Data (0x0a)]

0000  c0 1c cd c1 02 88 ff ff 43 03 01 27 02 00 2d 3e   ........C..'..->
0010  f8 e0 e9 54 00 00 00 00 20 df 06 00 00 00 00 00   ...T.... .......
0020  01 00 00 00 00 00 00 00 00 00 00 00 00 00 00 00   ................
0030  00 00 00 00 00 00 00 00 04 00 00 00 00 00 00 00   ................

No.     Time           Source                Destination           Protocol Length Info
   1314 7.871929000    host                  39.1                  Ethernet 65     URB_BULK out[Malformed Packet]

Frame 1314: 65 bytes on wire (520 bits), 65 bytes captured (520 bits) on interface 0
    Interface id: 0
    Encapsulation type: USB packets with Linux header and padding (115)
    Arrival Time: Feb 22, 2015 16:00:24.550348000 SAST
    [Time shift for this packet: 0.000000000 seconds]
    Epoch Time: 1424613624.550348000 seconds
    [Time delta from previous captured frame: 0.037987000 seconds]
    [Time delta from previous displayed frame: 0.100012000 seconds]
    [Time since reference or first frame: 7.871929000 seconds]
    Frame Number: 1314
    Frame Length: 65 bytes (520 bits)
    Capture Length: 65 bytes (520 bits)
    [Frame is marked: False]
    [Frame is ignored: False]
    [Protocols in frame: usb:eth]
USB URB
    URB id: 0xffff8802c1cd1cc0
    URB type: URB_SUBMIT ('S')
    URB transfer type: URB_BULK (0x03)
    Endpoint: 0x01, Direction: OUT
        0... .... = Direction: OUT (0)
        .000 0001 = Endpoint value: 1
    Device: 39
    URB bus id: 2
    Device setup request: not relevant ('-')
    Data: present (0)
    URB sec: 1424613624
    URB usec: 550348
    URB status: Operation now in progress (-EINPROGRESS) (-115)
    URB length [bytes]: 1
    Data length [bytes]: 1
    [Response in: 1846]
    [bInterfaceClass: CDC-Data (0x0a)]
[Malformed Packet: Ethernet]
    [Expert Info (Error/Malformed): Malformed Packet (Exception occurred)]
        [Message: Malformed Packet (Exception occurred)]
        [Severity level: Error]
        [Group: Malformed]

0000  c0 1c cd c1 02 88 ff ff 53 03 01 27 02 00 2d 00   ........S..'..-.
0010  f8 e0 e9 54 00 00 00 00 cc 65 08 00 8d ff ff ff   ...T.....e......
0020  01 00 00 00 01 00 00 00 00 00 00 00 00 00 00 00   ................
0030  00 00 00 00 00 00 00 00 04 00 00 00 00 00 00 00   ................
0040  0d                                                .

No.     Time           Source                Destination           Protocol Length Info
   1315 7.872005000    39.1                  host                  USB      64     URB_BULK out

Frame 1315: 64 bytes on wire (512 bits), 64 bytes captured (512 bits) on interface 0
    Interface id: 0
    Encapsulation type: USB packets with Linux header and padding (115)
    Arrival Time: Feb 22, 2015 16:00:24.550424000 SAST
    [Time shift for this packet: 0.000000000 seconds]
    Epoch Time: 1424613624.550424000 seconds
    [Time delta from previous captured frame: 0.000076000 seconds]
    [Time delta from previous displayed frame: 0.000076000 seconds]
    [Time since reference or first frame: 7.872005000 seconds]
    Frame Number: 1315
    Frame Length: 64 bytes (512 bits)
    Capture Length: 64 bytes (512 bits)
    [Frame is marked: False]
    [Frame is ignored: False]
    [Protocols in frame: usb]
USB URB
    URB id: 0xffff8802c1cd1cc0
    URB type: URB_COMPLETE ('C')
    URB transfer type: URB_BULK (0x03)
    Endpoint: 0x01, Direction: OUT
        0... .... = Direction: OUT (0)
        .000 0001 = Endpoint value: 1
    Device: 39
    URB bus id: 2
    Device setup request: not relevant ('-')
    Data: not present ('>')
    URB sec: 1424613624
    URB usec: 550424
    URB status: Success (0)
    URB length [bytes]: 1
    Data length [bytes]: 0
    [Request in: 1314]
    [Time from request: 0.000076000 seconds]
    [bInterfaceClass: CDC-Data (0x0a)]

0000  c0 1c cd c1 02 88 ff ff 43 03 01 27 02 00 2d 3e   ........C..'..->
0010  f8 e0 e9 54 00 00 00 00 18 66 08 00 00 00 00 00   ...T.....f......
0020  01 00 00 00 00 00 00 00 00 00 00 00 00 00 00 00   ................
0030  00 00 00 00 00 00 00 00 04 00 00 00 00 00 00 00   ................

No.     Time           Source                Destination           Protocol Length Info
   1822 10.670882000   host                  39.0                  USB      64     URB_CONTROL out

Frame 1822: 64 bytes on wire (512 bits), 64 bytes captured (512 bits) on interface 0
    Interface id: 0
    Encapsulation type: USB packets with Linux header and padding (115)
    Arrival Time: Feb 22, 2015 16:00:27.349301000 SAST
    [Time shift for this packet: 0.000000000 seconds]
    Epoch Time: 1424613627.349301000 seconds
    [Time delta from previous captured frame: 0.004924000 seconds]
    [Time delta from previous displayed frame: 2.798877000 seconds]
    [Time since reference or first frame: 10.670882000 seconds]
    Frame Number: 1822
    Frame Length: 64 bytes (512 bits)
    Capture Length: 64 bytes (512 bits)
    [Frame is marked: False]
    [Frame is ignored: False]
    [Protocols in frame: usb]
USB URB
    URB id: 0xffff8802c1f35f00
    URB type: URB_SUBMIT ('S')
    URB transfer type: URB_CONTROL (0x02)
    Endpoint: 0x00, Direction: OUT
        0... .... = Direction: OUT (0)
        .000 0000 = Endpoint value: 0
    Device: 39
    URB bus id: 2
    Device setup request: relevant (0)
    Data: present (0)
    URB sec: 1424613627
    URB usec: 349301
    URB status: Operation now in progress (-EINPROGRESS) (-115)
    URB length [bytes]: 0
    Data length [bytes]: 0
    [Response in: 1823]
    [bInterfaceClass: Communications and CDC Control (0x02)]
URB setup
    bmRequestType: 0x21
        0... .... = Direction: Host-to-device
        .01. .... = Type: Class (0x01)
        ...0 0001 = Recipient: Interface (0x01)
    bRequest: 34
    wValue: 0x0000
    wIndex: 0
    wLength: 0

0000  00 5f f3 c1 02 88 ff ff 53 02 00 27 02 00 00 00   ._......S..'....
0010  fb e0 e9 54 00 00 00 00 75 54 05 00 8d ff ff ff   ...T....uT......
0020  00 00 00 00 00 00 00 00 21 22 00 00 00 00 00 00   ........!"......
0030  00 00 00 00 00 00 00 00 00 00 00 00 00 00 00 00   ................

No.     Time           Source                Destination           Protocol Length Info
   1823 10.671009000   39.0                  host                  USB      64     URB_CONTROL out

Frame 1823: 64 bytes on wire (512 bits), 64 bytes captured (512 bits) on interface 0
    Interface id: 0
    Encapsulation type: USB packets with Linux header and padding (115)
    Arrival Time: Feb 22, 2015 16:00:27.349428000 SAST
    [Time shift for this packet: 0.000000000 seconds]
    Epoch Time: 1424613627.349428000 seconds
    [Time delta from previous captured frame: 0.000127000 seconds]
    [Time delta from previous displayed frame: 0.000127000 seconds]
    [Time since reference or first frame: 10.671009000 seconds]
    Frame Number: 1823
    Frame Length: 64 bytes (512 bits)
    Capture Length: 64 bytes (512 bits)
    [Frame is marked: False]
    [Frame is ignored: False]
    [Protocols in frame: usb]
USB URB
    URB id: 0xffff8802c1f35f00
    URB type: URB_COMPLETE ('C')
    URB transfer type: URB_CONTROL (0x02)
    Endpoint: 0x00, Direction: OUT
        0... .... = Direction: OUT (0)
        .000 0000 = Endpoint value: 0
    Device: 39
    URB bus id: 2
    Device setup request: not relevant ('-')
    Data: not present ('>')
    URB sec: 1424613627
    URB usec: 349428
    URB status: Success (0)
    URB length [bytes]: 0
    Data length [bytes]: 0
    [Request in: 1822]
    [Time from request: 0.000127000 seconds]
    [bInterfaceClass: Communications and CDC Control (0x02)]

0000  00 5f f3 c1 02 88 ff ff 43 02 00 27 02 00 2d 3e   ._......C..'..->
0010  fb e0 e9 54 00 00 00 00 f4 54 05 00 00 00 00 00   ...T.....T......
0020  00 00 00 00 00 00 00 00 00 00 00 00 00 00 00 00   ................
0030  00 00 00 00 00 00 00 00 00 00 00 00 00 00 00 00   ................

No.     Time           Source                Destination           Protocol Length Info
   1824 10.673181000   39.2                  host                  USB      64     URB_INTERRUPT in

Frame 1824: 64 bytes on wire (512 bits), 64 bytes captured (512 bits) on interface 0
    Interface id: 0
    Encapsulation type: USB packets with Linux header and padding (115)
    Arrival Time: Feb 22, 2015 16:00:27.351600000 SAST
    [Time shift for this packet: 0.000000000 seconds]
    Epoch Time: 1424613627.351600000 seconds
    [Time delta from previous captured frame: 0.002172000 seconds]
    [Time delta from previous displayed frame: 0.002172000 seconds]
    [Time since reference or first frame: 10.673181000 seconds]
    Frame Number: 1824
    Frame Length: 64 bytes (512 bits)
    Capture Length: 64 bytes (512 bits)
    [Frame is marked: False]
    [Frame is ignored: False]
    [Protocols in frame: usb]
USB URB
    URB id: 0xffff880220b5a240
    URB type: URB_COMPLETE ('C')
    URB transfer type: URB_INTERRUPT (0x01)
    Endpoint: 0x82, Direction: IN
        1... .... = Direction: IN (1)
        .000 0010 = Endpoint value: 2
    Device: 39
    URB bus id: 2
    Device setup request: not relevant ('-')
    Data: present (0)
    URB sec: 1424613627
    URB usec: 351600
    URB status: No such file or directory (-ENOENT) (-2)
    URB length [bytes]: 0
    Data length [bytes]: 0
    [Request in: 399]
    [Time from request: 9.187664000 seconds]
    [bInterfaceClass: Communications and CDC Control (0x02)]

0000  40 a2 b5 20 02 88 ff ff 43 01 82 27 02 00 2d 00   @.. ....C..'..-.
0010  fb e0 e9 54 00 00 00 00 70 5d 05 00 fe ff ff ff   ...T....p]......
0020  00 00 00 00 00 00 00 00 00 00 00 00 00 00 00 00   ................
0030  10 00 00 00 00 00 00 00 04 02 00 00 00 00 00 00   ................

No.     Time           Source                Destination           Protocol Length Info
   1825 10.673521000   39.1                  host                  USB      64     URB_BULK in

Frame 1825: 64 bytes on wire (512 bits), 64 bytes captured (512 bits) on interface 0
    Interface id: 0
    Encapsulation type: USB packets with Linux header and padding (115)
    Arrival Time: Feb 22, 2015 16:00:27.351940000 SAST
    [Time shift for this packet: 0.000000000 seconds]
    Epoch Time: 1424613627.351940000 seconds
    [Time delta from previous captured frame: 0.000340000 seconds]
    [Time delta from previous displayed frame: 0.000340000 seconds]
    [Time since reference or first frame: 10.673521000 seconds]
    Frame Number: 1825
    Frame Length: 64 bytes (512 bits)
    Capture Length: 64 bytes (512 bits)
    [Frame is marked: False]
    [Frame is ignored: False]
    [Protocols in frame: usb]
USB URB
    URB id: 0xffff88041783b9c0
    URB type: URB_COMPLETE ('C')
    URB transfer type: URB_BULK (0x03)
    Endpoint: 0x81, Direction: IN
        1... .... = Direction: IN (1)
        .000 0001 = Endpoint value: 1
    Device: 39
    URB bus id: 2
    Device setup request: not relevant ('-')
    Data: present (0)
    URB sec: 1424613627
    URB usec: 351940
    URB status: No such file or directory (-ENOENT) (-2)
    URB length [bytes]: 0
    Data length [bytes]: 0
    [Request in: 1314]
    [Time from request: 2.801592000 seconds]
    [bInterfaceClass: CDC-Data (0x0a)]

0000  c0 b9 83 17 04 88 ff ff 43 03 81 27 02 00 2d 00   ........C..'..-.
0010  fb e0 e9 54 00 00 00 00 c4 5e 05 00 fe ff ff ff   ...T.....^......
0020  00 00 00 00 00 00 00 00 00 00 00 00 00 00 00 00   ................
0030  00 00 00 00 00 00 00 00 04 02 00 00 00 00 00 00   ................

No.     Time           Source                Destination           Protocol Length Info
   1827 10.673571000   39.1                  host                  USB      64     URB_BULK in

Frame 1827: 64 bytes on wire (512 bits), 64 bytes captured (512 bits) on interface 0
    Interface id: 0
    Encapsulation type: USB packets with Linux header and padding (115)
    Arrival Time: Feb 22, 2015 16:00:27.351990000 SAST
    [Time shift for this packet: 0.000000000 seconds]
    Epoch Time: 1424613627.351990000 seconds
    [Time delta from previous captured frame: 0.000036000 seconds]
    [Time delta from previous displayed frame: 0.000050000 seconds]
    [Time since reference or first frame: 10.673571000 seconds]
    Frame Number: 1827
    Frame Length: 64 bytes (512 bits)
    Capture Length: 64 bytes (512 bits)
    [Frame is marked: False]
    [Frame is ignored: False]
    [Protocols in frame: usb]
USB URB
    URB id: 0xffff88041783b780
    URB type: URB_COMPLETE ('C')
    URB transfer type: URB_BULK (0x03)
    Endpoint: 0x81, Direction: IN
        1... .... = Direction: IN (1)
        .000 0001 = Endpoint value: 1
    Device: 39
    URB bus id: 2
    Device setup request: not relevant ('-')
    Data: present (0)
    URB sec: 1424613627
    URB usec: 351990
    URB status: No such file or directory (-ENOENT) (-2)
    URB length [bytes]: 0
    Data length [bytes]: 0
    [Request in: 1314]
    [Time from request: 2.801642000 seconds]
    [bInterfaceClass: CDC-Data (0x0a)]

0000  80 b7 83 17 04 88 ff ff 43 03 81 27 02 00 2d 00   ........C..'..-.
0010  fb e0 e9 54 00 00 00 00 f6 5e 05 00 fe ff ff ff   ...T.....^......
0020  00 00 00 00 00 00 00 00 00 00 00 00 00 00 00 00   ................
0030  00 00 00 00 00 00 00 00 04 02 00 00 00 00 00 00   ................

No.     Time           Source                Destination           Protocol Length Info
   1829 10.673632000   39.1                  host                  USB      64     URB_BULK in

Frame 1829: 64 bytes on wire (512 bits), 64 bytes captured (512 bits) on interface 0
    Interface id: 0
    Encapsulation type: USB packets with Linux header and padding (115)
    Arrival Time: Feb 22, 2015 16:00:27.352051000 SAST
    [Time shift for this packet: 0.000000000 seconds]
    Epoch Time: 1424613627.352051000 seconds
    [Time delta from previous captured frame: 0.000021000 seconds]
    [Time delta from previous displayed frame: 0.000061000 seconds]
    [Time since reference or first frame: 10.673632000 seconds]
    Frame Number: 1829
    Frame Length: 64 bytes (512 bits)
    Capture Length: 64 bytes (512 bits)
    [Frame is marked: False]
    [Frame is ignored: False]
    [Protocols in frame: usb]
USB URB
    URB id: 0xffff8801c36f8600
    URB type: URB_COMPLETE ('C')
    URB transfer type: URB_BULK (0x03)
    Endpoint: 0x81, Direction: IN
        1... .... = Direction: IN (1)
        .000 0001 = Endpoint value: 1
    Device: 39
    URB bus id: 2
    Device setup request: not relevant ('-')
    Data: present (0)
    URB sec: 1424613627
    URB usec: 352051
    URB status: No such file or directory (-ENOENT) (-2)
    URB length [bytes]: 0
    Data length [bytes]: 0
    [Request in: 1314]
    [Time from request: 2.801703000 seconds]
    [bInterfaceClass: CDC-Data (0x0a)]

0000  00 86 6f c3 01 88 ff ff 43 03 81 27 02 00 2d 00   ..o.....C..'..-.
0010  fb e0 e9 54 00 00 00 00 33 5f 05 00 fe ff ff ff   ...T....3_......
0020  00 00 00 00 00 00 00 00 00 00 00 00 00 00 00 00   ................
0030  00 00 00 00 00 00 00 00 04 02 00 00 00 00 00 00   ................

No.     Time           Source                Destination           Protocol Length Info
   1832 10.673870000   39.1                  host                  USB      64     URB_BULK in

Frame 1832: 64 bytes on wire (512 bits), 64 bytes captured (512 bits) on interface 0
    Interface id: 0
    Encapsulation type: USB packets with Linux header and padding (115)
    Arrival Time: Feb 22, 2015 16:00:27.352289000 SAST
    [Time shift for this packet: 0.000000000 seconds]
    Epoch Time: 1424613627.352289000 seconds
    [Time delta from previous captured frame: 0.000076000 seconds]
    [Time delta from previous displayed frame: 0.000238000 seconds]
    [Time since reference or first frame: 10.673870000 seconds]
    Frame Number: 1832
    Frame Length: 64 bytes (512 bits)
    Capture Length: 64 bytes (512 bits)
    [Frame is marked: False]
    [Frame is ignored: False]
    [Protocols in frame: usb]
USB URB
    URB id: 0xffff8801c36f8a80
    URB type: URB_COMPLETE ('C')
    URB transfer type: URB_BULK (0x03)
    Endpoint: 0x81, Direction: IN
        1... .... = Direction: IN (1)
        .000 0001 = Endpoint value: 1
    Device: 39
    URB bus id: 2
    Device setup request: not relevant ('-')
    Data: present (0)
    URB sec: 1424613627
    URB usec: 352289
    URB status: No such file or directory (-ENOENT) (-2)
    URB length [bytes]: 0
    Data length [bytes]: 0
    [Request in: 1314]
    [Time from request: 2.801941000 seconds]
    [bInterfaceClass: CDC-Data (0x0a)]

0000  80 8a 6f c3 01 88 ff ff 43 03 81 27 02 00 2d 00   ..o.....C..'..-.
0010  fb e0 e9 54 00 00 00 00 21 60 05 00 fe ff ff ff   ...T....!`......
0020  00 00 00 00 00 00 00 00 00 00 00 00 00 00 00 00   ................
0030  00 00 00 00 00 00 00 00 04 02 00 00 00 00 00 00   ................

No.     Time           Source                Destination           Protocol Length Info
   1834 10.673919000   39.1                  host                  USB      64     URB_BULK in

Frame 1834: 64 bytes on wire (512 bits), 64 bytes captured (512 bits) on interface 0
    Interface id: 0
    Encapsulation type: USB packets with Linux header and padding (115)
    Arrival Time: Feb 22, 2015 16:00:27.352338000 SAST
    [Time shift for this packet: 0.000000000 seconds]
    Epoch Time: 1424613627.352338000 seconds
    [Time delta from previous captured frame: 0.000038000 seconds]
    [Time delta from previous displayed frame: 0.000049000 seconds]
    [Time since reference or first frame: 10.673919000 seconds]
    Frame Number: 1834
    Frame Length: 64 bytes (512 bits)
    Capture Length: 64 bytes (512 bits)
    [Frame is marked: False]
    [Frame is ignored: False]
    [Protocols in frame: usb]
USB URB
    URB id: 0xffff8801c36f8180
    URB type: URB_COMPLETE ('C')
    URB transfer type: URB_BULK (0x03)
    Endpoint: 0x81, Direction: IN
        1... .... = Direction: IN (1)
        .000 0001 = Endpoint value: 1
    Device: 39
    URB bus id: 2
    Device setup request: not relevant ('-')
    Data: present (0)
    URB sec: 1424613627
    URB usec: 352338
    URB status: No such file or directory (-ENOENT) (-2)
    URB length [bytes]: 0
    Data length [bytes]: 0
    [Request in: 1314]
    [Time from request: 2.801990000 seconds]
    [bInterfaceClass: CDC-Data (0x0a)]

0000  80 81 6f c3 01 88 ff ff 43 03 81 27 02 00 2d 00   ..o.....C..'..-.
0010  fb e0 e9 54 00 00 00 00 52 60 05 00 fe ff ff ff   ...T....R`......
0020  00 00 00 00 00 00 00 00 00 00 00 00 00 00 00 00   ................
0030  00 00 00 00 00 00 00 00 04 02 00 00 00 00 00 00   ................

No.     Time           Source                Destination           Protocol Length Info
   1835 10.673929000   39.1                  host                  USB      64     URB_BULK in

Frame 1835: 64 bytes on wire (512 bits), 64 bytes captured (512 bits) on interface 0
    Interface id: 0
    Encapsulation type: USB packets with Linux header and padding (115)
    Arrival Time: Feb 22, 2015 16:00:27.352348000 SAST
    [Time shift for this packet: 0.000000000 seconds]
    Epoch Time: 1424613627.352348000 seconds
    [Time delta from previous captured frame: 0.000010000 seconds]
    [Time delta from previous displayed frame: 0.000010000 seconds]
    [Time since reference or first frame: 10.673929000 seconds]
    Frame Number: 1835
    Frame Length: 64 bytes (512 bits)
    Capture Length: 64 bytes (512 bits)
    [Frame is marked: False]
    [Frame is ignored: False]
    [Protocols in frame: usb]
USB URB
    URB id: 0xffff8801c36f86c0
    URB type: URB_COMPLETE ('C')
    URB transfer type: URB_BULK (0x03)
    Endpoint: 0x81, Direction: IN
        1... .... = Direction: IN (1)
        .000 0001 = Endpoint value: 1
    Device: 39
    URB bus id: 2
    Device setup request: not relevant ('-')
    Data: present (0)
    URB sec: 1424613627
    URB usec: 352348
    URB status: No such file or directory (-ENOENT) (-2)
    URB length [bytes]: 0
    Data length [bytes]: 0
    [Request in: 1314]
    [Time from request: 2.802000000 seconds]
    [bInterfaceClass: CDC-Data (0x0a)]

0000  c0 86 6f c3 01 88 ff ff 43 03 81 27 02 00 2d 00   ..o.....C..'..-.
0010  fb e0 e9 54 00 00 00 00 5c 60 05 00 fe ff ff ff   ...T....\`......
0020  00 00 00 00 00 00 00 00 00 00 00 00 00 00 00 00   ................
0030  00 00 00 00 00 00 00 00 04 02 00 00 00 00 00 00   ................

No.     Time           Source                Destination           Protocol Length Info
   1836 10.673934000   39.1                  host                  USB      64     URB_BULK in

Frame 1836: 64 bytes on wire (512 bits), 64 bytes captured (512 bits) on interface 0
    Interface id: 0
    Encapsulation type: USB packets with Linux header and padding (115)
    Arrival Time: Feb 22, 2015 16:00:27.352353000 SAST
    [Time shift for this packet: 0.000000000 seconds]
    Epoch Time: 1424613627.352353000 seconds
    [Time delta from previous captured frame: 0.000005000 seconds]
    [Time delta from previous displayed frame: 0.000005000 seconds]
    [Time since reference or first frame: 10.673934000 seconds]
    Frame Number: 1836
    Frame Length: 64 bytes (512 bits)
    Capture Length: 64 bytes (512 bits)
    [Frame is marked: False]
    [Frame is ignored: False]
    [Protocols in frame: usb]
USB URB
    URB id: 0xffff8801c36f8480
    URB type: URB_COMPLETE ('C')
    URB transfer type: URB_BULK (0x03)
    Endpoint: 0x81, Direction: IN
        1... .... = Direction: IN (1)
        .000 0001 = Endpoint value: 1
    Device: 39
    URB bus id: 2
    Device setup request: not relevant ('-')
    Data: present (0)
    URB sec: 1424613627
    URB usec: 352353
    URB status: No such file or directory (-ENOENT) (-2)
    URB length [bytes]: 0
    Data length [bytes]: 0
    [Request in: 1314]
    [Time from request: 2.802005000 seconds]
    [bInterfaceClass: CDC-Data (0x0a)]

0000  80 84 6f c3 01 88 ff ff 43 03 81 27 02 00 2d 00   ..o.....C..'..-.
0010  fb e0 e9 54 00 00 00 00 61 60 05 00 fe ff ff ff   ...T....a`......
0020  00 00 00 00 00 00 00 00 00 00 00 00 00 00 00 00   ................
0030  00 00 00 00 00 00 00 00 04 02 00 00 00 00 00 00   ................

No.     Time           Source                Destination           Protocol Length Info
   1837 10.673939000   39.1                  host                  USB      64     URB_BULK in

Frame 1837: 64 bytes on wire (512 bits), 64 bytes captured (512 bits) on interface 0
    Interface id: 0
    Encapsulation type: USB packets with Linux header and padding (115)
    Arrival Time: Feb 22, 2015 16:00:27.352358000 SAST
    [Time shift for this packet: 0.000000000 seconds]
    Epoch Time: 1424613627.352358000 seconds
    [Time delta from previous captured frame: 0.000005000 seconds]
    [Time delta from previous displayed frame: 0.000005000 seconds]
    [Time since reference or first frame: 10.673939000 seconds]
    Frame Number: 1837
    Frame Length: 64 bytes (512 bits)
    Capture Length: 64 bytes (512 bits)
    [Frame is marked: False]
    [Frame is ignored: False]
    [Protocols in frame: usb]
USB URB
    URB id: 0xffff8801c36f8840
    URB type: URB_COMPLETE ('C')
    URB transfer type: URB_BULK (0x03)
    Endpoint: 0x81, Direction: IN
        1... .... = Direction: IN (1)
        .000 0001 = Endpoint value: 1
    Device: 39
    URB bus id: 2
    Device setup request: not relevant ('-')
    Data: present (0)
    URB sec: 1424613627
    URB usec: 352358
    URB status: No such file or directory (-ENOENT) (-2)
    URB length [bytes]: 0
    Data length [bytes]: 0
    [Request in: 1314]
    [Time from request: 2.802010000 seconds]
    [bInterfaceClass: CDC-Data (0x0a)]

0000  40 88 6f c3 01 88 ff ff 43 03 81 27 02 00 2d 00   @.o.....C..'..-.
0010  fb e0 e9 54 00 00 00 00 66 60 05 00 fe ff ff ff   ...T....f`......
0020  00 00 00 00 00 00 00 00 00 00 00 00 00 00 00 00   ................
0030  00 00 00 00 00 00 00 00 04 02 00 00 00 00 00 00   ................

No.     Time           Source                Destination           Protocol Length Info
   1838 10.673943000   39.1                  host                  USB      64     URB_BULK in

Frame 1838: 64 bytes on wire (512 bits), 64 bytes captured (512 bits) on interface 0
    Interface id: 0
    Encapsulation type: USB packets with Linux header and padding (115)
    Arrival Time: Feb 22, 2015 16:00:27.352362000 SAST
    [Time shift for this packet: 0.000000000 seconds]
    Epoch Time: 1424613627.352362000 seconds
    [Time delta from previous captured frame: 0.000004000 seconds]
    [Time delta from previous displayed frame: 0.000004000 seconds]
    [Time since reference or first frame: 10.673943000 seconds]
    Frame Number: 1838
    Frame Length: 64 bytes (512 bits)
    Capture Length: 64 bytes (512 bits)
    [Frame is marked: False]
    [Frame is ignored: False]
    [Protocols in frame: usb]
USB URB
    URB id: 0xffff8801c36f8000
    URB type: URB_COMPLETE ('C')
    URB transfer type: URB_BULK (0x03)
    Endpoint: 0x81, Direction: IN
        1... .... = Direction: IN (1)
        .000 0001 = Endpoint value: 1
    Device: 39
    URB bus id: 2
    Device setup request: not relevant ('-')
    Data: present (0)
    URB sec: 1424613627
    URB usec: 352362
    URB status: No such file or directory (-ENOENT) (-2)
    URB length [bytes]: 0
    Data length [bytes]: 0
    [Request in: 1314]
    [Time from request: 2.802014000 seconds]
    [bInterfaceClass: CDC-Data (0x0a)]

0000  00 80 6f c3 01 88 ff ff 43 03 81 27 02 00 2d 00   ..o.....C..'..-.
0010  fb e0 e9 54 00 00 00 00 6a 60 05 00 fe ff ff ff   ...T....j`......
0020  00 00 00 00 00 00 00 00 00 00 00 00 00 00 00 00   ................
0030  00 00 00 00 00 00 00 00 04 02 00 00 00 00 00 00   ................

No.     Time           Source                Destination           Protocol Length Info
   1839 10.673946000   39.1                  host                  USB      64     URB_BULK in

Frame 1839: 64 bytes on wire (512 bits), 64 bytes captured (512 bits) on interface 0
    Interface id: 0
    Encapsulation type: USB packets with Linux header and padding (115)
    Arrival Time: Feb 22, 2015 16:00:27.352365000 SAST
    [Time shift for this packet: 0.000000000 seconds]
    Epoch Time: 1424613627.352365000 seconds
    [Time delta from previous captured frame: 0.000003000 seconds]
    [Time delta from previous displayed frame: 0.000003000 seconds]
    [Time since reference or first frame: 10.673946000 seconds]
    Frame Number: 1839
    Frame Length: 64 bytes (512 bits)
    Capture Length: 64 bytes (512 bits)
    [Frame is marked: False]
    [Frame is ignored: False]
    [Protocols in frame: usb]
USB URB
    URB id: 0xffff8801c36f80c0
    URB type: URB_COMPLETE ('C')
    URB transfer type: URB_BULK (0x03)
    Endpoint: 0x81, Direction: IN
        1... .... = Direction: IN (1)
        .000 0001 = Endpoint value: 1
    Device: 39
    URB bus id: 2
    Device setup request: not relevant ('-')
    Data: present (0)
    URB sec: 1424613627
    URB usec: 352365
    URB status: No such file or directory (-ENOENT) (-2)
    URB length [bytes]: 0
    Data length [bytes]: 0
    [Request in: 1314]
    [Time from request: 2.802017000 seconds]
    [bInterfaceClass: CDC-Data (0x0a)]

0000  c0 80 6f c3 01 88 ff ff 43 03 81 27 02 00 2d 00   ..o.....C..'..-.
0010  fb e0 e9 54 00 00 00 00 6d 60 05 00 fe ff ff ff   ...T....m`......
0020  00 00 00 00 00 00 00 00 00 00 00 00 00 00 00 00   ................
0030  00 00 00 00 00 00 00 00 04 02 00 00 00 00 00 00   ................

No.     Time           Source                Destination           Protocol Length Info
   1840 10.673950000   39.1                  host                  USB      64     URB_BULK in

Frame 1840: 64 bytes on wire (512 bits), 64 bytes captured (512 bits) on interface 0
    Interface id: 0
    Encapsulation type: USB packets with Linux header and padding (115)
    Arrival Time: Feb 22, 2015 16:00:27.352369000 SAST
    [Time shift for this packet: 0.000000000 seconds]
    Epoch Time: 1424613627.352369000 seconds
    [Time delta from previous captured frame: 0.000004000 seconds]
    [Time delta from previous displayed frame: 0.000004000 seconds]
    [Time since reference or first frame: 10.673950000 seconds]
    Frame Number: 1840
    Frame Length: 64 bytes (512 bits)
    Capture Length: 64 bytes (512 bits)
    [Frame is marked: False]
    [Frame is ignored: False]
    [Protocols in frame: usb]
USB URB
    URB id: 0xffff8801c36f89c0
    URB type: URB_COMPLETE ('C')
    URB transfer type: URB_BULK (0x03)
    Endpoint: 0x81, Direction: IN
        1... .... = Direction: IN (1)
        .000 0001 = Endpoint value: 1
    Device: 39
    URB bus id: 2
    Device setup request: not relevant ('-')
    Data: present (0)
    URB sec: 1424613627
    URB usec: 352369
    URB status: No such file or directory (-ENOENT) (-2)
    URB length [bytes]: 0
    Data length [bytes]: 0
    [Request in: 1314]
    [Time from request: 2.802021000 seconds]
    [bInterfaceClass: CDC-Data (0x0a)]

0000  c0 89 6f c3 01 88 ff ff 43 03 81 27 02 00 2d 00   ..o.....C..'..-.
0010  fb e0 e9 54 00 00 00 00 71 60 05 00 fe ff ff ff   ...T....q`......
0020  00 00 00 00 00 00 00 00 00 00 00 00 00 00 00 00   ................
0030  00 00 00 00 00 00 00 00 04 02 00 00 00 00 00 00   ................

No.     Time           Source                Destination           Protocol Length Info
   1841 10.673954000   39.1                  host                  USB      64     URB_BULK in

Frame 1841: 64 bytes on wire (512 bits), 64 bytes captured (512 bits) on interface 0
    Interface id: 0
    Encapsulation type: USB packets with Linux header and padding (115)
    Arrival Time: Feb 22, 2015 16:00:27.352373000 SAST
    [Time shift for this packet: 0.000000000 seconds]
    Epoch Time: 1424613627.352373000 seconds
    [Time delta from previous captured frame: 0.000004000 seconds]
    [Time delta from previous displayed frame: 0.000004000 seconds]
    [Time since reference or first frame: 10.673954000 seconds]
    Frame Number: 1841
    Frame Length: 64 bytes (512 bits)
    Capture Length: 64 bytes (512 bits)
    [Frame is marked: False]
    [Frame is ignored: False]
    [Protocols in frame: usb]
USB URB
    URB id: 0xffff8801c36f8e40
    URB type: URB_COMPLETE ('C')
    URB transfer type: URB_BULK (0x03)
    Endpoint: 0x81, Direction: IN
        1... .... = Direction: IN (1)
        .000 0001 = Endpoint value: 1
    Device: 39
    URB bus id: 2
    Device setup request: not relevant ('-')
    Data: present (0)
    URB sec: 1424613627
    URB usec: 352373
    URB status: No such file or directory (-ENOENT) (-2)
    URB length [bytes]: 0
    Data length [bytes]: 0
    [Request in: 1314]
    [Time from request: 2.802025000 seconds]
    [bInterfaceClass: CDC-Data (0x0a)]

0000  40 8e 6f c3 01 88 ff ff 43 03 81 27 02 00 2d 00   @.o.....C..'..-.
0010  fb e0 e9 54 00 00 00 00 75 60 05 00 fe ff ff ff   ...T....u`......
0020  00 00 00 00 00 00 00 00 00 00 00 00 00 00 00 00   ................
0030  00 00 00 00 00 00 00 00 04 02 00 00 00 00 00 00   ................

No.     Time           Source                Destination           Protocol Length Info
   1842 10.673958000   39.1                  host                  USB      64     URB_BULK in

Frame 1842: 64 bytes on wire (512 bits), 64 bytes captured (512 bits) on interface 0
    Interface id: 0
    Encapsulation type: USB packets with Linux header and padding (115)
    Arrival Time: Feb 22, 2015 16:00:27.352377000 SAST
    [Time shift for this packet: 0.000000000 seconds]
    Epoch Time: 1424613627.352377000 seconds
    [Time delta from previous captured frame: 0.000004000 seconds]
    [Time delta from previous displayed frame: 0.000004000 seconds]
    [Time since reference or first frame: 10.673958000 seconds]
    Frame Number: 1842
    Frame Length: 64 bytes (512 bits)
    Capture Length: 64 bytes (512 bits)
    [Frame is marked: False]
    [Frame is ignored: False]
    [Protocols in frame: usb]
USB URB
    URB id: 0xffff8801c36f8300
    URB type: URB_COMPLETE ('C')
    URB transfer type: URB_BULK (0x03)
    Endpoint: 0x81, Direction: IN
        1... .... = Direction: IN (1)
        .000 0001 = Endpoint value: 1
    Device: 39
    URB bus id: 2
    Device setup request: not relevant ('-')
    Data: present (0)
    URB sec: 1424613627
    URB usec: 352377
    URB status: No such file or directory (-ENOENT) (-2)
    URB length [bytes]: 0
    Data length [bytes]: 0
    [Request in: 1314]
    [Time from request: 2.802029000 seconds]
    [bInterfaceClass: CDC-Data (0x0a)]

0000  00 83 6f c3 01 88 ff ff 43 03 81 27 02 00 2d 00   ..o.....C..'..-.
0010  fb e0 e9 54 00 00 00 00 79 60 05 00 fe ff ff ff   ...T....y`......
0020  00 00 00 00 00 00 00 00 00 00 00 00 00 00 00 00   ................
0030  00 00 00 00 00 00 00 00 04 02 00 00 00 00 00 00   ................

No.     Time           Source                Destination           Protocol Length Info
   1843 10.673971000   39.1                  host                  USB      64     URB_BULK in

Frame 1843: 64 bytes on wire (512 bits), 64 bytes captured (512 bits) on interface 0
    Interface id: 0
    Encapsulation type: USB packets with Linux header and padding (115)
    Arrival Time: Feb 22, 2015 16:00:27.352390000 SAST
    [Time shift for this packet: 0.000000000 seconds]
    Epoch Time: 1424613627.352390000 seconds
    [Time delta from previous captured frame: 0.000013000 seconds]
    [Time delta from previous displayed frame: 0.000013000 seconds]
    [Time since reference or first frame: 10.673971000 seconds]
    Frame Number: 1843
    Frame Length: 64 bytes (512 bits)
    Capture Length: 64 bytes (512 bits)
    [Frame is marked: False]
    [Frame is ignored: False]
    [Protocols in frame: usb]
USB URB
    URB id: 0xffff8801c36f8c00
    URB type: URB_COMPLETE ('C')
    URB transfer type: URB_BULK (0x03)
    Endpoint: 0x81, Direction: IN
        1... .... = Direction: IN (1)
        .000 0001 = Endpoint value: 1
    Device: 39
    URB bus id: 2
    Device setup request: not relevant ('-')
    Data: present (0)
    URB sec: 1424613627
    URB usec: 352390
    URB status: No such file or directory (-ENOENT) (-2)
    URB length [bytes]: 0
    Data length [bytes]: 0
    [Request in: 1314]
    [Time from request: 2.802042000 seconds]
    [bInterfaceClass: CDC-Data (0x0a)]

0000  00 8c 6f c3 01 88 ff ff 43 03 81 27 02 00 2d 00   ..o.....C..'..-.
0010  fb e0 e9 54 00 00 00 00 86 60 05 00 fe ff ff ff   ...T.....`......
0020  00 00 00 00 00 00 00 00 00 00 00 00 00 00 00 00   ................
0030  00 00 00 00 00 00 00 00 04 02 00 00 00 00 00 00   ................

No.     Time           Source                Destination           Protocol Length Info
   1845 10.673996000   39.1                  host                  USB      64     URB_BULK in

Frame 1845: 64 bytes on wire (512 bits), 64 bytes captured (512 bits) on interface 0
    Interface id: 0
    Encapsulation type: USB packets with Linux header and padding (115)
    Arrival Time: Feb 22, 2015 16:00:27.352415000 SAST
    [Time shift for this packet: 0.000000000 seconds]
    Epoch Time: 1424613627.352415000 seconds
    [Time delta from previous captured frame: 0.000012000 seconds]
    [Time delta from previous displayed frame: 0.000025000 seconds]
    [Time since reference or first frame: 10.673996000 seconds]
    Frame Number: 1845
    Frame Length: 64 bytes (512 bits)
    Capture Length: 64 bytes (512 bits)
    [Frame is marked: False]
    [Frame is ignored: False]
    [Protocols in frame: usb]
USB URB
    URB id: 0xffff8802c1cd1b40
    URB type: URB_COMPLETE ('C')
    URB transfer type: URB_BULK (0x03)
    Endpoint: 0x81, Direction: IN
        1... .... = Direction: IN (1)
        .000 0001 = Endpoint value: 1
    Device: 39
    URB bus id: 2
    Device setup request: not relevant ('-')
    Data: present (0)
    URB sec: 1424613627
    URB usec: 352415
    URB status: No such file or directory (-ENOENT) (-2)
    URB length [bytes]: 0
    Data length [bytes]: 0
    [Request in: 1314]
    [Time from request: 2.802067000 seconds]
    [bInterfaceClass: CDC-Data (0x0a)]

0000  40 1b cd c1 02 88 ff ff 43 03 81 27 02 00 2d 00   @.......C..'..-.
0010  fb e0 e9 54 00 00 00 00 9f 60 05 00 fe ff ff ff   ...T.....`......
0020  00 00 00 00 00 00 00 00 00 00 00 00 00 00 00 00   ................
0030  00 00 00 00 00 00 00 00 04 02 00 00 00 00 00 00   ................

No.     Time           Source                Destination           Protocol Length Info
   1846 10.674287000   39.1                  host                  USB      64     URB_BULK in

Frame 1846: 64 bytes on wire (512 bits), 64 bytes captured (512 bits) on interface 0
    Interface id: 0
    Encapsulation type: USB packets with Linux header and padding (115)
    Arrival Time: Feb 22, 2015 16:00:27.352706000 SAST
    [Time shift for this packet: 0.000000000 seconds]
    Epoch Time: 1424613627.352706000 seconds
    [Time delta from previous captured frame: 0.000291000 seconds]
    [Time delta from previous displayed frame: 0.000291000 seconds]
    [Time since reference or first frame: 10.674287000 seconds]
    Frame Number: 1846
    Frame Length: 64 bytes (512 bits)
    Capture Length: 64 bytes (512 bits)
    [Frame is marked: False]
    [Frame is ignored: False]
    [Protocols in frame: usb]
USB URB
    URB id: 0xffff8802c1cd1a80
    URB type: URB_COMPLETE ('C')
    URB transfer type: URB_BULK (0x03)
    Endpoint: 0x81, Direction: IN
        1... .... = Direction: IN (1)
        .000 0001 = Endpoint value: 1
    Device: 39
    URB bus id: 2
    Device setup request: not relevant ('-')
    Data: present (0)
    URB sec: 1424613627
    URB usec: 352706
    URB status: No such file or directory (-ENOENT) (-2)
    URB length [bytes]: 0
    Data length [bytes]: 0
    [Request in: 1314]
    [Time from request: 2.802358000 seconds]
    [bInterfaceClass: CDC-Data (0x0a)]

0000  80 1a cd c1 02 88 ff ff 43 03 81 27 02 00 2d 00   ........C..'..-.
0010  fb e0 e9 54 00 00 00 00 c2 61 05 00 fe ff ff ff   ...T.....a......
0020  00 00 00 00 00 00 00 00 00 00 00 00 00 00 00 00   ................
0030  00 00 00 00 00 00 00 00 04 02 00 00 00 00 00 00   ................

No.     Time           Source                Destination           Protocol Length Info
   1849 10.674590000   host                  39.2                  USB      64     URB_INTERRUPT in

Frame 1849: 64 bytes on wire (512 bits), 64 bytes captured (512 bits) on interface 0
    Interface id: 0
    Encapsulation type: USB packets with Linux header and padding (115)
    Arrival Time: Feb 22, 2015 16:00:27.353009000 SAST
    [Time shift for this packet: 0.000000000 seconds]
    Epoch Time: 1424613627.353009000 seconds
    [Time delta from previous captured frame: 0.000209000 seconds]
    [Time delta from previous displayed frame: 0.000303000 seconds]
    [Time since reference or first frame: 10.674590000 seconds]
    Frame Number: 1849
    Frame Length: 64 bytes (512 bits)
    Capture Length: 64 bytes (512 bits)
    [Frame is marked: False]
    [Frame is ignored: False]
    [Protocols in frame: usb]
USB URB
    URB id: 0xffff880220b5a240
    URB type: URB_SUBMIT ('S')
    URB transfer type: URB_INTERRUPT (0x01)
    Endpoint: 0x82, Direction: IN
        1... .... = Direction: IN (1)
        .000 0010 = Endpoint value: 2
    Device: 39
    URB bus id: 2
    Device setup request: not relevant ('-')
    Data: not present ('<')
    URB sec: 1424613627
    URB usec: 353009
    URB status: Operation now in progress (-EINPROGRESS) (-115)
    URB length [bytes]: 8
    Data length [bytes]: 0
    [Response in: 2798]
    [bInterfaceClass: Communications and CDC Control (0x02)]

0000  40 a2 b5 20 02 88 ff ff 53 01 82 27 02 00 2d 3c   @.. ....S..'..-<
0010  fb e0 e9 54 00 00 00 00 f1 62 05 00 8d ff ff ff   ...T.....b......
0020  08 00 00 00 00 00 00 00 00 00 00 00 00 00 00 00   ................
0030  10 00 00 00 00 00 00 00 04 02 00 00 00 00 00 00   ................

No.     Time           Source                Destination           Protocol Length Info
   1850 10.674597000   host                  39.0                  USB      64     URB_CONTROL out

Frame 1850: 64 bytes on wire (512 bits), 64 bytes captured (512 bits) on interface 0
    Interface id: 0
    Encapsulation type: USB packets with Linux header and padding (115)
    Arrival Time: Feb 22, 2015 16:00:27.353016000 SAST
    [Time shift for this packet: 0.000000000 seconds]
    Epoch Time: 1424613627.353016000 seconds
    [Time delta from previous captured frame: 0.000007000 seconds]
    [Time delta from previous displayed frame: 0.000007000 seconds]
    [Time since reference or first frame: 10.674597000 seconds]
    Frame Number: 1850
    Frame Length: 64 bytes (512 bits)
    Capture Length: 64 bytes (512 bits)
    [Frame is marked: False]
    [Frame is ignored: False]
    [Protocols in frame: usb]
USB URB
    URB id: 0xffff8802c1f35f00
    URB type: URB_SUBMIT ('S')
    URB transfer type: URB_CONTROL (0x02)
    Endpoint: 0x00, Direction: OUT
        0... .... = Direction: OUT (0)
        .000 0000 = Endpoint value: 0
    Device: 39
    URB bus id: 2
    Device setup request: relevant (0)
    Data: present (0)
    URB sec: 1424613627
    URB usec: 353016
    URB status: Operation now in progress (-EINPROGRESS) (-115)
    URB length [bytes]: 0
    Data length [bytes]: 0
    [Response in: 1851]
    [bInterfaceClass: Communications and CDC Control (0x02)]
URB setup
    bmRequestType: 0x21
        0... .... = Direction: Host-to-device
        .01. .... = Type: Class (0x01)
        ...0 0001 = Recipient: Interface (0x01)
    bRequest: 34
    wValue: 0x0003
    wIndex: 0
    wLength: 0

0000  00 5f f3 c1 02 88 ff ff 53 02 00 27 02 00 00 00   ._......S..'....
0010  fb e0 e9 54 00 00 00 00 f8 62 05 00 8d ff ff ff   ...T.....b......
0020  00 00 00 00 00 00 00 00 21 22 03 00 00 00 00 00   ........!"......
0030  00 00 00 00 00 00 00 00 00 00 00 00 00 00 00 00   ................

No.     Time           Source                Destination           Protocol Length Info
   1851 10.674732000   39.0                  host                  USB      64     URB_CONTROL out

Frame 1851: 64 bytes on wire (512 bits), 64 bytes captured (512 bits) on interface 0
    Interface id: 0
    Encapsulation type: USB packets with Linux header and padding (115)
    Arrival Time: Feb 22, 2015 16:00:27.353151000 SAST
    [Time shift for this packet: 0.000000000 seconds]
    Epoch Time: 1424613627.353151000 seconds
    [Time delta from previous captured frame: 0.000135000 seconds]
    [Time delta from previous displayed frame: 0.000135000 seconds]
    [Time since reference or first frame: 10.674732000 seconds]
    Frame Number: 1851
    Frame Length: 64 bytes (512 bits)
    Capture Length: 64 bytes (512 bits)
    [Frame is marked: False]
    [Frame is ignored: False]
    [Protocols in frame: usb]
USB URB
    URB id: 0xffff8802c1f35f00
    URB type: URB_COMPLETE ('C')
    URB transfer type: URB_CONTROL (0x02)
    Endpoint: 0x00, Direction: OUT
        0... .... = Direction: OUT (0)
        .000 0000 = Endpoint value: 0
    Device: 39
    URB bus id: 2
    Device setup request: not relevant ('-')
    Data: not present ('>')
    URB sec: 1424613627
    URB usec: 353151
    URB status: Success (0)
    URB length [bytes]: 0
    Data length [bytes]: 0
    [Request in: 1850]
    [Time from request: 0.000135000 seconds]
    [bInterfaceClass: Communications and CDC Control (0x02)]

0000  00 5f f3 c1 02 88 ff ff 43 02 00 27 02 00 2d 3e   ._......C..'..->
0010  fb e0 e9 54 00 00 00 00 7f 63 05 00 00 00 00 00   ...T.....c......
0020  00 00 00 00 00 00 00 00 00 00 00 00 00 00 00 00   ................
0030  00 00 00 00 00 00 00 00 00 00 00 00 00 00 00 00   ................

No.     Time           Source                Destination           Protocol Length Info
   1852 10.674770000   host                  39.1                  USB      64     URB_BULK in

Frame 1852: 64 bytes on wire (512 bits), 64 bytes captured (512 bits) on interface 0
    Interface id: 0
    Encapsulation type: USB packets with Linux header and padding (115)
    Arrival Time: Feb 22, 2015 16:00:27.353189000 SAST
    [Time shift for this packet: 0.000000000 seconds]
    Epoch Time: 1424613627.353189000 seconds
    [Time delta from previous captured frame: 0.000038000 seconds]
    [Time delta from previous displayed frame: 0.000038000 seconds]
    [Time since reference or first frame: 10.674770000 seconds]
    Frame Number: 1852
    Frame Length: 64 bytes (512 bits)
    Capture Length: 64 bytes (512 bits)
    [Frame is marked: False]
    [Frame is ignored: False]
    [Protocols in frame: usb]
USB URB
    URB id: 0xffff88041783b9c0
    URB type: URB_SUBMIT ('S')
    URB transfer type: URB_BULK (0x03)
    Endpoint: 0x81, Direction: IN
        1... .... = Direction: IN (1)
        .000 0001 = Endpoint value: 1
    Device: 39
    URB bus id: 2
    Device setup request: not relevant ('-')
    Data: not present ('<')
    URB sec: 1424613627
    URB usec: 353189
    URB status: Operation now in progress (-EINPROGRESS) (-115)
    URB length [bytes]: 128
    Data length [bytes]: 0
    [bInterfaceClass: CDC-Data (0x0a)]

0000  c0 b9 83 17 04 88 ff ff 53 03 81 27 02 00 2d 3c   ........S..'..-<
0010  fb e0 e9 54 00 00 00 00 a5 63 05 00 8d ff ff ff   ...T.....c......
0020  80 00 00 00 00 00 00 00 00 00 00 00 00 00 00 00   ................
0030  00 00 00 00 00 00 00 00 04 02 00 00 00 00 00 00   ................

No.     Time           Source                Destination           Protocol Length Info
   1853 10.674777000   host                  39.1                  USB      64     URB_BULK in

Frame 1853: 64 bytes on wire (512 bits), 64 bytes captured (512 bits) on interface 0
    Interface id: 0
    Encapsulation type: USB packets with Linux header and padding (115)
    Arrival Time: Feb 22, 2015 16:00:27.353196000 SAST
    [Time shift for this packet: 0.000000000 seconds]
    Epoch Time: 1424613627.353196000 seconds
    [Time delta from previous captured frame: 0.000007000 seconds]
    [Time delta from previous displayed frame: 0.000007000 seconds]
    [Time since reference or first frame: 10.674777000 seconds]
    Frame Number: 1853
    Frame Length: 64 bytes (512 bits)
    Capture Length: 64 bytes (512 bits)
    [Frame is marked: False]
    [Frame is ignored: False]
    [Protocols in frame: usb]
USB URB
    URB id: 0xffff88041783b780
    URB type: URB_SUBMIT ('S')
    URB transfer type: URB_BULK (0x03)
    Endpoint: 0x81, Direction: IN
        1... .... = Direction: IN (1)
        .000 0001 = Endpoint value: 1
    Device: 39
    URB bus id: 2
    Device setup request: not relevant ('-')
    Data: not present ('<')
    URB sec: 1424613627
    URB usec: 353196
    URB status: Operation now in progress (-EINPROGRESS) (-115)
    URB length [bytes]: 128
    Data length [bytes]: 0
    [bInterfaceClass: CDC-Data (0x0a)]

0000  80 b7 83 17 04 88 ff ff 53 03 81 27 02 00 2d 3c   ........S..'..-<
0010  fb e0 e9 54 00 00 00 00 ac 63 05 00 8d ff ff ff   ...T.....c......
0020  80 00 00 00 00 00 00 00 00 00 00 00 00 00 00 00   ................
0030  00 00 00 00 00 00 00 00 04 02 00 00 00 00 00 00   ................

No.     Time           Source                Destination           Protocol Length Info
   1854 10.674778000   host                  39.1                  USB      64     URB_BULK in

Frame 1854: 64 bytes on wire (512 bits), 64 bytes captured (512 bits) on interface 0
    Interface id: 0
    Encapsulation type: USB packets with Linux header and padding (115)
    Arrival Time: Feb 22, 2015 16:00:27.353197000 SAST
    [Time shift for this packet: 0.000000000 seconds]
    Epoch Time: 1424613627.353197000 seconds
    [Time delta from previous captured frame: 0.000001000 seconds]
    [Time delta from previous displayed frame: 0.000001000 seconds]
    [Time since reference or first frame: 10.674778000 seconds]
    Frame Number: 1854
    Frame Length: 64 bytes (512 bits)
    Capture Length: 64 bytes (512 bits)
    [Frame is marked: False]
    [Frame is ignored: False]
    [Protocols in frame: usb]
USB URB
    URB id: 0xffff8801c36f8600
    URB type: URB_SUBMIT ('S')
    URB transfer type: URB_BULK (0x03)
    Endpoint: 0x81, Direction: IN
        1... .... = Direction: IN (1)
        .000 0001 = Endpoint value: 1
    Device: 39
    URB bus id: 2
    Device setup request: not relevant ('-')
    Data: not present ('<')
    URB sec: 1424613627
    URB usec: 353197
    URB status: Operation now in progress (-EINPROGRESS) (-115)
    URB length [bytes]: 128
    Data length [bytes]: 0
    [bInterfaceClass: CDC-Data (0x0a)]

0000  00 86 6f c3 01 88 ff ff 53 03 81 27 02 00 2d 3c   ..o.....S..'..-<
0010  fb e0 e9 54 00 00 00 00 ad 63 05 00 8d ff ff ff   ...T.....c......
0020  80 00 00 00 00 00 00 00 00 00 00 00 00 00 00 00   ................
0030  00 00 00 00 00 00 00 00 04 02 00 00 00 00 00 00   ................

No.     Time           Source                Destination           Protocol Length Info
   1855 10.674779000   host                  39.1                  USB      64     URB_BULK in

Frame 1855: 64 bytes on wire (512 bits), 64 bytes captured (512 bits) on interface 0
    Interface id: 0
    Encapsulation type: USB packets with Linux header and padding (115)
    Arrival Time: Feb 22, 2015 16:00:27.353198000 SAST
    [Time shift for this packet: 0.000000000 seconds]
    Epoch Time: 1424613627.353198000 seconds
    [Time delta from previous captured frame: 0.000001000 seconds]
    [Time delta from previous displayed frame: 0.000001000 seconds]
    [Time since reference or first frame: 10.674779000 seconds]
    Frame Number: 1855
    Frame Length: 64 bytes (512 bits)
    Capture Length: 64 bytes (512 bits)
    [Frame is marked: False]
    [Frame is ignored: False]
    [Protocols in frame: usb]
USB URB
    URB id: 0xffff8801c36f8a80
    URB type: URB_SUBMIT ('S')
    URB transfer type: URB_BULK (0x03)
    Endpoint: 0x81, Direction: IN
        1... .... = Direction: IN (1)
        .000 0001 = Endpoint value: 1
    Device: 39
    URB bus id: 2
    Device setup request: not relevant ('-')
    Data: not present ('<')
    URB sec: 1424613627
    URB usec: 353198
    URB status: Operation now in progress (-EINPROGRESS) (-115)
    URB length [bytes]: 128
    Data length [bytes]: 0
    [bInterfaceClass: CDC-Data (0x0a)]

0000  80 8a 6f c3 01 88 ff ff 53 03 81 27 02 00 2d 3c   ..o.....S..'..-<
0010  fb e0 e9 54 00 00 00 00 ae 63 05 00 8d ff ff ff   ...T.....c......
0020  80 00 00 00 00 00 00 00 00 00 00 00 00 00 00 00   ................
0030  00 00 00 00 00 00 00 00 04 02 00 00 00 00 00 00   ................

No.     Time           Source                Destination           Protocol Length Info
   1856 10.674780000   host                  39.1                  USB      64     URB_BULK in

Frame 1856: 64 bytes on wire (512 bits), 64 bytes captured (512 bits) on interface 0
    Interface id: 0
    Encapsulation type: USB packets with Linux header and padding (115)
    Arrival Time: Feb 22, 2015 16:00:27.353199000 SAST
    [Time shift for this packet: 0.000000000 seconds]
    Epoch Time: 1424613627.353199000 seconds
    [Time delta from previous captured frame: 0.000001000 seconds]
    [Time delta from previous displayed frame: 0.000001000 seconds]
    [Time since reference or first frame: 10.674780000 seconds]
    Frame Number: 1856
    Frame Length: 64 bytes (512 bits)
    Capture Length: 64 bytes (512 bits)
    [Frame is marked: False]
    [Frame is ignored: False]
    [Protocols in frame: usb]
USB URB
    URB id: 0xffff8801c36f8180
    URB type: URB_SUBMIT ('S')
    URB transfer type: URB_BULK (0x03)
    Endpoint: 0x81, Direction: IN
        1... .... = Direction: IN (1)
        .000 0001 = Endpoint value: 1
    Device: 39
    URB bus id: 2
    Device setup request: not relevant ('-')
    Data: not present ('<')
    URB sec: 1424613627
    URB usec: 353199
    URB status: Operation now in progress (-EINPROGRESS) (-115)
    URB length [bytes]: 128
    Data length [bytes]: 0
    [bInterfaceClass: CDC-Data (0x0a)]

0000  80 81 6f c3 01 88 ff ff 53 03 81 27 02 00 2d 3c   ..o.....S..'..-<
0010  fb e0 e9 54 00 00 00 00 af 63 05 00 8d ff ff ff   ...T.....c......
0020  80 00 00 00 00 00 00 00 00 00 00 00 00 00 00 00   ................
0030  00 00 00 00 00 00 00 00 04 02 00 00 00 00 00 00   ................

No.     Time           Source                Destination           Protocol Length Info
   1857 10.674780000   host                  39.1                  USB      64     URB_BULK in

Frame 1857: 64 bytes on wire (512 bits), 64 bytes captured (512 bits) on interface 0
    Interface id: 0
    Encapsulation type: USB packets with Linux header and padding (115)
    Arrival Time: Feb 22, 2015 16:00:27.353199000 SAST
    [Time shift for this packet: 0.000000000 seconds]
    Epoch Time: 1424613627.353199000 seconds
    [Time delta from previous captured frame: 0.000000000 seconds]
    [Time delta from previous displayed frame: 0.000000000 seconds]
    [Time since reference or first frame: 10.674780000 seconds]
    Frame Number: 1857
    Frame Length: 64 bytes (512 bits)
    Capture Length: 64 bytes (512 bits)
    [Frame is marked: False]
    [Frame is ignored: False]
    [Protocols in frame: usb]
USB URB
    URB id: 0xffff8801c36f86c0
    URB type: URB_SUBMIT ('S')
    URB transfer type: URB_BULK (0x03)
    Endpoint: 0x81, Direction: IN
        1... .... = Direction: IN (1)
        .000 0001 = Endpoint value: 1
    Device: 39
    URB bus id: 2
    Device setup request: not relevant ('-')
    Data: not present ('<')
    URB sec: 1424613627
    URB usec: 353199
    URB status: Operation now in progress (-EINPROGRESS) (-115)
    URB length [bytes]: 128
    Data length [bytes]: 0
    [bInterfaceClass: CDC-Data (0x0a)]

0000  c0 86 6f c3 01 88 ff ff 53 03 81 27 02 00 2d 3c   ..o.....S..'..-<
0010  fb e0 e9 54 00 00 00 00 af 63 05 00 8d ff ff ff   ...T.....c......
0020  80 00 00 00 00 00 00 00 00 00 00 00 00 00 00 00   ................
0030  00 00 00 00 00 00 00 00 04 02 00 00 00 00 00 00   ................

No.     Time           Source                Destination           Protocol Length Info
   1858 10.674781000   host                  39.1                  USB      64     URB_BULK in

Frame 1858: 64 bytes on wire (512 bits), 64 bytes captured (512 bits) on interface 0
    Interface id: 0
    Encapsulation type: USB packets with Linux header and padding (115)
    Arrival Time: Feb 22, 2015 16:00:27.353200000 SAST
    [Time shift for this packet: 0.000000000 seconds]
    Epoch Time: 1424613627.353200000 seconds
    [Time delta from previous captured frame: 0.000001000 seconds]
    [Time delta from previous displayed frame: 0.000001000 seconds]
    [Time since reference or first frame: 10.674781000 seconds]
    Frame Number: 1858
    Frame Length: 64 bytes (512 bits)
    Capture Length: 64 bytes (512 bits)
    [Frame is marked: False]
    [Frame is ignored: False]
    [Protocols in frame: usb]
USB URB
    URB id: 0xffff8801c36f8480
    URB type: URB_SUBMIT ('S')
    URB transfer type: URB_BULK (0x03)
    Endpoint: 0x81, Direction: IN
        1... .... = Direction: IN (1)
        .000 0001 = Endpoint value: 1
    Device: 39
    URB bus id: 2
    Device setup request: not relevant ('-')
    Data: not present ('<')
    URB sec: 1424613627
    URB usec: 353200
    URB status: Operation now in progress (-EINPROGRESS) (-115)
    URB length [bytes]: 128
    Data length [bytes]: 0
    [bInterfaceClass: CDC-Data (0x0a)]

0000  80 84 6f c3 01 88 ff ff 53 03 81 27 02 00 2d 3c   ..o.....S..'..-<
0010  fb e0 e9 54 00 00 00 00 b0 63 05 00 8d ff ff ff   ...T.....c......
0020  80 00 00 00 00 00 00 00 00 00 00 00 00 00 00 00   ................
0030  00 00 00 00 00 00 00 00 04 02 00 00 00 00 00 00   ................

No.     Time           Source                Destination           Protocol Length Info
   1859 10.674782000   host                  39.1                  USB      64     URB_BULK in

Frame 1859: 64 bytes on wire (512 bits), 64 bytes captured (512 bits) on interface 0
    Interface id: 0
    Encapsulation type: USB packets with Linux header and padding (115)
    Arrival Time: Feb 22, 2015 16:00:27.353201000 SAST
    [Time shift for this packet: 0.000000000 seconds]
    Epoch Time: 1424613627.353201000 seconds
    [Time delta from previous captured frame: 0.000001000 seconds]
    [Time delta from previous displayed frame: 0.000001000 seconds]
    [Time since reference or first frame: 10.674782000 seconds]
    Frame Number: 1859
    Frame Length: 64 bytes (512 bits)
    Capture Length: 64 bytes (512 bits)
    [Frame is marked: False]
    [Frame is ignored: False]
    [Protocols in frame: usb]
USB URB
    URB id: 0xffff8801c36f8840
    URB type: URB_SUBMIT ('S')
    URB transfer type: URB_BULK (0x03)
    Endpoint: 0x81, Direction: IN
        1... .... = Direction: IN (1)
        .000 0001 = Endpoint value: 1
    Device: 39
    URB bus id: 2
    Device setup request: not relevant ('-')
    Data: not present ('<')
    URB sec: 1424613627
    URB usec: 353201
    URB status: Operation now in progress (-EINPROGRESS) (-115)
    URB length [bytes]: 128
    Data length [bytes]: 0
    [bInterfaceClass: CDC-Data (0x0a)]

0000  40 88 6f c3 01 88 ff ff 53 03 81 27 02 00 2d 3c   @.o.....S..'..-<
0010  fb e0 e9 54 00 00 00 00 b1 63 05 00 8d ff ff ff   ...T.....c......
0020  80 00 00 00 00 00 00 00 00 00 00 00 00 00 00 00   ................
0030  00 00 00 00 00 00 00 00 04 02 00 00 00 00 00 00   ................

No.     Time           Source                Destination           Protocol Length Info
   1860 10.674783000   host                  39.1                  USB      64     URB_BULK in

Frame 1860: 64 bytes on wire (512 bits), 64 bytes captured (512 bits) on interface 0
    Interface id: 0
    Encapsulation type: USB packets with Linux header and padding (115)
    Arrival Time: Feb 22, 2015 16:00:27.353202000 SAST
    [Time shift for this packet: 0.000000000 seconds]
    Epoch Time: 1424613627.353202000 seconds
    [Time delta from previous captured frame: 0.000001000 seconds]
    [Time delta from previous displayed frame: 0.000001000 seconds]
    [Time since reference or first frame: 10.674783000 seconds]
    Frame Number: 1860
    Frame Length: 64 bytes (512 bits)
    Capture Length: 64 bytes (512 bits)
    [Frame is marked: False]
    [Frame is ignored: False]
    [Protocols in frame: usb]
USB URB
    URB id: 0xffff8801c36f8000
    URB type: URB_SUBMIT ('S')
    URB transfer type: URB_BULK (0x03)
    Endpoint: 0x81, Direction: IN
        1... .... = Direction: IN (1)
        .000 0001 = Endpoint value: 1
    Device: 39
    URB bus id: 2
    Device setup request: not relevant ('-')
    Data: not present ('<')
    URB sec: 1424613627
    URB usec: 353202
    URB status: Operation now in progress (-EINPROGRESS) (-115)
    URB length [bytes]: 128
    Data length [bytes]: 0
    [bInterfaceClass: CDC-Data (0x0a)]

0000  00 80 6f c3 01 88 ff ff 53 03 81 27 02 00 2d 3c   ..o.....S..'..-<
0010  fb e0 e9 54 00 00 00 00 b2 63 05 00 8d ff ff ff   ...T.....c......
0020  80 00 00 00 00 00 00 00 00 00 00 00 00 00 00 00   ................
0030  00 00 00 00 00 00 00 00 04 02 00 00 00 00 00 00   ................

No.     Time           Source                Destination           Protocol Length Info
   1861 10.674783000   host                  39.1                  USB      64     URB_BULK in

Frame 1861: 64 bytes on wire (512 bits), 64 bytes captured (512 bits) on interface 0
    Interface id: 0
    Encapsulation type: USB packets with Linux header and padding (115)
    Arrival Time: Feb 22, 2015 16:00:27.353202000 SAST
    [Time shift for this packet: 0.000000000 seconds]
    Epoch Time: 1424613627.353202000 seconds
    [Time delta from previous captured frame: 0.000000000 seconds]
    [Time delta from previous displayed frame: 0.000000000 seconds]
    [Time since reference or first frame: 10.674783000 seconds]
    Frame Number: 1861
    Frame Length: 64 bytes (512 bits)
    Capture Length: 64 bytes (512 bits)
    [Frame is marked: False]
    [Frame is ignored: False]
    [Protocols in frame: usb]
USB URB
    URB id: 0xffff8801c36f80c0
    URB type: URB_SUBMIT ('S')
    URB transfer type: URB_BULK (0x03)
    Endpoint: 0x81, Direction: IN
        1... .... = Direction: IN (1)
        .000 0001 = Endpoint value: 1
    Device: 39
    URB bus id: 2
    Device setup request: not relevant ('-')
    Data: not present ('<')
    URB sec: 1424613627
    URB usec: 353202
    URB status: Operation now in progress (-EINPROGRESS) (-115)
    URB length [bytes]: 128
    Data length [bytes]: 0
    [bInterfaceClass: CDC-Data (0x0a)]

0000  c0 80 6f c3 01 88 ff ff 53 03 81 27 02 00 2d 3c   ..o.....S..'..-<
0010  fb e0 e9 54 00 00 00 00 b2 63 05 00 8d ff ff ff   ...T.....c......
0020  80 00 00 00 00 00 00 00 00 00 00 00 00 00 00 00   ................
0030  00 00 00 00 00 00 00 00 04 02 00 00 00 00 00 00   ................

No.     Time           Source                Destination           Protocol Length Info
   1862 10.674784000   host                  39.1                  USB      64     URB_BULK in

Frame 1862: 64 bytes on wire (512 bits), 64 bytes captured (512 bits) on interface 0
    Interface id: 0
    Encapsulation type: USB packets with Linux header and padding (115)
    Arrival Time: Feb 22, 2015 16:00:27.353203000 SAST
    [Time shift for this packet: 0.000000000 seconds]
    Epoch Time: 1424613627.353203000 seconds
    [Time delta from previous captured frame: 0.000001000 seconds]
    [Time delta from previous displayed frame: 0.000001000 seconds]
    [Time since reference or first frame: 10.674784000 seconds]
    Frame Number: 1862
    Frame Length: 64 bytes (512 bits)
    Capture Length: 64 bytes (512 bits)
    [Frame is marked: False]
    [Frame is ignored: False]
    [Protocols in frame: usb]
USB URB
    URB id: 0xffff8801c36f89c0
    URB type: URB_SUBMIT ('S')
    URB transfer type: URB_BULK (0x03)
    Endpoint: 0x81, Direction: IN
        1... .... = Direction: IN (1)
        .000 0001 = Endpoint value: 1
    Device: 39
    URB bus id: 2
    Device setup request: not relevant ('-')
    Data: not present ('<')
    URB sec: 1424613627
    URB usec: 353203
    URB status: Operation now in progress (-EINPROGRESS) (-115)
    URB length [bytes]: 128
    Data length [bytes]: 0
    [bInterfaceClass: CDC-Data (0x0a)]

0000  c0 89 6f c3 01 88 ff ff 53 03 81 27 02 00 2d 3c   ..o.....S..'..-<
0010  fb e0 e9 54 00 00 00 00 b3 63 05 00 8d ff ff ff   ...T.....c......
0020  80 00 00 00 00 00 00 00 00 00 00 00 00 00 00 00   ................
0030  00 00 00 00 00 00 00 00 04 02 00 00 00 00 00 00   ................

No.     Time           Source                Destination           Protocol Length Info
   1863 10.674785000   host                  39.1                  USB      64     URB_BULK in

Frame 1863: 64 bytes on wire (512 bits), 64 bytes captured (512 bits) on interface 0
    Interface id: 0
    Encapsulation type: USB packets with Linux header and padding (115)
    Arrival Time: Feb 22, 2015 16:00:27.353204000 SAST
    [Time shift for this packet: 0.000000000 seconds]
    Epoch Time: 1424613627.353204000 seconds
    [Time delta from previous captured frame: 0.000001000 seconds]
    [Time delta from previous displayed frame: 0.000001000 seconds]
    [Time since reference or first frame: 10.674785000 seconds]
    Frame Number: 1863
    Frame Length: 64 bytes (512 bits)
    Capture Length: 64 bytes (512 bits)
    [Frame is marked: False]
    [Frame is ignored: False]
    [Protocols in frame: usb]
USB URB
    URB id: 0xffff8801c36f8e40
    URB type: URB_SUBMIT ('S')
    URB transfer type: URB_BULK (0x03)
    Endpoint: 0x81, Direction: IN
        1... .... = Direction: IN (1)
        .000 0001 = Endpoint value: 1
    Device: 39
    URB bus id: 2
    Device setup request: not relevant ('-')
    Data: not present ('<')
    URB sec: 1424613627
    URB usec: 353204
    URB status: Operation now in progress (-EINPROGRESS) (-115)
    URB length [bytes]: 128
    Data length [bytes]: 0
    [bInterfaceClass: CDC-Data (0x0a)]

0000  40 8e 6f c3 01 88 ff ff 53 03 81 27 02 00 2d 3c   @.o.....S..'..-<
0010  fb e0 e9 54 00 00 00 00 b4 63 05 00 8d ff ff ff   ...T.....c......
0020  80 00 00 00 00 00 00 00 00 00 00 00 00 00 00 00   ................
0030  00 00 00 00 00 00 00 00 04 02 00 00 00 00 00 00   ................

No.     Time           Source                Destination           Protocol Length Info
   1864 10.674786000   host                  39.1                  USB      64     URB_BULK in

Frame 1864: 64 bytes on wire (512 bits), 64 bytes captured (512 bits) on interface 0
    Interface id: 0
    Encapsulation type: USB packets with Linux header and padding (115)
    Arrival Time: Feb 22, 2015 16:00:27.353205000 SAST
    [Time shift for this packet: 0.000000000 seconds]
    Epoch Time: 1424613627.353205000 seconds
    [Time delta from previous captured frame: 0.000001000 seconds]
    [Time delta from previous displayed frame: 0.000001000 seconds]
    [Time since reference or first frame: 10.674786000 seconds]
    Frame Number: 1864
    Frame Length: 64 bytes (512 bits)
    Capture Length: 64 bytes (512 bits)
    [Frame is marked: False]
    [Frame is ignored: False]
    [Protocols in frame: usb]
USB URB
    URB id: 0xffff8801c36f8300
    URB type: URB_SUBMIT ('S')
    URB transfer type: URB_BULK (0x03)
    Endpoint: 0x81, Direction: IN
        1... .... = Direction: IN (1)
        .000 0001 = Endpoint value: 1
    Device: 39
    URB bus id: 2
    Device setup request: not relevant ('-')
    Data: not present ('<')
    URB sec: 1424613627
    URB usec: 353205
    URB status: Operation now in progress (-EINPROGRESS) (-115)
    URB length [bytes]: 128
    Data length [bytes]: 0
    [bInterfaceClass: CDC-Data (0x0a)]

0000  00 83 6f c3 01 88 ff ff 53 03 81 27 02 00 2d 3c   ..o.....S..'..-<
0010  fb e0 e9 54 00 00 00 00 b5 63 05 00 8d ff ff ff   ...T.....c......
0020  80 00 00 00 00 00 00 00 00 00 00 00 00 00 00 00   ................
0030  00 00 00 00 00 00 00 00 04 02 00 00 00 00 00 00   ................

No.     Time           Source                Destination           Protocol Length Info
   1865 10.674786000   host                  39.1                  USB      64     URB_BULK in

Frame 1865: 64 bytes on wire (512 bits), 64 bytes captured (512 bits) on interface 0
    Interface id: 0
    Encapsulation type: USB packets with Linux header and padding (115)
    Arrival Time: Feb 22, 2015 16:00:27.353205000 SAST
    [Time shift for this packet: 0.000000000 seconds]
    Epoch Time: 1424613627.353205000 seconds
    [Time delta from previous captured frame: 0.000000000 seconds]
    [Time delta from previous displayed frame: 0.000000000 seconds]
    [Time since reference or first frame: 10.674786000 seconds]
    Frame Number: 1865
    Frame Length: 64 bytes (512 bits)
    Capture Length: 64 bytes (512 bits)
    [Frame is marked: False]
    [Frame is ignored: False]
    [Protocols in frame: usb]
USB URB
    URB id: 0xffff8801c36f8c00
    URB type: URB_SUBMIT ('S')
    URB transfer type: URB_BULK (0x03)
    Endpoint: 0x81, Direction: IN
        1... .... = Direction: IN (1)
        .000 0001 = Endpoint value: 1
    Device: 39
    URB bus id: 2
    Device setup request: not relevant ('-')
    Data: not present ('<')
    URB sec: 1424613627
    URB usec: 353205
    URB status: Operation now in progress (-EINPROGRESS) (-115)
    URB length [bytes]: 128
    Data length [bytes]: 0
    [bInterfaceClass: CDC-Data (0x0a)]

0000  00 8c 6f c3 01 88 ff ff 53 03 81 27 02 00 2d 3c   ..o.....S..'..-<
0010  fb e0 e9 54 00 00 00 00 b5 63 05 00 8d ff ff ff   ...T.....c......
0020  80 00 00 00 00 00 00 00 00 00 00 00 00 00 00 00   ................
0030  00 00 00 00 00 00 00 00 04 02 00 00 00 00 00 00   ................

No.     Time           Source                Destination           Protocol Length Info
   1866 10.674787000   host                  39.1                  USB      64     URB_BULK in

Frame 1866: 64 bytes on wire (512 bits), 64 bytes captured (512 bits) on interface 0
    Interface id: 0
    Encapsulation type: USB packets with Linux header and padding (115)
    Arrival Time: Feb 22, 2015 16:00:27.353206000 SAST
    [Time shift for this packet: 0.000000000 seconds]
    Epoch Time: 1424613627.353206000 seconds
    [Time delta from previous captured frame: 0.000001000 seconds]
    [Time delta from previous displayed frame: 0.000001000 seconds]
    [Time since reference or first frame: 10.674787000 seconds]
    Frame Number: 1866
    Frame Length: 64 bytes (512 bits)
    Capture Length: 64 bytes (512 bits)
    [Frame is marked: False]
    [Frame is ignored: False]
    [Protocols in frame: usb]
USB URB
    URB id: 0xffff8802c1cd1b40
    URB type: URB_SUBMIT ('S')
    URB transfer type: URB_BULK (0x03)
    Endpoint: 0x81, Direction: IN
        1... .... = Direction: IN (1)
        .000 0001 = Endpoint value: 1
    Device: 39
    URB bus id: 2
    Device setup request: not relevant ('-')
    Data: not present ('<')
    URB sec: 1424613627
    URB usec: 353206
    URB status: Operation now in progress (-EINPROGRESS) (-115)
    URB length [bytes]: 128
    Data length [bytes]: 0
    [bInterfaceClass: CDC-Data (0x0a)]

0000  40 1b cd c1 02 88 ff ff 53 03 81 27 02 00 2d 3c   @.......S..'..-<
0010  fb e0 e9 54 00 00 00 00 b6 63 05 00 8d ff ff ff   ...T.....c......
0020  80 00 00 00 00 00 00 00 00 00 00 00 00 00 00 00   ................
0030  00 00 00 00 00 00 00 00 04 02 00 00 00 00 00 00   ................

No.     Time           Source                Destination           Protocol Length Info
   1867 10.674788000   host                  39.1                  USB      64     URB_BULK in

Frame 1867: 64 bytes on wire (512 bits), 64 bytes captured (512 bits) on interface 0
    Interface id: 0
    Encapsulation type: USB packets with Linux header and padding (115)
    Arrival Time: Feb 22, 2015 16:00:27.353207000 SAST
    [Time shift for this packet: 0.000000000 seconds]
    Epoch Time: 1424613627.353207000 seconds
    [Time delta from previous captured frame: 0.000001000 seconds]
    [Time delta from previous displayed frame: 0.000001000 seconds]
    [Time since reference or first frame: 10.674788000 seconds]
    Frame Number: 1867
    Frame Length: 64 bytes (512 bits)
    Capture Length: 64 bytes (512 bits)
    [Frame is marked: False]
    [Frame is ignored: False]
    [Protocols in frame: usb]
USB URB
    URB id: 0xffff8802c1cd1a80
    URB type: URB_SUBMIT ('S')
    URB transfer type: URB_BULK (0x03)
    Endpoint: 0x81, Direction: IN
        1... .... = Direction: IN (1)
        .000 0001 = Endpoint value: 1
    Device: 39
    URB bus id: 2
    Device setup request: not relevant ('-')
    Data: not present ('<')
    URB sec: 1424613627
    URB usec: 353207
    URB status: Operation now in progress (-EINPROGRESS) (-115)
    URB length [bytes]: 128
    Data length [bytes]: 0
    [bInterfaceClass: CDC-Data (0x0a)]

0000  80 1a cd c1 02 88 ff ff 53 03 81 27 02 00 2d 3c   ........S..'..-<
0010  fb e0 e9 54 00 00 00 00 b7 63 05 00 8d ff ff ff   ...T.....c......
0020  80 00 00 00 00 00 00 00 00 00 00 00 00 00 00 00   ................
0030  00 00 00 00 00 00 00 00 04 02 00 00 00 00 00 00   ................

No.     Time           Source                Destination           Protocol Length Info
   1868 10.674803000   host                  39.0                  USB      71     URB_CONTROL out

Frame 1868: 71 bytes on wire (568 bits), 71 bytes captured (568 bits) on interface 0
    Interface id: 0
    Encapsulation type: USB packets with Linux header and padding (115)
    Arrival Time: Feb 22, 2015 16:00:27.353222000 SAST
    [Time shift for this packet: 0.000000000 seconds]
    Epoch Time: 1424613627.353222000 seconds
    [Time delta from previous captured frame: 0.000015000 seconds]
    [Time delta from previous displayed frame: 0.000015000 seconds]
    [Time since reference or first frame: 10.674803000 seconds]
    Frame Number: 1868
    Frame Length: 71 bytes (568 bits)
    Capture Length: 71 bytes (568 bits)
    [Frame is marked: False]
    [Frame is ignored: False]
    [Protocols in frame: usb]
USB URB
    URB id: 0xffff8802c1f35f00
    URB type: URB_SUBMIT ('S')
    URB transfer type: URB_CONTROL (0x02)
    Endpoint: 0x00, Direction: OUT
        0... .... = Direction: OUT (0)
        .000 0000 = Endpoint value: 0
    Device: 39
    URB bus id: 2
    Device setup request: relevant (0)
    Data: present (0)
    URB sec: 1424613627
    URB usec: 353222
    URB status: Operation now in progress (-EINPROGRESS) (-115)
    URB length [bytes]: 7
    Data length [bytes]: 7
    [Response in: 1869]
    [bInterfaceClass: Communications and CDC Control (0x02)]
URB setup
    bmRequestType: 0x21
        0... .... = Direction: Host-to-device
        .01. .... = Type: Class (0x01)
        ...0 0001 = Recipient: Interface (0x01)
    bRequest: 32
    wValue: 0x0000
    wIndex: 0
    wLength: 7
Leftover Capture Data: 00c20100000008

0000  00 5f f3 c1 02 88 ff ff 53 02 00 27 02 00 00 00   ._......S..'....
0010  fb e0 e9 54 00 00 00 00 c6 63 05 00 8d ff ff ff   ...T.....c......
0020  07 00 00 00 07 00 00 00 21 20 00 00 00 00 07 00   ........! ......
0030  00 00 00 00 00 00 00 00 00 00 00 00 00 00 00 00   ................
0040  00 c2 01 00 00 00 08                              .......

No.     Time           Source                Destination           Protocol Length Info
   1869 10.675039000   39.0                  host                  USB      64     URB_CONTROL out

Frame 1869: 64 bytes on wire (512 bits), 64 bytes captured (512 bits) on interface 0
    Interface id: 0
    Encapsulation type: USB packets with Linux header and padding (115)
    Arrival Time: Feb 22, 2015 16:00:27.353458000 SAST
    [Time shift for this packet: 0.000000000 seconds]
    Epoch Time: 1424613627.353458000 seconds
    [Time delta from previous captured frame: 0.000236000 seconds]
    [Time delta from previous displayed frame: 0.000236000 seconds]
    [Time since reference or first frame: 10.675039000 seconds]
    Frame Number: 1869
    Frame Length: 64 bytes (512 bits)
    Capture Length: 64 bytes (512 bits)
    [Frame is marked: False]
    [Frame is ignored: False]
    [Protocols in frame: usb]
USB URB
    URB id: 0xffff8802c1f35f00
    URB type: URB_COMPLETE ('C')
    URB transfer type: URB_CONTROL (0x02)
    Endpoint: 0x00, Direction: OUT
        0... .... = Direction: OUT (0)
        .000 0000 = Endpoint value: 0
    Device: 39
    URB bus id: 2
    Device setup request: not relevant ('-')
    Data: not present ('>')
    URB sec: 1424613627
    URB usec: 353458
    URB status: Success (0)
    URB length [bytes]: 7
    Data length [bytes]: 0
    [Request in: 1868]
    [Time from request: 0.000236000 seconds]
    [bInterfaceClass: Communications and CDC Control (0x02)]

0000  00 5f f3 c1 02 88 ff ff 43 02 00 27 02 00 2d 3e   ._......C..'..->
0010  fb e0 e9 54 00 00 00 00 b2 64 05 00 00 00 00 00   ...T.....d......
0020  07 00 00 00 00 00 00 00 00 00 00 00 00 00 00 00   ................
0030  00 00 00 00 00 00 00 00 00 00 00 00 00 00 00 00   ................

No.     Time           Source                Destination           Protocol Length Info
   1870 10.675140000   host                  39.1                  0x0078   69     PPP Unknown (0x0078)

Frame 1870: 69 bytes on wire (552 bits), 69 bytes captured (552 bits) on interface 0
    Interface id: 0
    Encapsulation type: USB packets with Linux header and padding (115)
    Arrival Time: Feb 22, 2015 16:00:27.353559000 SAST
    [Time shift for this packet: 0.000000000 seconds]
    Epoch Time: 1424613627.353559000 seconds
    [Time delta from previous captured frame: 0.000101000 seconds]
    [Time delta from previous displayed frame: 0.000101000 seconds]
    [Time since reference or first frame: 10.675140000 seconds]
    Frame Number: 1870
    Frame Length: 69 bytes (552 bits)
    Capture Length: 69 bytes (552 bits)
    [Frame is marked: False]
    [Frame is ignored: False]
    [Protocols in frame: usb:ppp:data]
USB URB
    URB id: 0xffff8802c1cd1cc0
    URB type: URB_SUBMIT ('S')
    URB transfer type: URB_BULK (0x03)
    Endpoint: 0x01, Direction: OUT
        0... .... = Direction: OUT (0)
        .000 0001 = Endpoint value: 1
    Device: 39
    URB bus id: 2
    Device setup request: not relevant ('-')
    Data: present (0)
    URB sec: 1424613627
    URB usec: 353559
    URB status: Operation now in progress (-EINPROGRESS) (-115)
    URB length [bytes]: 5
    Data length [bytes]: 5
    [Response in: 1871]
    [bInterfaceClass: CDC-Data (0x0a)]
Point-to-Point Protocol
    Protocol: Unknown (0x0078)
Data (2 bytes)
    Data: f07e
    [Length: 2]

0000  c0 1c cd c1 02 88 ff ff 53 03 01 27 02 00 2d 00   ........S..'..-.
0010  fb e0 e9 54 00 00 00 00 17 65 05 00 8d ff ff ff   ...T.....e......
0020  05 00 00 00 05 00 00 00 00 00 00 00 00 00 00 00   ................
0030  00 00 00 00 00 00 00 00 04 00 00 00 00 00 00 00   ................
0040  7e 00 78 f0 7e                                    ~.x.~

No.     Time           Source                Destination           Protocol Length Info
   1871 10.675259000   39.1                  host                  USB      64     URB_BULK out

Frame 1871: 64 bytes on wire (512 bits), 64 bytes captured (512 bits) on interface 0
    Interface id: 0
    Encapsulation type: USB packets with Linux header and padding (115)
    Arrival Time: Feb 22, 2015 16:00:27.353678000 SAST
    [Time shift for this packet: 0.000000000 seconds]
    Epoch Time: 1424613627.353678000 seconds
    [Time delta from previous captured frame: 0.000119000 seconds]
    [Time delta from previous displayed frame: 0.000119000 seconds]
    [Time since reference or first frame: 10.675259000 seconds]
    Frame Number: 1871
    Frame Length: 64 bytes (512 bits)
    Capture Length: 64 bytes (512 bits)
    [Frame is marked: False]
    [Frame is ignored: False]
    [Protocols in frame: usb]
USB URB
    URB id: 0xffff8802c1cd1cc0
    URB type: URB_COMPLETE ('C')
    URB transfer type: URB_BULK (0x03)
    Endpoint: 0x01, Direction: OUT
        0... .... = Direction: OUT (0)
        .000 0001 = Endpoint value: 1
    Device: 39
    URB bus id: 2
    Device setup request: not relevant ('-')
    Data: not present ('>')
    URB sec: 1424613627
    URB usec: 353678
    URB status: Success (0)
    URB length [bytes]: 5
    Data length [bytes]: 0
    [Request in: 1870]
    [Time from request: 0.000119000 seconds]
    [bInterfaceClass: CDC-Data (0x0a)]

0000  c0 1c cd c1 02 88 ff ff 43 03 01 27 02 00 2d 3e   ........C..'..->
0010  fb e0 e9 54 00 00 00 00 8e 65 05 00 00 00 00 00   ...T.....e......
0020  05 00 00 00 00 00 00 00 00 00 00 00 00 00 00 00   ................
0030  00 00 00 00 00 00 00 00 04 00 00 00 00 00 00 00   ................

No.     Time           Source                Destination           Protocol Length Info
   2380 13.670329000   host                  39.1                  0x0078   69     PPP Unknown (0x0078)

Frame 2380: 69 bytes on wire (552 bits), 69 bytes captured (552 bits) on interface 0
    Interface id: 0
    Encapsulation type: USB packets with Linux header and padding (115)
    Arrival Time: Feb 22, 2015 16:00:30.348748000 SAST
    [Time shift for this packet: 0.000000000 seconds]
    Epoch Time: 1424613630.348748000 seconds
    [Time delta from previous captured frame: 0.004390000 seconds]
    [Time delta from previous displayed frame: 2.995070000 seconds]
    [Time since reference or first frame: 13.670329000 seconds]
    Frame Number: 2380
    Frame Length: 69 bytes (552 bits)
    Capture Length: 69 bytes (552 bits)
    [Frame is marked: False]
    [Frame is ignored: False]
    [Protocols in frame: usb:ppp:data]
USB URB
    URB id: 0xffff8802c1cd1cc0
    URB type: URB_SUBMIT ('S')
    URB transfer type: URB_BULK (0x03)
    Endpoint: 0x01, Direction: OUT
        0... .... = Direction: OUT (0)
        .000 0001 = Endpoint value: 1
    Device: 39
    URB bus id: 2
    Device setup request: not relevant ('-')
    Data: present (0)
    URB sec: 1424613630
    URB usec: 348748
    URB status: Operation now in progress (-EINPROGRESS) (-115)
    URB length [bytes]: 5
    Data length [bytes]: 5
    [Response in: 2823]
    [bInterfaceClass: CDC-Data (0x0a)]
Point-to-Point Protocol
    Protocol: Unknown (0x0078)
Data (2 bytes)
    Data: f07e
    [Length: 2]

0000  c0 1c cd c1 02 88 ff ff 53 03 01 27 02 00 2d 00   ........S..'..-.
0010  fe e0 e9 54 00 00 00 00 4c 52 05 00 8d ff ff ff   ...T....LR......
0020  05 00 00 00 05 00 00 00 00 00 00 00 00 00 00 00   ................
0030  00 00 00 00 00 00 00 00 04 00 00 00 00 00 00 00   ................
0040  7e 00 78 f0 7e                                    ~.x.~

No.     Time           Source                Destination           Protocol Length Info
   2381 13.670463000   39.1                  host                  USB      64     URB_BULK out

Frame 2381: 64 bytes on wire (512 bits), 64 bytes captured (512 bits) on interface 0
    Interface id: 0
    Encapsulation type: USB packets with Linux header and padding (115)
    Arrival Time: Feb 22, 2015 16:00:30.348882000 SAST
    [Time shift for this packet: 0.000000000 seconds]
    Epoch Time: 1424613630.348882000 seconds
    [Time delta from previous captured frame: 0.000134000 seconds]
    [Time delta from previous displayed frame: 0.000134000 seconds]
    [Time since reference or first frame: 13.670463000 seconds]
    Frame Number: 2381
    Frame Length: 64 bytes (512 bits)
    Capture Length: 64 bytes (512 bits)
    [Frame is marked: False]
    [Frame is ignored: False]
    [Protocols in frame: usb]
USB URB
    URB id: 0xffff8802c1cd1cc0
    URB type: URB_COMPLETE ('C')
    URB transfer type: URB_BULK (0x03)
    Endpoint: 0x01, Direction: OUT
        0... .... = Direction: OUT (0)
        .000 0001 = Endpoint value: 1
    Device: 39
    URB bus id: 2
    Device setup request: not relevant ('-')
    Data: not present ('>')
    URB sec: 1424613630
    URB usec: 348882
    URB status: Success (0)
    URB length [bytes]: 5
    Data length [bytes]: 0
    [Request in: 2380]
    [Time from request: 0.000134000 seconds]
    [bInterfaceClass: CDC-Data (0x0a)]

0000  c0 1c cd c1 02 88 ff ff 43 03 01 27 02 00 2d 3e   ........C..'..->
0010  fe e0 e9 54 00 00 00 00 d2 52 05 00 00 00 00 00   ...T.....R......
0020  05 00 00 00 00 00 00 00 00 00 00 00 00 00 00 00   ................
0030  00 00 00 00 00 00 00 00 04 00 00 00 00 00 00 00   ................

No.     Time           Source                Destination           Protocol Length Info
   2796 16.671424000   host                  39.0                  USB      64     URB_CONTROL out

Frame 2796: 64 bytes on wire (512 bits), 64 bytes captured (512 bits) on interface 0
    Interface id: 0
    Encapsulation type: USB packets with Linux header and padding (115)
    Arrival Time: Feb 22, 2015 16:00:33.349843000 SAST
    [Time shift for this packet: 0.000000000 seconds]
    Epoch Time: 1424613633.349843000 seconds
    [Time delta from previous captured frame: 0.005494000 seconds]
    [Time delta from previous displayed frame: 3.000961000 seconds]
    [Time since reference or first frame: 16.671424000 seconds]
    Frame Number: 2796
    Frame Length: 64 bytes (512 bits)
    Capture Length: 64 bytes (512 bits)
    [Frame is marked: False]
    [Frame is ignored: False]
    [Protocols in frame: usb]
USB URB
    URB id: 0xffff8800c2074540
    URB type: URB_SUBMIT ('S')
    URB transfer type: URB_CONTROL (0x02)
    Endpoint: 0x00, Direction: OUT
        0... .... = Direction: OUT (0)
        .000 0000 = Endpoint value: 0
    Device: 39
    URB bus id: 2
    Device setup request: relevant (0)
    Data: present (0)
    URB sec: 1424613633
    URB usec: 349843
    URB status: Operation now in progress (-EINPROGRESS) (-115)
    URB length [bytes]: 0
    Data length [bytes]: 0
    [Response in: 2797]
    [bInterfaceClass: Communications and CDC Control (0x02)]
URB setup
    bmRequestType: 0x21
        0... .... = Direction: Host-to-device
        .01. .... = Type: Class (0x01)
        ...0 0001 = Recipient: Interface (0x01)
    bRequest: 34
    wValue: 0x0000
    wIndex: 0
    wLength: 0

0000  40 45 07 c2 00 88 ff ff 53 02 00 27 02 00 00 00   @E......S..'....
0010  01 e1 e9 54 00 00 00 00 93 56 05 00 8d ff ff ff   ...T.....V......
0020  00 00 00 00 00 00 00 00 21 22 00 00 00 00 00 00   ........!"......
0030  00 00 00 00 00 00 00 00 00 00 00 00 00 00 00 00   ................

No.     Time           Source                Destination           Protocol Length Info
   2797 16.671570000   39.0                  host                  USB      64     URB_CONTROL out

Frame 2797: 64 bytes on wire (512 bits), 64 bytes captured (512 bits) on interface 0
    Interface id: 0
    Encapsulation type: USB packets with Linux header and padding (115)
    Arrival Time: Feb 22, 2015 16:00:33.349989000 SAST
    [Time shift for this packet: 0.000000000 seconds]
    Epoch Time: 1424613633.349989000 seconds
    [Time delta from previous captured frame: 0.000146000 seconds]
    [Time delta from previous displayed frame: 0.000146000 seconds]
    [Time since reference or first frame: 16.671570000 seconds]
    Frame Number: 2797
    Frame Length: 64 bytes (512 bits)
    Capture Length: 64 bytes (512 bits)
    [Frame is marked: False]
    [Frame is ignored: False]
    [Protocols in frame: usb]
USB URB
    URB id: 0xffff8800c2074540
    URB type: URB_COMPLETE ('C')
    URB transfer type: URB_CONTROL (0x02)
    Endpoint: 0x00, Direction: OUT
        0... .... = Direction: OUT (0)
        .000 0000 = Endpoint value: 0
    Device: 39
    URB bus id: 2
    Device setup request: not relevant ('-')
    Data: not present ('>')
    URB sec: 1424613633
    URB usec: 349989
    URB status: Success (0)
    URB length [bytes]: 0
    Data length [bytes]: 0
    [Request in: 2796]
    [Time from request: 0.000146000 seconds]
    [bInterfaceClass: Communications and CDC Control (0x02)]

0000  40 45 07 c2 00 88 ff ff 43 02 00 27 02 00 2d 3e   @E......C..'..->
0010  01 e1 e9 54 00 00 00 00 25 57 05 00 00 00 00 00   ...T....%W......
0020  00 00 00 00 00 00 00 00 00 00 00 00 00 00 00 00   ................
0030  00 00 00 00 00 00 00 00 00 00 00 00 00 00 00 00   ................

No.     Time           Source                Destination           Protocol Length Info
   2798 16.673789000   39.2                  host                  USB      64     URB_INTERRUPT in

Frame 2798: 64 bytes on wire (512 bits), 64 bytes captured (512 bits) on interface 0
    Interface id: 0
    Encapsulation type: USB packets with Linux header and padding (115)
    Arrival Time: Feb 22, 2015 16:00:33.352208000 SAST
    [Time shift for this packet: 0.000000000 seconds]
    Epoch Time: 1424613633.352208000 seconds
    [Time delta from previous captured frame: 0.002219000 seconds]
    [Time delta from previous displayed frame: 0.002219000 seconds]
    [Time since reference or first frame: 16.673789000 seconds]
    Frame Number: 2798
    Frame Length: 64 bytes (512 bits)
    Capture Length: 64 bytes (512 bits)
    [Frame is marked: False]
    [Frame is ignored: False]
    [Protocols in frame: usb]
USB URB
    URB id: 0xffff880220b5a240
    URB type: URB_COMPLETE ('C')
    URB transfer type: URB_INTERRUPT (0x01)
    Endpoint: 0x82, Direction: IN
        1... .... = Direction: IN (1)
        .000 0010 = Endpoint value: 2
    Device: 39
    URB bus id: 2
    Device setup request: not relevant ('-')
    Data: present (0)
    URB sec: 1424613633
    URB usec: 352208
    URB status: No such file or directory (-ENOENT) (-2)
    URB length [bytes]: 0
    Data length [bytes]: 0
    [Request in: 1849]
    [Time from request: 5.999199000 seconds]
    [bInterfaceClass: Communications and CDC Control (0x02)]

0000  40 a2 b5 20 02 88 ff ff 43 01 82 27 02 00 2d 00   @.. ....C..'..-.
0010  01 e1 e9 54 00 00 00 00 d0 5f 05 00 fe ff ff ff   ...T....._......
0020  00 00 00 00 00 00 00 00 00 00 00 00 00 00 00 00   ................
0030  10 00 00 00 00 00 00 00 04 02 00 00 00 00 00 00   ................

No.     Time           Source                Destination           Protocol Length Info
   2801 16.674097000   39.1                  host                  USB      64     URB_BULK in

Frame 2801: 64 bytes on wire (512 bits), 64 bytes captured (512 bits) on interface 0
    Interface id: 0
    Encapsulation type: USB packets with Linux header and padding (115)
    Arrival Time: Feb 22, 2015 16:00:33.352516000 SAST
    [Time shift for this packet: 0.000000000 seconds]
    Epoch Time: 1424613633.352516000 seconds
    [Time delta from previous captured frame: 0.000241000 seconds]
    [Time delta from previous displayed frame: 0.000308000 seconds]
    [Time since reference or first frame: 16.674097000 seconds]
    Frame Number: 2801
    Frame Length: 64 bytes (512 bits)
    Capture Length: 64 bytes (512 bits)
    [Frame is marked: False]
    [Frame is ignored: False]
    [Protocols in frame: usb]
USB URB
    URB id: 0xffff88041783b9c0
    URB type: URB_COMPLETE ('C')
    URB transfer type: URB_BULK (0x03)
    Endpoint: 0x81, Direction: IN
        1... .... = Direction: IN (1)
        .000 0001 = Endpoint value: 1
    Device: 39
    URB bus id: 2
    Device setup request: not relevant ('-')
    Data: present (0)
    URB sec: 1424613633
    URB usec: 352516
    URB status: No such file or directory (-ENOENT) (-2)
    URB length [bytes]: 0
    Data length [bytes]: 0
    [Request in: 2380]
    [Time from request: 3.003768000 seconds]
    [bInterfaceClass: CDC-Data (0x0a)]

0000  c0 b9 83 17 04 88 ff ff 43 03 81 27 02 00 2d 00   ........C..'..-.
0010  01 e1 e9 54 00 00 00 00 04 61 05 00 fe ff ff ff   ...T.....a......
0020  00 00 00 00 00 00 00 00 00 00 00 00 00 00 00 00   ................
0030  00 00 00 00 00 00 00 00 04 02 00 00 00 00 00 00   ................

No.     Time           Source                Destination           Protocol Length Info
   2803 16.674141000   39.1                  host                  USB      64     URB_BULK in

Frame 2803: 64 bytes on wire (512 bits), 64 bytes captured (512 bits) on interface 0
    Interface id: 0
    Encapsulation type: USB packets with Linux header and padding (115)
    Arrival Time: Feb 22, 2015 16:00:33.352560000 SAST
    [Time shift for this packet: 0.000000000 seconds]
    Epoch Time: 1424613633.352560000 seconds
    [Time delta from previous captured frame: 0.000031000 seconds]
    [Time delta from previous displayed frame: 0.000044000 seconds]
    [Time since reference or first frame: 16.674141000 seconds]
    Frame Number: 2803
    Frame Length: 64 bytes (512 bits)
    Capture Length: 64 bytes (512 bits)
    [Frame is marked: False]
    [Frame is ignored: False]
    [Protocols in frame: usb]
USB URB
    URB id: 0xffff88041783b780
    URB type: URB_COMPLETE ('C')
    URB transfer type: URB_BULK (0x03)
    Endpoint: 0x81, Direction: IN
        1... .... = Direction: IN (1)
        .000 0001 = Endpoint value: 1
    Device: 39
    URB bus id: 2
    Device setup request: not relevant ('-')
    Data: present (0)
    URB sec: 1424613633
    URB usec: 352560
    URB status: No such file or directory (-ENOENT) (-2)
    URB length [bytes]: 0
    Data length [bytes]: 0
    [Request in: 2380]
    [Time from request: 3.003812000 seconds]
    [bInterfaceClass: CDC-Data (0x0a)]

0000  80 b7 83 17 04 88 ff ff 43 03 81 27 02 00 2d 00   ........C..'..-.
0010  01 e1 e9 54 00 00 00 00 30 61 05 00 fe ff ff ff   ...T....0a......
0020  00 00 00 00 00 00 00 00 00 00 00 00 00 00 00 00   ................
0030  00 00 00 00 00 00 00 00 04 02 00 00 00 00 00 00   ................

No.     Time           Source                Destination           Protocol Length Info
   2805 16.674224000   39.1                  host                  USB      64     URB_BULK in

Frame 2805: 64 bytes on wire (512 bits), 64 bytes captured (512 bits) on interface 0
    Interface id: 0
    Encapsulation type: USB packets with Linux header and padding (115)
    Arrival Time: Feb 22, 2015 16:00:33.352643000 SAST
    [Time shift for this packet: 0.000000000 seconds]
    Epoch Time: 1424613633.352643000 seconds
    [Time delta from previous captured frame: 0.000011000 seconds]
    [Time delta from previous displayed frame: 0.000083000 seconds]
    [Time since reference or first frame: 16.674224000 seconds]
    Frame Number: 2805
    Frame Length: 64 bytes (512 bits)
    Capture Length: 64 bytes (512 bits)
    [Frame is marked: False]
    [Frame is ignored: False]
    [Protocols in frame: usb]
USB URB
    URB id: 0xffff8801c36f8600
    URB type: URB_COMPLETE ('C')
    URB transfer type: URB_BULK (0x03)
    Endpoint: 0x81, Direction: IN
        1... .... = Direction: IN (1)
        .000 0001 = Endpoint value: 1
    Device: 39
    URB bus id: 2
    Device setup request: not relevant ('-')
    Data: present (0)
    URB sec: 1424613633
    URB usec: 352643
    URB status: No such file or directory (-ENOENT) (-2)
    URB length [bytes]: 0
    Data length [bytes]: 0
    [Request in: 2380]
    [Time from request: 3.003895000 seconds]
    [bInterfaceClass: CDC-Data (0x0a)]

0000  00 86 6f c3 01 88 ff ff 43 03 81 27 02 00 2d 00   ..o.....C..'..-.
0010  01 e1 e9 54 00 00 00 00 83 61 05 00 fe ff ff ff   ...T.....a......
0020  00 00 00 00 00 00 00 00 00 00 00 00 00 00 00 00   ................
0030  00 00 00 00 00 00 00 00 04 02 00 00 00 00 00 00   ................

No.     Time           Source                Destination           Protocol Length Info
   2806 16.674469000   39.1                  host                  USB      64     URB_BULK in

Frame 2806: 64 bytes on wire (512 bits), 64 bytes captured (512 bits) on interface 0
    Interface id: 0
    Encapsulation type: USB packets with Linux header and padding (115)
    Arrival Time: Feb 22, 2015 16:00:33.352888000 SAST
    [Time shift for this packet: 0.000000000 seconds]
    Epoch Time: 1424613633.352888000 seconds
    [Time delta from previous captured frame: 0.000245000 seconds]
    [Time delta from previous displayed frame: 0.000245000 seconds]
    [Time since reference or first frame: 16.674469000 seconds]
    Frame Number: 2806
    Frame Length: 64 bytes (512 bits)
    Capture Length: 64 bytes (512 bits)
    [Frame is marked: False]
    [Frame is ignored: False]
    [Protocols in frame: usb]
USB URB
    URB id: 0xffff8801c36f8a80
    URB type: URB_COMPLETE ('C')
    URB transfer type: URB_BULK (0x03)
    Endpoint: 0x81, Direction: IN
        1... .... = Direction: IN (1)
        .000 0001 = Endpoint value: 1
    Device: 39
    URB bus id: 2
    Device setup request: not relevant ('-')
    Data: present (0)
    URB sec: 1424613633
    URB usec: 352888
    URB status: No such file or directory (-ENOENT) (-2)
    URB length [bytes]: 0
    Data length [bytes]: 0
    [Request in: 2380]
    [Time from request: 3.004140000 seconds]
    [bInterfaceClass: CDC-Data (0x0a)]

0000  80 8a 6f c3 01 88 ff ff 43 03 81 27 02 00 2d 00   ..o.....C..'..-.
0010  01 e1 e9 54 00 00 00 00 78 62 05 00 fe ff ff ff   ...T....xb......
0020  00 00 00 00 00 00 00 00 00 00 00 00 00 00 00 00   ................
0030  00 00 00 00 00 00 00 00 04 02 00 00 00 00 00 00   ................

No.     Time           Source                Destination           Protocol Length Info
   2808 16.674512000   39.1                  host                  USB      64     URB_BULK in

Frame 2808: 64 bytes on wire (512 bits), 64 bytes captured (512 bits) on interface 0
    Interface id: 0
    Encapsulation type: USB packets with Linux header and padding (115)
    Arrival Time: Feb 22, 2015 16:00:33.352931000 SAST
    [Time shift for this packet: 0.000000000 seconds]
    Epoch Time: 1424613633.352931000 seconds
    [Time delta from previous captured frame: 0.000034000 seconds]
    [Time delta from previous displayed frame: 0.000043000 seconds]
    [Time since reference or first frame: 16.674512000 seconds]
    Frame Number: 2808
    Frame Length: 64 bytes (512 bits)
    Capture Length: 64 bytes (512 bits)
    [Frame is marked: False]
    [Frame is ignored: False]
    [Protocols in frame: usb]
USB URB
    URB id: 0xffff8801c36f8180
    URB type: URB_COMPLETE ('C')
    URB transfer type: URB_BULK (0x03)
    Endpoint: 0x81, Direction: IN
        1... .... = Direction: IN (1)
        .000 0001 = Endpoint value: 1
    Device: 39
    URB bus id: 2
    Device setup request: not relevant ('-')
    Data: present (0)
    URB sec: 1424613633
    URB usec: 352931
    URB status: No such file or directory (-ENOENT) (-2)
    URB length [bytes]: 0
    Data length [bytes]: 0
    [Request in: 2380]
    [Time from request: 3.004183000 seconds]
    [bInterfaceClass: CDC-Data (0x0a)]

0000  80 81 6f c3 01 88 ff ff 43 03 81 27 02 00 2d 00   ..o.....C..'..-.
0010  01 e1 e9 54 00 00 00 00 a3 62 05 00 fe ff ff ff   ...T.....b......
0020  00 00 00 00 00 00 00 00 00 00 00 00 00 00 00 00   ................
0030  00 00 00 00 00 00 00 00 04 02 00 00 00 00 00 00   ................

No.     Time           Source                Destination           Protocol Length Info
   2809 16.674547000   39.1                  host                  USB      64     URB_BULK in

Frame 2809: 64 bytes on wire (512 bits), 64 bytes captured (512 bits) on interface 0
    Interface id: 0
    Encapsulation type: USB packets with Linux header and padding (115)
    Arrival Time: Feb 22, 2015 16:00:33.352966000 SAST
    [Time shift for this packet: 0.000000000 seconds]
    Epoch Time: 1424613633.352966000 seconds
    [Time delta from previous captured frame: 0.000035000 seconds]
    [Time delta from previous displayed frame: 0.000035000 seconds]
    [Time since reference or first frame: 16.674547000 seconds]
    Frame Number: 2809
    Frame Length: 64 bytes (512 bits)
    Capture Length: 64 bytes (512 bits)
    [Frame is marked: False]
    [Frame is ignored: False]
    [Protocols in frame: usb]
USB URB
    URB id: 0xffff8801c36f86c0
    URB type: URB_COMPLETE ('C')
    URB transfer type: URB_BULK (0x03)
    Endpoint: 0x81, Direction: IN
        1... .... = Direction: IN (1)
        .000 0001 = Endpoint value: 1
    Device: 39
    URB bus id: 2
    Device setup request: not relevant ('-')
    Data: present (0)
    URB sec: 1424613633
    URB usec: 352966
    URB status: No such file or directory (-ENOENT) (-2)
    URB length [bytes]: 0
    Data length [bytes]: 0
    [Request in: 2380]
    [Time from request: 3.004218000 seconds]
    [bInterfaceClass: CDC-Data (0x0a)]

0000  c0 86 6f c3 01 88 ff ff 43 03 81 27 02 00 2d 00   ..o.....C..'..-.
0010  01 e1 e9 54 00 00 00 00 c6 62 05 00 fe ff ff ff   ...T.....b......
0020  00 00 00 00 00 00 00 00 00 00 00 00 00 00 00 00   ................
0030  00 00 00 00 00 00 00 00 04 02 00 00 00 00 00 00   ................

No.     Time           Source                Destination           Protocol Length Info
   2811 16.674600000   39.1                  host                  USB      64     URB_BULK in

Frame 2811: 64 bytes on wire (512 bits), 64 bytes captured (512 bits) on interface 0
    Interface id: 0
    Encapsulation type: USB packets with Linux header and padding (115)
    Arrival Time: Feb 22, 2015 16:00:33.353019000 SAST
    [Time shift for this packet: 0.000000000 seconds]
    Epoch Time: 1424613633.353019000 seconds
    [Time delta from previous captured frame: 0.000002000 seconds]
    [Time delta from previous displayed frame: 0.000053000 seconds]
    [Time since reference or first frame: 16.674600000 seconds]
    Frame Number: 2811
    Frame Length: 64 bytes (512 bits)
    Capture Length: 64 bytes (512 bits)
    [Frame is marked: False]
    [Frame is ignored: False]
    [Protocols in frame: usb]
USB URB
    URB id: 0xffff8801c36f8480
    URB type: URB_COMPLETE ('C')
    URB transfer type: URB_BULK (0x03)
    Endpoint: 0x81, Direction: IN
        1... .... = Direction: IN (1)
        .000 0001 = Endpoint value: 1
    Device: 39
    URB bus id: 2
    Device setup request: not relevant ('-')
    Data: present (0)
    URB sec: 1424613633
    URB usec: 353019
    URB status: No such file or directory (-ENOENT) (-2)
    URB length [bytes]: 0
    Data length [bytes]: 0
    [Request in: 2380]
    [Time from request: 3.004271000 seconds]
    [bInterfaceClass: CDC-Data (0x0a)]

0000  80 84 6f c3 01 88 ff ff 43 03 81 27 02 00 2d 00   ..o.....C..'..-.
0010  01 e1 e9 54 00 00 00 00 fb 62 05 00 fe ff ff ff   ...T.....b......
0020  00 00 00 00 00 00 00 00 00 00 00 00 00 00 00 00   ................
0030  00 00 00 00 00 00 00 00 04 02 00 00 00 00 00 00   ................

No.     Time           Source                Destination           Protocol Length Info
   2812 16.674611000   39.1                  host                  USB      64     URB_BULK in

Frame 2812: 64 bytes on wire (512 bits), 64 bytes captured (512 bits) on interface 0
    Interface id: 0
    Encapsulation type: USB packets with Linux header and padding (115)
    Arrival Time: Feb 22, 2015 16:00:33.353030000 SAST
    [Time shift for this packet: 0.000000000 seconds]
    Epoch Time: 1424613633.353030000 seconds
    [Time delta from previous captured frame: 0.000011000 seconds]
    [Time delta from previous displayed frame: 0.000011000 seconds]
    [Time since reference or first frame: 16.674611000 seconds]
    Frame Number: 2812
    Frame Length: 64 bytes (512 bits)
    Capture Length: 64 bytes (512 bits)
    [Frame is marked: False]
    [Frame is ignored: False]
    [Protocols in frame: usb]
USB URB
    URB id: 0xffff8801c36f8840
    URB type: URB_COMPLETE ('C')
    URB transfer type: URB_BULK (0x03)
    Endpoint: 0x81, Direction: IN
        1... .... = Direction: IN (1)
        .000 0001 = Endpoint value: 1
    Device: 39
    URB bus id: 2
    Device setup request: not relevant ('-')
    Data: present (0)
    URB sec: 1424613633
    URB usec: 353030
    URB status: No such file or directory (-ENOENT) (-2)
    URB length [bytes]: 0
    Data length [bytes]: 0
    [Request in: 2380]
    [Time from request: 3.004282000 seconds]
    [bInterfaceClass: CDC-Data (0x0a)]

0000  40 88 6f c3 01 88 ff ff 43 03 81 27 02 00 2d 00   @.o.....C..'..-.
0010  01 e1 e9 54 00 00 00 00 06 63 05 00 fe ff ff ff   ...T.....c......
0020  00 00 00 00 00 00 00 00 00 00 00 00 00 00 00 00   ................
0030  00 00 00 00 00 00 00 00 04 02 00 00 00 00 00 00   ................

No.     Time           Source                Destination           Protocol Length Info
   2813 16.674834000   39.1                  host                  USB      64     URB_BULK in

Frame 2813: 64 bytes on wire (512 bits), 64 bytes captured (512 bits) on interface 0
    Interface id: 0
    Encapsulation type: USB packets with Linux header and padding (115)
    Arrival Time: Feb 22, 2015 16:00:33.353253000 SAST
    [Time shift for this packet: 0.000000000 seconds]
    Epoch Time: 1424613633.353253000 seconds
    [Time delta from previous captured frame: 0.000223000 seconds]
    [Time delta from previous displayed frame: 0.000223000 seconds]
    [Time since reference or first frame: 16.674834000 seconds]
    Frame Number: 2813
    Frame Length: 64 bytes (512 bits)
    Capture Length: 64 bytes (512 bits)
    [Frame is marked: False]
    [Frame is ignored: False]
    [Protocols in frame: usb]
USB URB
    URB id: 0xffff8801c36f8000
    URB type: URB_COMPLETE ('C')
    URB transfer type: URB_BULK (0x03)
    Endpoint: 0x81, Direction: IN
        1... .... = Direction: IN (1)
        .000 0001 = Endpoint value: 1
    Device: 39
    URB bus id: 2
    Device setup request: not relevant ('-')
    Data: present (0)
    URB sec: 1424613633
    URB usec: 353253
    URB status: No such file or directory (-ENOENT) (-2)
    URB length [bytes]: 0
    Data length [bytes]: 0
    [Request in: 2380]
    [Time from request: 3.004505000 seconds]
    [bInterfaceClass: CDC-Data (0x0a)]

0000  00 80 6f c3 01 88 ff ff 43 03 81 27 02 00 2d 00   ..o.....C..'..-.
0010  01 e1 e9 54 00 00 00 00 e5 63 05 00 fe ff ff ff   ...T.....c......
0020  00 00 00 00 00 00 00 00 00 00 00 00 00 00 00 00   ................
0030  00 00 00 00 00 00 00 00 04 02 00 00 00 00 00 00   ................

No.     Time           Source                Destination           Protocol Length Info
   2815 16.674886000   39.1                  host                  USB      64     URB_BULK in

Frame 2815: 64 bytes on wire (512 bits), 64 bytes captured (512 bits) on interface 0
    Interface id: 0
    Encapsulation type: USB packets with Linux header and padding (115)
    Arrival Time: Feb 22, 2015 16:00:33.353305000 SAST
    [Time shift for this packet: 0.000000000 seconds]
    Epoch Time: 1424613633.353305000 seconds
    [Time delta from previous captured frame: 0.000045000 seconds]
    [Time delta from previous displayed frame: 0.000052000 seconds]
    [Time since reference or first frame: 16.674886000 seconds]
    Frame Number: 2815
    Frame Length: 64 bytes (512 bits)
    Capture Length: 64 bytes (512 bits)
    [Frame is marked: False]
    [Frame is ignored: False]
    [Protocols in frame: usb]
USB URB
    URB id: 0xffff8801c36f80c0
    URB type: URB_COMPLETE ('C')
    URB transfer type: URB_BULK (0x03)
    Endpoint: 0x81, Direction: IN
        1... .... = Direction: IN (1)
        .000 0001 = Endpoint value: 1
    Device: 39
    URB bus id: 2
    Device setup request: not relevant ('-')
    Data: present (0)
    URB sec: 1424613633
    URB usec: 353305
    URB status: No such file or directory (-ENOENT) (-2)
    URB length [bytes]: 0
    Data length [bytes]: 0
    [Request in: 2380]
    [Time from request: 3.004557000 seconds]
    [bInterfaceClass: CDC-Data (0x0a)]

0000  c0 80 6f c3 01 88 ff ff 43 03 81 27 02 00 2d 00   ..o.....C..'..-.
0010  01 e1 e9 54 00 00 00 00 19 64 05 00 fe ff ff ff   ...T.....d......
0020  00 00 00 00 00 00 00 00 00 00 00 00 00 00 00 00   ................
0030  00 00 00 00 00 00 00 00 04 02 00 00 00 00 00 00   ................

No.     Time           Source                Destination           Protocol Length Info
   2816 16.674909000   39.1                  host                  USB      64     URB_BULK in

Frame 2816: 64 bytes on wire (512 bits), 64 bytes captured (512 bits) on interface 0
    Interface id: 0
    Encapsulation type: USB packets with Linux header and padding (115)
    Arrival Time: Feb 22, 2015 16:00:33.353328000 SAST
    [Time shift for this packet: 0.000000000 seconds]
    Epoch Time: 1424613633.353328000 seconds
    [Time delta from previous captured frame: 0.000023000 seconds]
    [Time delta from previous displayed frame: 0.000023000 seconds]
    [Time since reference or first frame: 16.674909000 seconds]
    Frame Number: 2816
    Frame Length: 64 bytes (512 bits)
    Capture Length: 64 bytes (512 bits)
    [Frame is marked: False]
    [Frame is ignored: False]
    [Protocols in frame: usb]
USB URB
    URB id: 0xffff8801c36f89c0
    URB type: URB_COMPLETE ('C')
    URB transfer type: URB_BULK (0x03)
    Endpoint: 0x81, Direction: IN
        1... .... = Direction: IN (1)
        .000 0001 = Endpoint value: 1
    Device: 39
    URB bus id: 2
    Device setup request: not relevant ('-')
    Data: present (0)
    URB sec: 1424613633
    URB usec: 353328
    URB status: No such file or directory (-ENOENT) (-2)
    URB length [bytes]: 0
    Data length [bytes]: 0
    [Request in: 2380]
    [Time from request: 3.004580000 seconds]
    [bInterfaceClass: CDC-Data (0x0a)]

0000  c0 89 6f c3 01 88 ff ff 43 03 81 27 02 00 2d 00   ..o.....C..'..-.
0010  01 e1 e9 54 00 00 00 00 30 64 05 00 fe ff ff ff   ...T....0d......
0020  00 00 00 00 00 00 00 00 00 00 00 00 00 00 00 00   ................
0030  00 00 00 00 00 00 00 00 04 02 00 00 00 00 00 00   ................

No.     Time           Source                Destination           Protocol Length Info
   2817 16.674950000   39.1                  host                  USB      64     URB_BULK in

Frame 2817: 64 bytes on wire (512 bits), 64 bytes captured (512 bits) on interface 0
    Interface id: 0
    Encapsulation type: USB packets with Linux header and padding (115)
    Arrival Time: Feb 22, 2015 16:00:33.353369000 SAST
    [Time shift for this packet: 0.000000000 seconds]
    Epoch Time: 1424613633.353369000 seconds
    [Time delta from previous captured frame: 0.000041000 seconds]
    [Time delta from previous displayed frame: 0.000041000 seconds]
    [Time since reference or first frame: 16.674950000 seconds]
    Frame Number: 2817
    Frame Length: 64 bytes (512 bits)
    Capture Length: 64 bytes (512 bits)
    [Frame is marked: False]
    [Frame is ignored: False]
    [Protocols in frame: usb]
USB URB
    URB id: 0xffff8801c36f8e40
    URB type: URB_COMPLETE ('C')
    URB transfer type: URB_BULK (0x03)
    Endpoint: 0x81, Direction: IN
        1... .... = Direction: IN (1)
        .000 0001 = Endpoint value: 1
    Device: 39
    URB bus id: 2
    Device setup request: not relevant ('-')
    Data: present (0)
    URB sec: 1424613633
    URB usec: 353369
    URB status: No such file or directory (-ENOENT) (-2)
    URB length [bytes]: 0
    Data length [bytes]: 0
    [Request in: 2380]
    [Time from request: 3.004621000 seconds]
    [bInterfaceClass: CDC-Data (0x0a)]

0000  40 8e 6f c3 01 88 ff ff 43 03 81 27 02 00 2d 00   @.o.....C..'..-.
0010  01 e1 e9 54 00 00 00 00 59 64 05 00 fe ff ff ff   ...T....Yd......
0020  00 00 00 00 00 00 00 00 00 00 00 00 00 00 00 00   ................
0030  00 00 00 00 00 00 00 00 04 02 00 00 00 00 00 00   ................

No.     Time           Source                Destination           Protocol Length Info
   2819 16.675205000   39.1                  host                  USB      64     URB_BULK in

Frame 2819: 64 bytes on wire (512 bits), 64 bytes captured (512 bits) on interface 0
    Interface id: 0
    Encapsulation type: USB packets with Linux header and padding (115)
    Arrival Time: Feb 22, 2015 16:00:33.353624000 SAST
    [Time shift for this packet: 0.000000000 seconds]
    Epoch Time: 1424613633.353624000 seconds
    [Time delta from previous captured frame: 0.000248000 seconds]
    [Time delta from previous displayed frame: 0.000255000 seconds]
    [Time since reference or first frame: 16.675205000 seconds]
    Frame Number: 2819
    Frame Length: 64 bytes (512 bits)
    Capture Length: 64 bytes (512 bits)
    [Frame is marked: False]
    [Frame is ignored: False]
    [Protocols in frame: usb]
USB URB
    URB id: 0xffff8801c36f8300
    URB type: URB_COMPLETE ('C')
    URB transfer type: URB_BULK (0x03)
    Endpoint: 0x81, Direction: IN
        1... .... = Direction: IN (1)
        .000 0001 = Endpoint value: 1
    Device: 39
    URB bus id: 2
    Device setup request: not relevant ('-')
    Data: present (0)
    URB sec: 1424613633
    URB usec: 353624
    URB status: No such file or directory (-ENOENT) (-2)
    URB length [bytes]: 0
    Data length [bytes]: 0
    [Request in: 2380]
    [Time from request: 3.004876000 seconds]
    [bInterfaceClass: CDC-Data (0x0a)]

0000  00 83 6f c3 01 88 ff ff 43 03 81 27 02 00 2d 00   ..o.....C..'..-.
0010  01 e1 e9 54 00 00 00 00 58 65 05 00 fe ff ff ff   ...T....Xe......
0020  00 00 00 00 00 00 00 00 00 00 00 00 00 00 00 00   ................
0030  00 00 00 00 00 00 00 00 04 02 00 00 00 00 00 00   ................

No.     Time           Source                Destination           Protocol Length Info
   2821 16.675247000   39.1                  host                  USB      64     URB_BULK in

Frame 2821: 64 bytes on wire (512 bits), 64 bytes captured (512 bits) on interface 0
    Interface id: 0
    Encapsulation type: USB packets with Linux header and padding (115)
    Arrival Time: Feb 22, 2015 16:00:33.353666000 SAST
    [Time shift for this packet: 0.000000000 seconds]
    Epoch Time: 1424613633.353666000 seconds
    [Time delta from previous captured frame: 0.000036000 seconds]
    [Time delta from previous displayed frame: 0.000042000 seconds]
    [Time since reference or first frame: 16.675247000 seconds]
    Frame Number: 2821
    Frame Length: 64 bytes (512 bits)
    Capture Length: 64 bytes (512 bits)
    [Frame is marked: False]
    [Frame is ignored: False]
    [Protocols in frame: usb]
USB URB
    URB id: 0xffff8801c36f8c00
    URB type: URB_COMPLETE ('C')
    URB transfer type: URB_BULK (0x03)
    Endpoint: 0x81, Direction: IN
        1... .... = Direction: IN (1)
        .000 0001 = Endpoint value: 1
    Device: 39
    URB bus id: 2
    Device setup request: not relevant ('-')
    Data: present (0)
    URB sec: 1424613633
    URB usec: 353666
    URB status: No such file or directory (-ENOENT) (-2)
    URB length [bytes]: 0
    Data length [bytes]: 0
    [Request in: 2380]
    [Time from request: 3.004918000 seconds]
    [bInterfaceClass: CDC-Data (0x0a)]

0000  00 8c 6f c3 01 88 ff ff 43 03 81 27 02 00 2d 00   ..o.....C..'..-.
0010  01 e1 e9 54 00 00 00 00 82 65 05 00 fe ff ff ff   ...T.....e......
0020  00 00 00 00 00 00 00 00 00 00 00 00 00 00 00 00   ................
0030  00 00 00 00 00 00 00 00 04 02 00 00 00 00 00 00   ................

No.     Time           Source                Destination           Protocol Length Info
   2822 16.675256000   39.1                  host                  USB      64     URB_BULK in

Frame 2822: 64 bytes on wire (512 bits), 64 bytes captured (512 bits) on interface 0
    Interface id: 0
    Encapsulation type: USB packets with Linux header and padding (115)
    Arrival Time: Feb 22, 2015 16:00:33.353675000 SAST
    [Time shift for this packet: 0.000000000 seconds]
    Epoch Time: 1424613633.353675000 seconds
    [Time delta from previous captured frame: 0.000009000 seconds]
    [Time delta from previous displayed frame: 0.000009000 seconds]
    [Time since reference or first frame: 16.675256000 seconds]
    Frame Number: 2822
    Frame Length: 64 bytes (512 bits)
    Capture Length: 64 bytes (512 bits)
    [Frame is marked: False]
    [Frame is ignored: False]
    [Protocols in frame: usb]
USB URB
    URB id: 0xffff8802c1cd1b40
    URB type: URB_COMPLETE ('C')
    URB transfer type: URB_BULK (0x03)
    Endpoint: 0x81, Direction: IN
        1... .... = Direction: IN (1)
        .000 0001 = Endpoint value: 1
    Device: 39
    URB bus id: 2
    Device setup request: not relevant ('-')
    Data: present (0)
    URB sec: 1424613633
    URB usec: 353675
    URB status: No such file or directory (-ENOENT) (-2)
    URB length [bytes]: 0
    Data length [bytes]: 0
    [Request in: 2380]
    [Time from request: 3.004927000 seconds]
    [bInterfaceClass: CDC-Data (0x0a)]

0000  40 1b cd c1 02 88 ff ff 43 03 81 27 02 00 2d 00   @.......C..'..-.
0010  01 e1 e9 54 00 00 00 00 8b 65 05 00 fe ff ff ff   ...T.....e......
0020  00 00 00 00 00 00 00 00 00 00 00 00 00 00 00 00   ................
0030  00 00 00 00 00 00 00 00 04 02 00 00 00 00 00 00   ................

No.     Time           Source                Destination           Protocol Length Info
   2823 16.675301000   39.1                  host                  USB      64     URB_BULK in

Frame 2823: 64 bytes on wire (512 bits), 64 bytes captured (512 bits) on interface 0
    Interface id: 0
    Encapsulation type: USB packets with Linux header and padding (115)
    Arrival Time: Feb 22, 2015 16:00:33.353720000 SAST
    [Time shift for this packet: 0.000000000 seconds]
    Epoch Time: 1424613633.353720000 seconds
    [Time delta from previous captured frame: 0.000045000 seconds]
    [Time delta from previous displayed frame: 0.000045000 seconds]
    [Time since reference or first frame: 16.675301000 seconds]
    Frame Number: 2823
    Frame Length: 64 bytes (512 bits)
    Capture Length: 64 bytes (512 bits)
    [Frame is marked: False]
    [Frame is ignored: False]
    [Protocols in frame: usb]
USB URB
    URB id: 0xffff8802c1cd1a80
    URB type: URB_COMPLETE ('C')
    URB transfer type: URB_BULK (0x03)
    Endpoint: 0x81, Direction: IN
        1... .... = Direction: IN (1)
        .000 0001 = Endpoint value: 1
    Device: 39
    URB bus id: 2
    Device setup request: not relevant ('-')
    Data: present (0)
    URB sec: 1424613633
    URB usec: 353720
    URB status: No such file or directory (-ENOENT) (-2)
    URB length [bytes]: 0
    Data length [bytes]: 0
    [Request in: 2380]
    [Time from request: 3.004972000 seconds]
    [bInterfaceClass: CDC-Data (0x0a)]

0000  80 1a cd c1 02 88 ff ff 43 03 81 27 02 00 2d 00   ........C..'..-.
0010  01 e1 e9 54 00 00 00 00 b8 65 05 00 fe ff ff ff   ...T.....e......
0020  00 00 00 00 00 00 00 00 00 00 00 00 00 00 00 00   ................
0030  00 00 00 00 00 00 00 00 04 02 00 00 00 00 00 00   ................

No.     Time           Source                Destination           Protocol Length Info
   3147 18.523518000   host                  39.2                  USB      64     URB_INTERRUPT in

Frame 3147: 64 bytes on wire (512 bits), 64 bytes captured (512 bits) on interface 0
    Interface id: 0
    Encapsulation type: USB packets with Linux header and padding (115)
    Arrival Time: Feb 22, 2015 16:00:35.201937000 SAST
    [Time shift for this packet: 0.000000000 seconds]
    Epoch Time: 1424613635.201937000 seconds
    [Time delta from previous captured frame: 0.057598000 seconds]
    [Time delta from previous displayed frame: 1.848217000 seconds]
    [Time since reference or first frame: 18.523518000 seconds]
    Frame Number: 3147
    Frame Length: 64 bytes (512 bits)
    Capture Length: 64 bytes (512 bits)
    [Frame is marked: False]
    [Frame is ignored: False]
    [Protocols in frame: usb]
USB URB
    URB id: 0xffff880220b5a240
    URB type: URB_SUBMIT ('S')
    URB transfer type: URB_INTERRUPT (0x01)
    Endpoint: 0x82, Direction: IN
        1... .... = Direction: IN (1)
        .000 0010 = Endpoint value: 2
    Device: 39
    URB bus id: 2
    Device setup request: not relevant ('-')
    Data: not present ('<')
    URB sec: 1424613635
    URB usec: 201937
    URB status: Operation now in progress (-EINPROGRESS) (-115)
    URB length [bytes]: 8
    Data length [bytes]: 0
    [bInterfaceClass: Communications and CDC Control (0x02)]

0000  40 a2 b5 20 02 88 ff ff 53 01 82 27 02 00 2d 3c   @.. ....S..'..-<
0010  03 e1 e9 54 00 00 00 00 d1 14 03 00 8d ff ff ff   ...T............
0020  08 00 00 00 00 00 00 00 00 00 00 00 00 00 00 00   ................
0030  10 00 00 00 00 00 00 00 04 02 00 00 00 00 00 00   ................

No.     Time           Source                Destination           Protocol Length Info
   3148 18.523526000   host                  39.0                  USB      64     URB_CONTROL out

Frame 3148: 64 bytes on wire (512 bits), 64 bytes captured (512 bits) on interface 0
    Interface id: 0
    Encapsulation type: USB packets with Linux header and padding (115)
    Arrival Time: Feb 22, 2015 16:00:35.201945000 SAST
    [Time shift for this packet: 0.000000000 seconds]
    Epoch Time: 1424613635.201945000 seconds
    [Time delta from previous captured frame: 0.000008000 seconds]
    [Time delta from previous displayed frame: 0.000008000 seconds]
    [Time since reference or first frame: 18.523526000 seconds]
    Frame Number: 3148
    Frame Length: 64 bytes (512 bits)
    Capture Length: 64 bytes (512 bits)
    [Frame is marked: False]
    [Frame is ignored: False]
    [Protocols in frame: usb]
USB URB
    URB id: 0xffff8802c1d89b40
    URB type: URB_SUBMIT ('S')
    URB transfer type: URB_CONTROL (0x02)
    Endpoint: 0x00, Direction: OUT
        0... .... = Direction: OUT (0)
        .000 0000 = Endpoint value: 0
    Device: 39
    URB bus id: 2
    Device setup request: relevant (0)
    Data: present (0)
    URB sec: 1424613635
    URB usec: 201945
    URB status: Operation now in progress (-EINPROGRESS) (-115)
    URB length [bytes]: 0
    Data length [bytes]: 0
    [Response in: 3149]
    [bInterfaceClass: Communications and CDC Control (0x02)]
URB setup
    bmRequestType: 0x21
        0... .... = Direction: Host-to-device
        .01. .... = Type: Class (0x01)
        ...0 0001 = Recipient: Interface (0x01)
    bRequest: 34
    wValue: 0x0003
    wIndex: 0
    wLength: 0

0000  40 9b d8 c1 02 88 ff ff 53 02 00 27 02 00 00 00   @.......S..'....
0010  03 e1 e9 54 00 00 00 00 d9 14 03 00 8d ff ff ff   ...T............
0020  00 00 00 00 00 00 00 00 21 22 03 00 00 00 00 00   ........!"......
0030  00 00 00 00 00 00 00 00 00 00 00 00 00 00 00 00   ................

No.     Time           Source                Destination           Protocol Length Info
   3149 18.523714000   39.0                  host                  USB      64     URB_CONTROL out

Frame 3149: 64 bytes on wire (512 bits), 64 bytes captured (512 bits) on interface 0
    Interface id: 0
    Encapsulation type: USB packets with Linux header and padding (115)
    Arrival Time: Feb 22, 2015 16:00:35.202133000 SAST
    [Time shift for this packet: 0.000000000 seconds]
    Epoch Time: 1424613635.202133000 seconds
    [Time delta from previous captured frame: 0.000188000 seconds]
    [Time delta from previous displayed frame: 0.000188000 seconds]
    [Time since reference or first frame: 18.523714000 seconds]
    Frame Number: 3149
    Frame Length: 64 bytes (512 bits)
    Capture Length: 64 bytes (512 bits)
    [Frame is marked: False]
    [Frame is ignored: False]
    [Protocols in frame: usb]
USB URB
    URB id: 0xffff8802c1d89b40
    URB type: URB_COMPLETE ('C')
    URB transfer type: URB_CONTROL (0x02)
    Endpoint: 0x00, Direction: OUT
        0... .... = Direction: OUT (0)
        .000 0000 = Endpoint value: 0
    Device: 39
    URB bus id: 2
    Device setup request: not relevant ('-')
    Data: not present ('>')
    URB sec: 1424613635
    URB usec: 202133
    URB status: Success (0)
    URB length [bytes]: 0
    Data length [bytes]: 0
    [Request in: 3148]
    [Time from request: 0.000188000 seconds]
    [bInterfaceClass: Communications and CDC Control (0x02)]

0000  40 9b d8 c1 02 88 ff ff 43 02 00 27 02 00 2d 3e   @.......C..'..->
0010  03 e1 e9 54 00 00 00 00 95 15 03 00 00 00 00 00   ...T............
0020  00 00 00 00 00 00 00 00 00 00 00 00 00 00 00 00   ................
0030  00 00 00 00 00 00 00 00 00 00 00 00 00 00 00 00   ................

No.     Time           Source                Destination           Protocol Length Info
   3150 18.523727000   host                  39.1                  USB      64     URB_BULK in

Frame 3150: 64 bytes on wire (512 bits), 64 bytes captured (512 bits) on interface 0
    Interface id: 0
    Encapsulation type: USB packets with Linux header and padding (115)
    Arrival Time: Feb 22, 2015 16:00:35.202146000 SAST
    [Time shift for this packet: 0.000000000 seconds]
    Epoch Time: 1424613635.202146000 seconds
    [Time delta from previous captured frame: 0.000013000 seconds]
    [Time delta from previous displayed frame: 0.000013000 seconds]
    [Time since reference or first frame: 18.523727000 seconds]
    Frame Number: 3150
    Frame Length: 64 bytes (512 bits)
    Capture Length: 64 bytes (512 bits)
    [Frame is marked: False]
    [Frame is ignored: False]
    [Protocols in frame: usb]
USB URB
    URB id: 0xffff88041783b9c0
    URB type: URB_SUBMIT ('S')
    URB transfer type: URB_BULK (0x03)
    Endpoint: 0x81, Direction: IN
        1... .... = Direction: IN (1)
        .000 0001 = Endpoint value: 1
    Device: 39
    URB bus id: 2
    Device setup request: not relevant ('-')
    Data: not present ('<')
    URB sec: 1424613635
    URB usec: 202146
    URB status: Operation now in progress (-EINPROGRESS) (-115)
    URB length [bytes]: 128
    Data length [bytes]: 0
    [bInterfaceClass: CDC-Data (0x0a)]

0000  c0 b9 83 17 04 88 ff ff 53 03 81 27 02 00 2d 3c   ........S..'..-<
0010  03 e1 e9 54 00 00 00 00 a2 15 03 00 8d ff ff ff   ...T............
0020  80 00 00 00 00 00 00 00 00 00 00 00 00 00 00 00   ................
0030  00 00 00 00 00 00 00 00 04 02 00 00 00 00 00 00   ................

No.     Time           Source                Destination           Protocol Length Info
   3151 18.523729000   host                  39.1                  USB      64     URB_BULK in

Frame 3151: 64 bytes on wire (512 bits), 64 bytes captured (512 bits) on interface 0
    Interface id: 0
    Encapsulation type: USB packets with Linux header and padding (115)
    Arrival Time: Feb 22, 2015 16:00:35.202148000 SAST
    [Time shift for this packet: 0.000000000 seconds]
    Epoch Time: 1424613635.202148000 seconds
    [Time delta from previous captured frame: 0.000002000 seconds]
    [Time delta from previous displayed frame: 0.000002000 seconds]
    [Time since reference or first frame: 18.523729000 seconds]
    Frame Number: 3151
    Frame Length: 64 bytes (512 bits)
    Capture Length: 64 bytes (512 bits)
    [Frame is marked: False]
    [Frame is ignored: False]
    [Protocols in frame: usb]
USB URB
    URB id: 0xffff88041783b780
    URB type: URB_SUBMIT ('S')
    URB transfer type: URB_BULK (0x03)
    Endpoint: 0x81, Direction: IN
        1... .... = Direction: IN (1)
        .000 0001 = Endpoint value: 1
    Device: 39
    URB bus id: 2
    Device setup request: not relevant ('-')
    Data: not present ('<')
    URB sec: 1424613635
    URB usec: 202148
    URB status: Operation now in progress (-EINPROGRESS) (-115)
    URB length [bytes]: 128
    Data length [bytes]: 0
    [bInterfaceClass: CDC-Data (0x0a)]

0000  80 b7 83 17 04 88 ff ff 53 03 81 27 02 00 2d 3c   ........S..'..-<
0010  03 e1 e9 54 00 00 00 00 a4 15 03 00 8d ff ff ff   ...T............
0020  80 00 00 00 00 00 00 00 00 00 00 00 00 00 00 00   ................
0030  00 00 00 00 00 00 00 00 04 02 00 00 00 00 00 00   ................

No.     Time           Source                Destination           Protocol Length Info
   3152 18.523730000   host                  39.1                  USB      64     URB_BULK in

Frame 3152: 64 bytes on wire (512 bits), 64 bytes captured (512 bits) on interface 0
    Interface id: 0
    Encapsulation type: USB packets with Linux header and padding (115)
    Arrival Time: Feb 22, 2015 16:00:35.202149000 SAST
    [Time shift for this packet: 0.000000000 seconds]
    Epoch Time: 1424613635.202149000 seconds
    [Time delta from previous captured frame: 0.000001000 seconds]
    [Time delta from previous displayed frame: 0.000001000 seconds]
    [Time since reference or first frame: 18.523730000 seconds]
    Frame Number: 3152
    Frame Length: 64 bytes (512 bits)
    Capture Length: 64 bytes (512 bits)
    [Frame is marked: False]
    [Frame is ignored: False]
    [Protocols in frame: usb]
USB URB
    URB id: 0xffff8801c36f8600
    URB type: URB_SUBMIT ('S')
    URB transfer type: URB_BULK (0x03)
    Endpoint: 0x81, Direction: IN
        1... .... = Direction: IN (1)
        .000 0001 = Endpoint value: 1
    Device: 39
    URB bus id: 2
    Device setup request: not relevant ('-')
    Data: not present ('<')
    URB sec: 1424613635
    URB usec: 202149
    URB status: Operation now in progress (-EINPROGRESS) (-115)
    URB length [bytes]: 128
    Data length [bytes]: 0
    [bInterfaceClass: CDC-Data (0x0a)]

0000  00 86 6f c3 01 88 ff ff 53 03 81 27 02 00 2d 3c   ..o.....S..'..-<
0010  03 e1 e9 54 00 00 00 00 a5 15 03 00 8d ff ff ff   ...T............
0020  80 00 00 00 00 00 00 00 00 00 00 00 00 00 00 00   ................
0030  00 00 00 00 00 00 00 00 04 02 00 00 00 00 00 00   ................

No.     Time           Source                Destination           Protocol Length Info
   3153 18.523731000   host                  39.1                  USB      64     URB_BULK in

Frame 3153: 64 bytes on wire (512 bits), 64 bytes captured (512 bits) on interface 0
    Interface id: 0
    Encapsulation type: USB packets with Linux header and padding (115)
    Arrival Time: Feb 22, 2015 16:00:35.202150000 SAST
    [Time shift for this packet: 0.000000000 seconds]
    Epoch Time: 1424613635.202150000 seconds
    [Time delta from previous captured frame: 0.000001000 seconds]
    [Time delta from previous displayed frame: 0.000001000 seconds]
    [Time since reference or first frame: 18.523731000 seconds]
    Frame Number: 3153
    Frame Length: 64 bytes (512 bits)
    Capture Length: 64 bytes (512 bits)
    [Frame is marked: False]
    [Frame is ignored: False]
    [Protocols in frame: usb]
USB URB
    URB id: 0xffff8801c36f8a80
    URB type: URB_SUBMIT ('S')
    URB transfer type: URB_BULK (0x03)
    Endpoint: 0x81, Direction: IN
        1... .... = Direction: IN (1)
        .000 0001 = Endpoint value: 1
    Device: 39
    URB bus id: 2
    Device setup request: not relevant ('-')
    Data: not present ('<')
    URB sec: 1424613635
    URB usec: 202150
    URB status: Operation now in progress (-EINPROGRESS) (-115)
    URB length [bytes]: 128
    Data length [bytes]: 0
    [bInterfaceClass: CDC-Data (0x0a)]

0000  80 8a 6f c3 01 88 ff ff 53 03 81 27 02 00 2d 3c   ..o.....S..'..-<
0010  03 e1 e9 54 00 00 00 00 a6 15 03 00 8d ff ff ff   ...T............
0020  80 00 00 00 00 00 00 00 00 00 00 00 00 00 00 00   ................
0030  00 00 00 00 00 00 00 00 04 02 00 00 00 00 00 00   ................

No.     Time           Source                Destination           Protocol Length Info
   3154 18.523731000   host                  39.1                  USB      64     URB_BULK in

Frame 3154: 64 bytes on wire (512 bits), 64 bytes captured (512 bits) on interface 0
    Interface id: 0
    Encapsulation type: USB packets with Linux header and padding (115)
    Arrival Time: Feb 22, 2015 16:00:35.202150000 SAST
    [Time shift for this packet: 0.000000000 seconds]
    Epoch Time: 1424613635.202150000 seconds
    [Time delta from previous captured frame: 0.000000000 seconds]
    [Time delta from previous displayed frame: 0.000000000 seconds]
    [Time since reference or first frame: 18.523731000 seconds]
    Frame Number: 3154
    Frame Length: 64 bytes (512 bits)
    Capture Length: 64 bytes (512 bits)
    [Frame is marked: False]
    [Frame is ignored: False]
    [Protocols in frame: usb]
USB URB
    URB id: 0xffff8801c36f8180
    URB type: URB_SUBMIT ('S')
    URB transfer type: URB_BULK (0x03)
    Endpoint: 0x81, Direction: IN
        1... .... = Direction: IN (1)
        .000 0001 = Endpoint value: 1
    Device: 39
    URB bus id: 2
    Device setup request: not relevant ('-')
    Data: not present ('<')
    URB sec: 1424613635
    URB usec: 202150
    URB status: Operation now in progress (-EINPROGRESS) (-115)
    URB length [bytes]: 128
    Data length [bytes]: 0
    [bInterfaceClass: CDC-Data (0x0a)]

0000  80 81 6f c3 01 88 ff ff 53 03 81 27 02 00 2d 3c   ..o.....S..'..-<
0010  03 e1 e9 54 00 00 00 00 a6 15 03 00 8d ff ff ff   ...T............
0020  80 00 00 00 00 00 00 00 00 00 00 00 00 00 00 00   ................
0030  00 00 00 00 00 00 00 00 04 02 00 00 00 00 00 00   ................

No.     Time           Source                Destination           Protocol Length Info
   3155 18.523732000   host                  39.1                  USB      64     URB_BULK in

Frame 3155: 64 bytes on wire (512 bits), 64 bytes captured (512 bits) on interface 0
    Interface id: 0
    Encapsulation type: USB packets with Linux header and padding (115)
    Arrival Time: Feb 22, 2015 16:00:35.202151000 SAST
    [Time shift for this packet: 0.000000000 seconds]
    Epoch Time: 1424613635.202151000 seconds
    [Time delta from previous captured frame: 0.000001000 seconds]
    [Time delta from previous displayed frame: 0.000001000 seconds]
    [Time since reference or first frame: 18.523732000 seconds]
    Frame Number: 3155
    Frame Length: 64 bytes (512 bits)
    Capture Length: 64 bytes (512 bits)
    [Frame is marked: False]
    [Frame is ignored: False]
    [Protocols in frame: usb]
USB URB
    URB id: 0xffff8801c36f86c0
    URB type: URB_SUBMIT ('S')
    URB transfer type: URB_BULK (0x03)
    Endpoint: 0x81, Direction: IN
        1... .... = Direction: IN (1)
        .000 0001 = Endpoint value: 1
    Device: 39
    URB bus id: 2
    Device setup request: not relevant ('-')
    Data: not present ('<')
    URB sec: 1424613635
    URB usec: 202151
    URB status: Operation now in progress (-EINPROGRESS) (-115)
    URB length [bytes]: 128
    Data length [bytes]: 0
    [bInterfaceClass: CDC-Data (0x0a)]

0000  c0 86 6f c3 01 88 ff ff 53 03 81 27 02 00 2d 3c   ..o.....S..'..-<
0010  03 e1 e9 54 00 00 00 00 a7 15 03 00 8d ff ff ff   ...T............
0020  80 00 00 00 00 00 00 00 00 00 00 00 00 00 00 00   ................
0030  00 00 00 00 00 00 00 00 04 02 00 00 00 00 00 00   ................

No.     Time           Source                Destination           Protocol Length Info
   3156 18.523733000   host                  39.1                  USB      64     URB_BULK in

Frame 3156: 64 bytes on wire (512 bits), 64 bytes captured (512 bits) on interface 0
    Interface id: 0
    Encapsulation type: USB packets with Linux header and padding (115)
    Arrival Time: Feb 22, 2015 16:00:35.202152000 SAST
    [Time shift for this packet: 0.000000000 seconds]
    Epoch Time: 1424613635.202152000 seconds
    [Time delta from previous captured frame: 0.000001000 seconds]
    [Time delta from previous displayed frame: 0.000001000 seconds]
    [Time since reference or first frame: 18.523733000 seconds]
    Frame Number: 3156
    Frame Length: 64 bytes (512 bits)
    Capture Length: 64 bytes (512 bits)
    [Frame is marked: False]
    [Frame is ignored: False]
    [Protocols in frame: usb]
USB URB
    URB id: 0xffff8801c36f8480
    URB type: URB_SUBMIT ('S')
    URB transfer type: URB_BULK (0x03)
    Endpoint: 0x81, Direction: IN
        1... .... = Direction: IN (1)
        .000 0001 = Endpoint value: 1
    Device: 39
    URB bus id: 2
    Device setup request: not relevant ('-')
    Data: not present ('<')
    URB sec: 1424613635
    URB usec: 202152
    URB status: Operation now in progress (-EINPROGRESS) (-115)
    URB length [bytes]: 128
    Data length [bytes]: 0
    [bInterfaceClass: CDC-Data (0x0a)]

0000  80 84 6f c3 01 88 ff ff 53 03 81 27 02 00 2d 3c   ..o.....S..'..-<
0010  03 e1 e9 54 00 00 00 00 a8 15 03 00 8d ff ff ff   ...T............
0020  80 00 00 00 00 00 00 00 00 00 00 00 00 00 00 00   ................
0030  00 00 00 00 00 00 00 00 04 02 00 00 00 00 00 00   ................

No.     Time           Source                Destination           Protocol Length Info
   3157 18.523734000   host                  39.1                  USB      64     URB_BULK in

Frame 3157: 64 bytes on wire (512 bits), 64 bytes captured (512 bits) on interface 0
    Interface id: 0
    Encapsulation type: USB packets with Linux header and padding (115)
    Arrival Time: Feb 22, 2015 16:00:35.202153000 SAST
    [Time shift for this packet: 0.000000000 seconds]
    Epoch Time: 1424613635.202153000 seconds
    [Time delta from previous captured frame: 0.000001000 seconds]
    [Time delta from previous displayed frame: 0.000001000 seconds]
    [Time since reference or first frame: 18.523734000 seconds]
    Frame Number: 3157
    Frame Length: 64 bytes (512 bits)
    Capture Length: 64 bytes (512 bits)
    [Frame is marked: False]
    [Frame is ignored: False]
    [Protocols in frame: usb]
USB URB
    URB id: 0xffff8801c36f8840
    URB type: URB_SUBMIT ('S')
    URB transfer type: URB_BULK (0x03)
    Endpoint: 0x81, Direction: IN
        1... .... = Direction: IN (1)
        .000 0001 = Endpoint value: 1
    Device: 39
    URB bus id: 2
    Device setup request: not relevant ('-')
    Data: not present ('<')
    URB sec: 1424613635
    URB usec: 202153
    URB status: Operation now in progress (-EINPROGRESS) (-115)
    URB length [bytes]: 128
    Data length [bytes]: 0
    [bInterfaceClass: CDC-Data (0x0a)]

0000  40 88 6f c3 01 88 ff ff 53 03 81 27 02 00 2d 3c   @.o.....S..'..-<
0010  03 e1 e9 54 00 00 00 00 a9 15 03 00 8d ff ff ff   ...T............
0020  80 00 00 00 00 00 00 00 00 00 00 00 00 00 00 00   ................
0030  00 00 00 00 00 00 00 00 04 02 00 00 00 00 00 00   ................

No.     Time           Source                Destination           Protocol Length Info
   3158 18.523734000   host                  39.1                  USB      64     URB_BULK in

Frame 3158: 64 bytes on wire (512 bits), 64 bytes captured (512 bits) on interface 0
    Interface id: 0
    Encapsulation type: USB packets with Linux header and padding (115)
    Arrival Time: Feb 22, 2015 16:00:35.202153000 SAST
    [Time shift for this packet: 0.000000000 seconds]
    Epoch Time: 1424613635.202153000 seconds
    [Time delta from previous captured frame: 0.000000000 seconds]
    [Time delta from previous displayed frame: 0.000000000 seconds]
    [Time since reference or first frame: 18.523734000 seconds]
    Frame Number: 3158
    Frame Length: 64 bytes (512 bits)
    Capture Length: 64 bytes (512 bits)
    [Frame is marked: False]
    [Frame is ignored: False]
    [Protocols in frame: usb]
USB URB
    URB id: 0xffff8801c36f8000
    URB type: URB_SUBMIT ('S')
    URB transfer type: URB_BULK (0x03)
    Endpoint: 0x81, Direction: IN
        1... .... = Direction: IN (1)
        .000 0001 = Endpoint value: 1
    Device: 39
    URB bus id: 2
    Device setup request: not relevant ('-')
    Data: not present ('<')
    URB sec: 1424613635
    URB usec: 202153
    URB status: Operation now in progress (-EINPROGRESS) (-115)
    URB length [bytes]: 128
    Data length [bytes]: 0
    [bInterfaceClass: CDC-Data (0x0a)]

0000  00 80 6f c3 01 88 ff ff 53 03 81 27 02 00 2d 3c   ..o.....S..'..-<
0010  03 e1 e9 54 00 00 00 00 a9 15 03 00 8d ff ff ff   ...T............
0020  80 00 00 00 00 00 00 00 00 00 00 00 00 00 00 00   ................
0030  00 00 00 00 00 00 00 00 04 02 00 00 00 00 00 00   ................

No.     Time           Source                Destination           Protocol Length Info
   3159 18.523735000   host                  39.1                  USB      64     URB_BULK in

Frame 3159: 64 bytes on wire (512 bits), 64 bytes captured (512 bits) on interface 0
    Interface id: 0
    Encapsulation type: USB packets with Linux header and padding (115)
    Arrival Time: Feb 22, 2015 16:00:35.202154000 SAST
    [Time shift for this packet: 0.000000000 seconds]
    Epoch Time: 1424613635.202154000 seconds
    [Time delta from previous captured frame: 0.000001000 seconds]
    [Time delta from previous displayed frame: 0.000001000 seconds]
    [Time since reference or first frame: 18.523735000 seconds]
    Frame Number: 3159
    Frame Length: 64 bytes (512 bits)
    Capture Length: 64 bytes (512 bits)
    [Frame is marked: False]
    [Frame is ignored: False]
    [Protocols in frame: usb]
USB URB
    URB id: 0xffff8801c36f80c0
    URB type: URB_SUBMIT ('S')
    URB transfer type: URB_BULK (0x03)
    Endpoint: 0x81, Direction: IN
        1... .... = Direction: IN (1)
        .000 0001 = Endpoint value: 1
    Device: 39
    URB bus id: 2
    Device setup request: not relevant ('-')
    Data: not present ('<')
    URB sec: 1424613635
    URB usec: 202154
    URB status: Operation now in progress (-EINPROGRESS) (-115)
    URB length [bytes]: 128
    Data length [bytes]: 0
    [bInterfaceClass: CDC-Data (0x0a)]

0000  c0 80 6f c3 01 88 ff ff 53 03 81 27 02 00 2d 3c   ..o.....S..'..-<
0010  03 e1 e9 54 00 00 00 00 aa 15 03 00 8d ff ff ff   ...T............
0020  80 00 00 00 00 00 00 00 00 00 00 00 00 00 00 00   ................
0030  00 00 00 00 00 00 00 00 04 02 00 00 00 00 00 00   ................

No.     Time           Source                Destination           Protocol Length Info
   3160 18.523736000   host                  39.1                  USB      64     URB_BULK in

Frame 3160: 64 bytes on wire (512 bits), 64 bytes captured (512 bits) on interface 0
    Interface id: 0
    Encapsulation type: USB packets with Linux header and padding (115)
    Arrival Time: Feb 22, 2015 16:00:35.202155000 SAST
    [Time shift for this packet: 0.000000000 seconds]
    Epoch Time: 1424613635.202155000 seconds
    [Time delta from previous captured frame: 0.000001000 seconds]
    [Time delta from previous displayed frame: 0.000001000 seconds]
    [Time since reference or first frame: 18.523736000 seconds]
    Frame Number: 3160
    Frame Length: 64 bytes (512 bits)
    Capture Length: 64 bytes (512 bits)
    [Frame is marked: False]
    [Frame is ignored: False]
    [Protocols in frame: usb]
USB URB
    URB id: 0xffff8801c36f89c0
    URB type: URB_SUBMIT ('S')
    URB transfer type: URB_BULK (0x03)
    Endpoint: 0x81, Direction: IN
        1... .... = Direction: IN (1)
        .000 0001 = Endpoint value: 1
    Device: 39
    URB bus id: 2
    Device setup request: not relevant ('-')
    Data: not present ('<')
    URB sec: 1424613635
    URB usec: 202155
    URB status: Operation now in progress (-EINPROGRESS) (-115)
    URB length [bytes]: 128
    Data length [bytes]: 0
    [bInterfaceClass: CDC-Data (0x0a)]

0000  c0 89 6f c3 01 88 ff ff 53 03 81 27 02 00 2d 3c   ..o.....S..'..-<
0010  03 e1 e9 54 00 00 00 00 ab 15 03 00 8d ff ff ff   ...T............
0020  80 00 00 00 00 00 00 00 00 00 00 00 00 00 00 00   ................
0030  00 00 00 00 00 00 00 00 04 02 00 00 00 00 00 00   ................

No.     Time           Source                Destination           Protocol Length Info
   3161 18.523737000   host                  39.1                  USB      64     URB_BULK in

Frame 3161: 64 bytes on wire (512 bits), 64 bytes captured (512 bits) on interface 0
    Interface id: 0
    Encapsulation type: USB packets with Linux header and padding (115)
    Arrival Time: Feb 22, 2015 16:00:35.202156000 SAST
    [Time shift for this packet: 0.000000000 seconds]
    Epoch Time: 1424613635.202156000 seconds
    [Time delta from previous captured frame: 0.000001000 seconds]
    [Time delta from previous displayed frame: 0.000001000 seconds]
    [Time since reference or first frame: 18.523737000 seconds]
    Frame Number: 3161
    Frame Length: 64 bytes (512 bits)
    Capture Length: 64 bytes (512 bits)
    [Frame is marked: False]
    [Frame is ignored: False]
    [Protocols in frame: usb]
USB URB
    URB id: 0xffff8801c36f8e40
    URB type: URB_SUBMIT ('S')
    URB transfer type: URB_BULK (0x03)
    Endpoint: 0x81, Direction: IN
        1... .... = Direction: IN (1)
        .000 0001 = Endpoint value: 1
    Device: 39
    URB bus id: 2
    Device setup request: not relevant ('-')
    Data: not present ('<')
    URB sec: 1424613635
    URB usec: 202156
    URB status: Operation now in progress (-EINPROGRESS) (-115)
    URB length [bytes]: 128
    Data length [bytes]: 0
    [bInterfaceClass: CDC-Data (0x0a)]

0000  40 8e 6f c3 01 88 ff ff 53 03 81 27 02 00 2d 3c   @.o.....S..'..-<
0010  03 e1 e9 54 00 00 00 00 ac 15 03 00 8d ff ff ff   ...T............
0020  80 00 00 00 00 00 00 00 00 00 00 00 00 00 00 00   ................
0030  00 00 00 00 00 00 00 00 04 02 00 00 00 00 00 00   ................

No.     Time           Source                Destination           Protocol Length Info
   3162 18.523737000   host                  39.1                  USB      64     URB_BULK in

Frame 3162: 64 bytes on wire (512 bits), 64 bytes captured (512 bits) on interface 0
    Interface id: 0
    Encapsulation type: USB packets with Linux header and padding (115)
    Arrival Time: Feb 22, 2015 16:00:35.202156000 SAST
    [Time shift for this packet: 0.000000000 seconds]
    Epoch Time: 1424613635.202156000 seconds
    [Time delta from previous captured frame: 0.000000000 seconds]
    [Time delta from previous displayed frame: 0.000000000 seconds]
    [Time since reference or first frame: 18.523737000 seconds]
    Frame Number: 3162
    Frame Length: 64 bytes (512 bits)
    Capture Length: 64 bytes (512 bits)
    [Frame is marked: False]
    [Frame is ignored: False]
    [Protocols in frame: usb]
USB URB
    URB id: 0xffff8801c36f8300
    URB type: URB_SUBMIT ('S')
    URB transfer type: URB_BULK (0x03)
    Endpoint: 0x81, Direction: IN
        1... .... = Direction: IN (1)
        .000 0001 = Endpoint value: 1
    Device: 39
    URB bus id: 2
    Device setup request: not relevant ('-')
    Data: not present ('<')
    URB sec: 1424613635
    URB usec: 202156
    URB status: Operation now in progress (-EINPROGRESS) (-115)
    URB length [bytes]: 128
    Data length [bytes]: 0
    [bInterfaceClass: CDC-Data (0x0a)]

0000  00 83 6f c3 01 88 ff ff 53 03 81 27 02 00 2d 3c   ..o.....S..'..-<
0010  03 e1 e9 54 00 00 00 00 ac 15 03 00 8d ff ff ff   ...T............
0020  80 00 00 00 00 00 00 00 00 00 00 00 00 00 00 00   ................
0030  00 00 00 00 00 00 00 00 04 02 00 00 00 00 00 00   ................

No.     Time           Source                Destination           Protocol Length Info
   3163 18.523738000   host                  39.1                  USB      64     URB_BULK in

Frame 3163: 64 bytes on wire (512 bits), 64 bytes captured (512 bits) on interface 0
    Interface id: 0
    Encapsulation type: USB packets with Linux header and padding (115)
    Arrival Time: Feb 22, 2015 16:00:35.202157000 SAST
    [Time shift for this packet: 0.000000000 seconds]
    Epoch Time: 1424613635.202157000 seconds
    [Time delta from previous captured frame: 0.000001000 seconds]
    [Time delta from previous displayed frame: 0.000001000 seconds]
    [Time since reference or first frame: 18.523738000 seconds]
    Frame Number: 3163
    Frame Length: 64 bytes (512 bits)
    Capture Length: 64 bytes (512 bits)
    [Frame is marked: False]
    [Frame is ignored: False]
    [Protocols in frame: usb]
USB URB
    URB id: 0xffff8801c36f8c00
    URB type: URB_SUBMIT ('S')
    URB transfer type: URB_BULK (0x03)
    Endpoint: 0x81, Direction: IN
        1... .... = Direction: IN (1)
        .000 0001 = Endpoint value: 1
    Device: 39
    URB bus id: 2
    Device setup request: not relevant ('-')
    Data: not present ('<')
    URB sec: 1424613635
    URB usec: 202157
    URB status: Operation now in progress (-EINPROGRESS) (-115)
    URB length [bytes]: 128
    Data length [bytes]: 0
    [bInterfaceClass: CDC-Data (0x0a)]

0000  00 8c 6f c3 01 88 ff ff 53 03 81 27 02 00 2d 3c   ..o.....S..'..-<
0010  03 e1 e9 54 00 00 00 00 ad 15 03 00 8d ff ff ff   ...T............
0020  80 00 00 00 00 00 00 00 00 00 00 00 00 00 00 00   ................
0030  00 00 00 00 00 00 00 00 04 02 00 00 00 00 00 00   ................

No.     Time           Source                Destination           Protocol Length Info
   3164 18.523739000   host                  39.1                  USB      64     URB_BULK in

Frame 3164: 64 bytes on wire (512 bits), 64 bytes captured (512 bits) on interface 0
    Interface id: 0
    Encapsulation type: USB packets with Linux header and padding (115)
    Arrival Time: Feb 22, 2015 16:00:35.202158000 SAST
    [Time shift for this packet: 0.000000000 seconds]
    Epoch Time: 1424613635.202158000 seconds
    [Time delta from previous captured frame: 0.000001000 seconds]
    [Time delta from previous displayed frame: 0.000001000 seconds]
    [Time since reference or first frame: 18.523739000 seconds]
    Frame Number: 3164
    Frame Length: 64 bytes (512 bits)
    Capture Length: 64 bytes (512 bits)
    [Frame is marked: False]
    [Frame is ignored: False]
    [Protocols in frame: usb]
USB URB
    URB id: 0xffff8802c1cd1b40
    URB type: URB_SUBMIT ('S')
    URB transfer type: URB_BULK (0x03)
    Endpoint: 0x81, Direction: IN
        1... .... = Direction: IN (1)
        .000 0001 = Endpoint value: 1
    Device: 39
    URB bus id: 2
    Device setup request: not relevant ('-')
    Data: not present ('<')
    URB sec: 1424613635
    URB usec: 202158
    URB status: Operation now in progress (-EINPROGRESS) (-115)
    URB length [bytes]: 128
    Data length [bytes]: 0
    [bInterfaceClass: CDC-Data (0x0a)]

0000  40 1b cd c1 02 88 ff ff 53 03 81 27 02 00 2d 3c   @.......S..'..-<
0010  03 e1 e9 54 00 00 00 00 ae 15 03 00 8d ff ff ff   ...T............
0020  80 00 00 00 00 00 00 00 00 00 00 00 00 00 00 00   ................
0030  00 00 00 00 00 00 00 00 04 02 00 00 00 00 00 00   ................

No.     Time           Source                Destination           Protocol Length Info
   3165 18.523740000   host                  39.1                  USB      64     URB_BULK in

Frame 3165: 64 bytes on wire (512 bits), 64 bytes captured (512 bits) on interface 0
    Interface id: 0
    Encapsulation type: USB packets with Linux header and padding (115)
    Arrival Time: Feb 22, 2015 16:00:35.202159000 SAST
    [Time shift for this packet: 0.000000000 seconds]
    Epoch Time: 1424613635.202159000 seconds
    [Time delta from previous captured frame: 0.000001000 seconds]
    [Time delta from previous displayed frame: 0.000001000 seconds]
    [Time since reference or first frame: 18.523740000 seconds]
    Frame Number: 3165
    Frame Length: 64 bytes (512 bits)
    Capture Length: 64 bytes (512 bits)
    [Frame is marked: False]
    [Frame is ignored: False]
    [Protocols in frame: usb]
USB URB
    URB id: 0xffff8802c1cd1a80
    URB type: URB_SUBMIT ('S')
    URB transfer type: URB_BULK (0x03)
    Endpoint: 0x81, Direction: IN
        1... .... = Direction: IN (1)
        .000 0001 = Endpoint value: 1
    Device: 39
    URB bus id: 2
    Device setup request: not relevant ('-')
    Data: not present ('<')
    URB sec: 1424613635
    URB usec: 202159
    URB status: Operation now in progress (-EINPROGRESS) (-115)
    URB length [bytes]: 128
    Data length [bytes]: 0
    [bInterfaceClass: CDC-Data (0x0a)]

0000  80 1a cd c1 02 88 ff ff 53 03 81 27 02 00 2d 3c   ........S..'..-<
0010  03 e1 e9 54 00 00 00 00 af 15 03 00 8d ff ff ff   ...T............
0020  80 00 00 00 00 00 00 00 00 00 00 00 00 00 00 00   ................
0030  00 00 00 00 00 00 00 00 04 02 00 00 00 00 00 00   ................

No.     Time           Source                Destination           Protocol Length Info
   3166 18.524126000   host                  39.0                  USB      71     URB_CONTROL out

Frame 3166: 71 bytes on wire (568 bits), 71 bytes captured (568 bits) on interface 0
    Interface id: 0
    Encapsulation type: USB packets with Linux header and padding (115)
    Arrival Time: Feb 22, 2015 16:00:35.202545000 SAST
    [Time shift for this packet: 0.000000000 seconds]
    Epoch Time: 1424613635.202545000 seconds
    [Time delta from previous captured frame: 0.000386000 seconds]
    [Time delta from previous displayed frame: 0.000386000 seconds]
    [Time since reference or first frame: 18.524126000 seconds]
    Frame Number: 3166
    Frame Length: 71 bytes (568 bits)
    Capture Length: 71 bytes (568 bits)
    [Frame is marked: False]
    [Frame is ignored: False]
    [Protocols in frame: usb]
USB URB
    URB id: 0xffff8801c37ca000
    URB type: URB_SUBMIT ('S')
    URB transfer type: URB_CONTROL (0x02)
    Endpoint: 0x00, Direction: OUT
        0... .... = Direction: OUT (0)
        .000 0000 = Endpoint value: 0
    Device: 39
    URB bus id: 2
    Device setup request: relevant (0)
    Data: present (0)
    URB sec: 1424613635
    URB usec: 202545
    URB status: Operation now in progress (-EINPROGRESS) (-115)
    URB length [bytes]: 7
    Data length [bytes]: 7
    [Response in: 3167]
    [bInterfaceClass: Communications and CDC Control (0x02)]
URB setup
    bmRequestType: 0x21
        0... .... = Direction: Host-to-device
        .01. .... = Type: Class (0x01)
        ...0 0001 = Recipient: Interface (0x01)
    bRequest: 32
    wValue: 0x0000
    wIndex: 0
    wLength: 7
Leftover Capture Data: 80250000000008

0000  00 a0 7c c3 01 88 ff ff 53 02 00 27 02 00 00 00   ..|.....S..'....
0010  03 e1 e9 54 00 00 00 00 31 17 03 00 8d ff ff ff   ...T....1.......
0020  07 00 00 00 07 00 00 00 21 20 00 00 00 00 07 00   ........! ......
0030  00 00 00 00 00 00 00 00 00 00 00 00 00 00 00 00   ................
0040  80 25 00 00 00 00 08                              .%.....

No.     Time           Source                Destination           Protocol Length Info
   3167 18.524334000   39.0                  host                  USB      64     URB_CONTROL out

Frame 3167: 64 bytes on wire (512 bits), 64 bytes captured (512 bits) on interface 0
    Interface id: 0
    Encapsulation type: USB packets with Linux header and padding (115)
    Arrival Time: Feb 22, 2015 16:00:35.202753000 SAST
    [Time shift for this packet: 0.000000000 seconds]
    Epoch Time: 1424613635.202753000 seconds
    [Time delta from previous captured frame: 0.000208000 seconds]
    [Time delta from previous displayed frame: 0.000208000 seconds]
    [Time since reference or first frame: 18.524334000 seconds]
    Frame Number: 3167
    Frame Length: 64 bytes (512 bits)
    Capture Length: 64 bytes (512 bits)
    [Frame is marked: False]
    [Frame is ignored: False]
    [Protocols in frame: usb]
USB URB
    URB id: 0xffff8801c37ca000
    URB type: URB_COMPLETE ('C')
    URB transfer type: URB_CONTROL (0x02)
    Endpoint: 0x00, Direction: OUT
        0... .... = Direction: OUT (0)
        .000 0000 = Endpoint value: 0
    Device: 39
    URB bus id: 2
    Device setup request: not relevant ('-')
    Data: not present ('>')
    URB sec: 1424613635
    URB usec: 202753
    URB status: Success (0)
    URB length [bytes]: 7
    Data length [bytes]: 0
    [Request in: 3166]
    [Time from request: 0.000208000 seconds]
    [bInterfaceClass: Communications and CDC Control (0x02)]

0000  00 a0 7c c3 01 88 ff ff 43 02 00 27 02 00 2d 3e   ..|.....C..'..->
0010  03 e1 e9 54 00 00 00 00 01 18 03 00 00 00 00 00   ...T............
0020  07 00 00 00 00 00 00 00 00 00 00 00 00 00 00 00   ................
0030  00 00 00 00 00 00 00 00 00 00 00 00 00 00 00 00   ................

No.     Time           Source                Destination           Protocol Length Info
   3316 19.974704000   host                  39.1                  Ethernet 65     URB_BULK out[Malformed Packet]

Frame 3316: 65 bytes on wire (520 bits), 65 bytes captured (520 bits) on interface 0
    Interface id: 0
    Encapsulation type: USB packets with Linux header and padding (115)
    Arrival Time: Feb 22, 2015 16:00:36.653123000 SAST
    [Time shift for this packet: 0.000000000 seconds]
    Epoch Time: 1424613636.653123000 seconds
    [Time delta from previous captured frame: 0.005797000 seconds]
    [Time delta from previous displayed frame: 1.450370000 seconds]
    [Time since reference or first frame: 19.974704000 seconds]
    Frame Number: 3316
    Frame Length: 65 bytes (520 bits)
    Capture Length: 65 bytes (520 bits)
    [Frame is marked: False]
    [Frame is ignored: False]
    [Protocols in frame: usb:eth]
USB URB
    URB id: 0xffff8802c1cd1cc0
    URB type: URB_SUBMIT ('S')
    URB transfer type: URB_BULK (0x03)
    Endpoint: 0x01, Direction: OUT
        0... .... = Direction: OUT (0)
        .000 0001 = Endpoint value: 1
    Device: 39
    URB bus id: 2
    Device setup request: not relevant ('-')
    Data: present (0)
    URB sec: 1424613636
    URB usec: 653123
    URB status: Operation now in progress (-EINPROGRESS) (-115)
    URB length [bytes]: 1
    Data length [bytes]: 1
    [Response in: 3318]
    [bInterfaceClass: CDC-Data (0x0a)]
[Malformed Packet: Ethernet]
    [Expert Info (Error/Malformed): Malformed Packet (Exception occurred)]
        [Message: Malformed Packet (Exception occurred)]
        [Severity level: Error]
        [Group: Malformed]

0000  c0 1c cd c1 02 88 ff ff 53 03 01 27 02 00 2d 00   ........S..'..-.
0010  04 e1 e9 54 00 00 00 00 43 f7 09 00 8d ff ff ff   ...T....C.......
0020  01 00 00 00 01 00 00 00 00 00 00 00 00 00 00 00   ................
0030  00 00 00 00 00 00 00 00 04 00 00 00 00 00 00 00   ................
0040  2e                                                .

No.     Time           Source                Destination           Protocol Length Info
   3317 19.974821000   39.1                  host                  USB      64     URB_BULK out

Frame 3317: 64 bytes on wire (512 bits), 64 bytes captured (512 bits) on interface 0
    Interface id: 0
    Encapsulation type: USB packets with Linux header and padding (115)
    Arrival Time: Feb 22, 2015 16:00:36.653240000 SAST
    [Time shift for this packet: 0.000000000 seconds]
    Epoch Time: 1424613636.653240000 seconds
    [Time delta from previous captured frame: 0.000117000 seconds]
    [Time delta from previous displayed frame: 0.000117000 seconds]
    [Time since reference or first frame: 19.974821000 seconds]
    Frame Number: 3317
    Frame Length: 64 bytes (512 bits)
    Capture Length: 64 bytes (512 bits)
    [Frame is marked: False]
    [Frame is ignored: False]
    [Protocols in frame: usb]
USB URB
    URB id: 0xffff8802c1cd1cc0
    URB type: URB_COMPLETE ('C')
    URB transfer type: URB_BULK (0x03)
    Endpoint: 0x01, Direction: OUT
        0... .... = Direction: OUT (0)
        .000 0001 = Endpoint value: 1
    Device: 39
    URB bus id: 2
    Device setup request: not relevant ('-')
    Data: not present ('>')
    URB sec: 1424613636
    URB usec: 653240
    URB status: Success (0)
    URB length [bytes]: 1
    Data length [bytes]: 0
    [Request in: 3316]
    [Time from request: 0.000117000 seconds]
    [bInterfaceClass: CDC-Data (0x0a)]

0000  c0 1c cd c1 02 88 ff ff 43 03 01 27 02 00 2d 3e   ........C..'..->
0010  04 e1 e9 54 00 00 00 00 b8 f7 09 00 00 00 00 00   ...T............
0020  01 00 00 00 00 00 00 00 00 00 00 00 00 00 00 00   ................
0030  00 00 00 00 00 00 00 00 04 00 00 00 00 00 00 00   ................

No.     Time           Source                Destination           Protocol Length Info
   3318 19.975438000   2c:20:32:35:39:0a     30:2c:20:2d:38:39     Ethernet 76     URB_BULK in[Malformed Packet]

Frame 3318: 76 bytes on wire (608 bits), 76 bytes captured (608 bits) on interface 0
    Interface id: 0
    Encapsulation type: USB packets with Linux header and padding (115)
    Arrival Time: Feb 22, 2015 16:00:36.653857000 SAST
    [Time shift for this packet: 0.000000000 seconds]
    Epoch Time: 1424613636.653857000 seconds
    [Time delta from previous captured frame: 0.000617000 seconds]
    [Time delta from previous displayed frame: 0.000617000 seconds]
    [Time since reference or first frame: 19.975438000 seconds]
    Frame Number: 3318
    Frame Length: 76 bytes (608 bits)
    Capture Length: 76 bytes (608 bits)
    [Frame is marked: False]
    [Frame is ignored: False]
    [Protocols in frame: usb:eth]
USB URB
    URB id: 0xffff88041783b9c0
    URB type: URB_COMPLETE ('C')
    URB transfer type: URB_BULK (0x03)
    Endpoint: 0x81, Direction: IN
        1... .... = Direction: IN (1)
        .000 0001 = Endpoint value: 1
    Device: 39
    URB bus id: 2
    Device setup request: not relevant ('-')
    Data: present (0)
    URB sec: 1424613636
    URB usec: 653857
    URB status: Success (0)
    URB length [bytes]: 12
    Data length [bytes]: 12
    [Request in: 3316]
    [Time from request: 0.000734000 seconds]
    [bInterfaceClass: CDC-Data (0x0a)]
[Malformed Packet: Ethernet]
    [Expert Info (Error/Malformed): Malformed Packet (Exception occurred)]
        [Message: Malformed Packet (Exception occurred)]
        [Severity level: Error]
        [Group: Malformed]

0000  c0 b9 83 17 04 88 ff ff 43 03 81 27 02 00 2d 00   ........C..'..-.
0010  04 e1 e9 54 00 00 00 00 21 fa 09 00 00 00 00 00   ...T....!.......
0020  0c 00 00 00 0c 00 00 00 00 00 00 00 00 00 00 00   ................
0030  00 00 00 00 00 00 00 00 04 02 00 00 00 00 00 00   ................
0040  30 2c 20 2d 38 39 2c 20 32 35 39 0a               0, -89, 259.

No.     Time           Source                Destination           Protocol Length Info
   3319 19.975445000   host                  39.1                  USB      64     URB_BULK in

Frame 3319: 64 bytes on wire (512 bits), 64 bytes captured (512 bits) on interface 0
    Interface id: 0
    Encapsulation type: USB packets with Linux header and padding (115)
    Arrival Time: Feb 22, 2015 16:00:36.653864000 SAST
    [Time shift for this packet: 0.000000000 seconds]
    Epoch Time: 1424613636.653864000 seconds
    [Time delta from previous captured frame: 0.000007000 seconds]
    [Time delta from previous displayed frame: 0.000007000 seconds]
    [Time since reference or first frame: 19.975445000 seconds]
    Frame Number: 3319
    Frame Length: 64 bytes (512 bits)
    Capture Length: 64 bytes (512 bits)
    [Frame is marked: False]
    [Frame is ignored: False]
    [Protocols in frame: usb]
USB URB
    URB id: 0xffff88041783b9c0
    URB type: URB_SUBMIT ('S')
    URB transfer type: URB_BULK (0x03)
    Endpoint: 0x81, Direction: IN
        1... .... = Direction: IN (1)
        .000 0001 = Endpoint value: 1
    Device: 39
    URB bus id: 2
    Device setup request: not relevant ('-')
    Data: not present ('<')
    URB sec: 1424613636
    URB usec: 653864
    URB status: Operation now in progress (-EINPROGRESS) (-115)
    URB length [bytes]: 128
    Data length [bytes]: 0
    [bInterfaceClass: CDC-Data (0x0a)]

0000  c0 b9 83 17 04 88 ff ff 53 03 81 27 02 00 2d 3c   ........S..'..-<
0010  04 e1 e9 54 00 00 00 00 28 fa 09 00 8d ff ff ff   ...T....(.......
0020  80 00 00 00 00 00 00 00 00 00 00 00 00 00 00 00   ................
0030  00 00 00 00 00 00 00 00 04 02 00 00 00 00 00 00   ................

No.     Time           Source                Destination           Protocol Length Info
   3424 20.643302000   host                  39.1                  Ethernet 65     URB_BULK out[Malformed Packet]

Frame 3424: 65 bytes on wire (520 bits), 65 bytes captured (520 bits) on interface 0
    Interface id: 0
    Encapsulation type: USB packets with Linux header and padding (115)
    Arrival Time: Feb 22, 2015 16:00:37.321721000 SAST
    [Time shift for this packet: 0.000000000 seconds]
    Epoch Time: 1424613637.321721000 seconds
    [Time delta from previous captured frame: 0.002402000 seconds]
    [Time delta from previous displayed frame: 0.667857000 seconds]
    [Time since reference or first frame: 20.643302000 seconds]
    Frame Number: 3424
    Frame Length: 65 bytes (520 bits)
    Capture Length: 65 bytes (520 bits)
    [Frame is marked: False]
    [Frame is ignored: False]
    [Protocols in frame: usb:eth]
USB URB
    URB id: 0xffff8802c1cd1cc0
    URB type: URB_SUBMIT ('S')
    URB transfer type: URB_BULK (0x03)
    Endpoint: 0x01, Direction: OUT
        0... .... = Direction: OUT (0)
        .000 0001 = Endpoint value: 1
    Device: 39
    URB bus id: 2
    Device setup request: not relevant ('-')
    Data: present (0)
    URB sec: 1424613637
    URB usec: 321721
    URB status: Operation now in progress (-EINPROGRESS) (-115)
    URB length [bytes]: 1
    Data length [bytes]: 1
    [Response in: 3426]
    [bInterfaceClass: CDC-Data (0x0a)]
[Malformed Packet: Ethernet]
    [Expert Info (Error/Malformed): Malformed Packet (Exception occurred)]
        [Message: Malformed Packet (Exception occurred)]
        [Severity level: Error]
        [Group: Malformed]

0000  c0 1c cd c1 02 88 ff ff 53 03 01 27 02 00 2d 00   ........S..'..-.
0010  05 e1 e9 54 00 00 00 00 b9 e8 04 00 8d ff ff ff   ...T............
0020  01 00 00 00 01 00 00 00 00 00 00 00 00 00 00 00   ................
0030  00 00 00 00 00 00 00 00 04 00 00 00 00 00 00 00   ................
0040  2e                                                .

No.     Time           Source                Destination           Protocol Length Info
   3425 20.643443000   39.1                  host                  USB      64     URB_BULK out

Frame 3425: 64 bytes on wire (512 bits), 64 bytes captured (512 bits) on interface 0
    Interface id: 0
    Encapsulation type: USB packets with Linux header and padding (115)
    Arrival Time: Feb 22, 2015 16:00:37.321862000 SAST
    [Time shift for this packet: 0.000000000 seconds]
    Epoch Time: 1424613637.321862000 seconds
    [Time delta from previous captured frame: 0.000141000 seconds]
    [Time delta from previous displayed frame: 0.000141000 seconds]
    [Time since reference or first frame: 20.643443000 seconds]
    Frame Number: 3425
    Frame Length: 64 bytes (512 bits)
    Capture Length: 64 bytes (512 bits)
    [Frame is marked: False]
    [Frame is ignored: False]
    [Protocols in frame: usb]
USB URB
    URB id: 0xffff8802c1cd1cc0
    URB type: URB_COMPLETE ('C')
    URB transfer type: URB_BULK (0x03)
    Endpoint: 0x01, Direction: OUT
        0... .... = Direction: OUT (0)
        .000 0001 = Endpoint value: 1
    Device: 39
    URB bus id: 2
    Device setup request: not relevant ('-')
    Data: not present ('>')
    URB sec: 1424613637
    URB usec: 321862
    URB status: Success (0)
    URB length [bytes]: 1
    Data length [bytes]: 0
    [Request in: 3424]
    [Time from request: 0.000141000 seconds]
    [bInterfaceClass: CDC-Data (0x0a)]

0000  c0 1c cd c1 02 88 ff ff 43 03 01 27 02 00 2d 3e   ........C..'..->
0010  05 e1 e9 54 00 00 00 00 46 e9 04 00 00 00 00 00   ...T....F.......
0020  01 00 00 00 00 00 00 00 00 00 00 00 00 00 00 00   ................
0030  00 00 00 00 00 00 00 00 04 00 00 00 00 00 00 00   ................

No.     Time           Source                Destination           Protocol Length Info
   3426 20.646320000   2c:20:32:35:39:0a     30:2c:20:2d:38:39     Ethernet 76     URB_BULK in[Malformed Packet]

Frame 3426: 76 bytes on wire (608 bits), 76 bytes captured (608 bits) on interface 0
    Interface id: 0
    Encapsulation type: USB packets with Linux header and padding (115)
    Arrival Time: Feb 22, 2015 16:00:37.324739000 SAST
    [Time shift for this packet: 0.000000000 seconds]
    Epoch Time: 1424613637.324739000 seconds
    [Time delta from previous captured frame: 0.002877000 seconds]
    [Time delta from previous displayed frame: 0.002877000 seconds]
    [Time since reference or first frame: 20.646320000 seconds]
    Frame Number: 3426
    Frame Length: 76 bytes (608 bits)
    Capture Length: 76 bytes (608 bits)
    [Frame is marked: False]
    [Frame is ignored: False]
    [Protocols in frame: usb:eth]
USB URB
    URB id: 0xffff88041783b780
    URB type: URB_COMPLETE ('C')
    URB transfer type: URB_BULK (0x03)
    Endpoint: 0x81, Direction: IN
        1... .... = Direction: IN (1)
        .000 0001 = Endpoint value: 1
    Device: 39
    URB bus id: 2
    Device setup request: not relevant ('-')
    Data: present (0)
    URB sec: 1424613637
    URB usec: 324739
    URB status: Success (0)
    URB length [bytes]: 12
    Data length [bytes]: 12
    [Request in: 3424]
    [Time from request: 0.003018000 seconds]
    [bInterfaceClass: CDC-Data (0x0a)]
[Malformed Packet: Ethernet]
    [Expert Info (Error/Malformed): Malformed Packet (Exception occurred)]
        [Message: Malformed Packet (Exception occurred)]
        [Severity level: Error]
        [Group: Malformed]

0000  80 b7 83 17 04 88 ff ff 43 03 81 27 02 00 2d 00   ........C..'..-.
0010  05 e1 e9 54 00 00 00 00 83 f4 04 00 00 00 00 00   ...T............
0020  0c 00 00 00 0c 00 00 00 00 00 00 00 00 00 00 00   ................
0030  00 00 00 00 00 00 00 00 04 02 00 00 00 00 00 00   ................
0040  30 2c 20 2d 38 39 2c 20 32 35 39 0a               0, -89, 259.

No.     Time           Source                Destination           Protocol Length Info
   3427 20.646331000   host                  39.1                  USB      64     URB_BULK in

Frame 3427: 64 bytes on wire (512 bits), 64 bytes captured (512 bits) on interface 0
    Interface id: 0
    Encapsulation type: USB packets with Linux header and padding (115)
    Arrival Time: Feb 22, 2015 16:00:37.324750000 SAST
    [Time shift for this packet: 0.000000000 seconds]
    Epoch Time: 1424613637.324750000 seconds
    [Time delta from previous captured frame: 0.000011000 seconds]
    [Time delta from previous displayed frame: 0.000011000 seconds]
    [Time since reference or first frame: 20.646331000 seconds]
    Frame Number: 3427
    Frame Length: 64 bytes (512 bits)
    Capture Length: 64 bytes (512 bits)
    [Frame is marked: False]
    [Frame is ignored: False]
    [Protocols in frame: usb]
USB URB
    URB id: 0xffff88041783b780
    URB type: URB_SUBMIT ('S')
    URB transfer type: URB_BULK (0x03)
    Endpoint: 0x81, Direction: IN
        1... .... = Direction: IN (1)
        .000 0001 = Endpoint value: 1
    Device: 39
    URB bus id: 2
    Device setup request: not relevant ('-')
    Data: not present ('<')
    URB sec: 1424613637
    URB usec: 324750
    URB status: Operation now in progress (-EINPROGRESS) (-115)
    URB length [bytes]: 128
    Data length [bytes]: 0
    [bInterfaceClass: CDC-Data (0x0a)]

0000  80 b7 83 17 04 88 ff ff 53 03 81 27 02 00 2d 3c   ........S..'..-<
0010  05 e1 e9 54 00 00 00 00 8e f4 04 00 8d ff ff ff   ...T............
0020  80 00 00 00 00 00 00 00 00 00 00 00 00 00 00 00   ................
0030  00 00 00 00 00 00 00 00 04 02 00 00 00 00 00 00   ................

No.     Time           Source                Destination           Protocol Length Info
   3432 21.123542000   host                  39.1                  Ethernet 65     URB_BULK out[Malformed Packet]

Frame 3432: 65 bytes on wire (520 bits), 65 bytes captured (520 bits) on interface 0
    Interface id: 0
    Encapsulation type: USB packets with Linux header and padding (115)
    Arrival Time: Feb 22, 2015 16:00:37.801961000 SAST
    [Time shift for this packet: 0.000000000 seconds]
    Epoch Time: 1424613637.801961000 seconds
    [Time delta from previous captured frame: 0.002717000 seconds]
    [Time delta from previous displayed frame: 0.477211000 seconds]
    [Time since reference or first frame: 21.123542000 seconds]
    Frame Number: 3432
    Frame Length: 65 bytes (520 bits)
    Capture Length: 65 bytes (520 bits)
    [Frame is marked: False]
    [Frame is ignored: False]
    [Protocols in frame: usb:eth]
USB URB
    URB id: 0xffff8802c1cd1cc0
    URB type: URB_SUBMIT ('S')
    URB transfer type: URB_BULK (0x03)
    Endpoint: 0x01, Direction: OUT
        0... .... = Direction: OUT (0)
        .000 0001 = Endpoint value: 1
    Device: 39
    URB bus id: 2
    Device setup request: not relevant ('-')
    Data: present (0)
    URB sec: 1424613637
    URB usec: 801961
    URB status: Operation now in progress (-EINPROGRESS) (-115)
    URB length [bytes]: 1
    Data length [bytes]: 1
    [Response in: 3434]
    [bInterfaceClass: CDC-Data (0x0a)]
[Malformed Packet: Ethernet]
    [Expert Info (Error/Malformed): Malformed Packet (Exception occurred)]
        [Message: Malformed Packet (Exception occurred)]
        [Severity level: Error]
        [Group: Malformed]

0000  c0 1c cd c1 02 88 ff ff 53 03 01 27 02 00 2d 00   ........S..'..-.
0010  05 e1 e9 54 00 00 00 00 a9 3c 0c 00 8d ff ff ff   ...T.....<......
0020  01 00 00 00 01 00 00 00 00 00 00 00 00 00 00 00   ................
0030  00 00 00 00 00 00 00 00 04 00 00 00 00 00 00 00   ................
0040  2e                                                .

No.     Time           Source                Destination           Protocol Length Info
   3433 21.123697000   39.1                  host                  USB      64     URB_BULK out

Frame 3433: 64 bytes on wire (512 bits), 64 bytes captured (512 bits) on interface 0
    Interface id: 0
    Encapsulation type: USB packets with Linux header and padding (115)
    Arrival Time: Feb 22, 2015 16:00:37.802116000 SAST
    [Time shift for this packet: 0.000000000 seconds]
    Epoch Time: 1424613637.802116000 seconds
    [Time delta from previous captured frame: 0.000155000 seconds]
    [Time delta from previous displayed frame: 0.000155000 seconds]
    [Time since reference or first frame: 21.123697000 seconds]
    Frame Number: 3433
    Frame Length: 64 bytes (512 bits)
    Capture Length: 64 bytes (512 bits)
    [Frame is marked: False]
    [Frame is ignored: False]
    [Protocols in frame: usb]
USB URB
    URB id: 0xffff8802c1cd1cc0
    URB type: URB_COMPLETE ('C')
    URB transfer type: URB_BULK (0x03)
    Endpoint: 0x01, Direction: OUT
        0... .... = Direction: OUT (0)
        .000 0001 = Endpoint value: 1
    Device: 39
    URB bus id: 2
    Device setup request: not relevant ('-')
    Data: not present ('>')
    URB sec: 1424613637
    URB usec: 802116
    URB status: Success (0)
    URB length [bytes]: 1
    Data length [bytes]: 0
    [Request in: 3432]
    [Time from request: 0.000155000 seconds]
    [bInterfaceClass: CDC-Data (0x0a)]

0000  c0 1c cd c1 02 88 ff ff 43 03 01 27 02 00 2d 3e   ........C..'..->
0010  05 e1 e9 54 00 00 00 00 44 3d 0c 00 00 00 00 00   ...T....D=......
0020  01 00 00 00 00 00 00 00 00 00 00 00 00 00 00 00   ................
0030  00 00 00 00 00 00 00 00 04 00 00 00 00 00 00 00   ................

No.     Time           Source                Destination           Protocol Length Info
   3434 21.128196000   2c:20:32:35:39:0a     30:2c:20:2d:38:39     Ethernet 76     URB_BULK in[Malformed Packet]

Frame 3434: 76 bytes on wire (608 bits), 76 bytes captured (608 bits) on interface 0
    Interface id: 0
    Encapsulation type: USB packets with Linux header and padding (115)
    Arrival Time: Feb 22, 2015 16:00:37.806615000 SAST
    [Time shift for this packet: 0.000000000 seconds]
    Epoch Time: 1424613637.806615000 seconds
    [Time delta from previous captured frame: 0.004499000 seconds]
    [Time delta from previous displayed frame: 0.004499000 seconds]
    [Time since reference or first frame: 21.128196000 seconds]
    Frame Number: 3434
    Frame Length: 76 bytes (608 bits)
    Capture Length: 76 bytes (608 bits)
    [Frame is marked: False]
    [Frame is ignored: False]
    [Protocols in frame: usb:eth]
USB URB
    URB id: 0xffff8801c36f8600
    URB type: URB_COMPLETE ('C')
    URB transfer type: URB_BULK (0x03)
    Endpoint: 0x81, Direction: IN
        1... .... = Direction: IN (1)
        .000 0001 = Endpoint value: 1
    Device: 39
    URB bus id: 2
    Device setup request: not relevant ('-')
    Data: present (0)
    URB sec: 1424613637
    URB usec: 806615
    URB status: Success (0)
    URB length [bytes]: 12
    Data length [bytes]: 12
    [Request in: 3432]
    [Time from request: 0.004654000 seconds]
    [bInterfaceClass: CDC-Data (0x0a)]
[Malformed Packet: Ethernet]
    [Expert Info (Error/Malformed): Malformed Packet (Exception occurred)]
        [Message: Malformed Packet (Exception occurred)]
        [Severity level: Error]
        [Group: Malformed]

0000  00 86 6f c3 01 88 ff ff 43 03 81 27 02 00 2d 00   ..o.....C..'..-.
0010  05 e1 e9 54 00 00 00 00 d7 4e 0c 00 00 00 00 00   ...T.....N......
0020  0c 00 00 00 0c 00 00 00 00 00 00 00 00 00 00 00   ................
0030  00 00 00 00 00 00 00 00 04 02 00 00 00 00 00 00   ................
0040  30 2c 20 2d 38 39 2c 20 32 35 39 0a               0, -89, 259.

No.     Time           Source                Destination           Protocol Length Info
   3435 21.128206000   host                  39.1                  USB      64     URB_BULK in

Frame 3435: 64 bytes on wire (512 bits), 64 bytes captured (512 bits) on interface 0
    Interface id: 0
    Encapsulation type: USB packets with Linux header and padding (115)
    Arrival Time: Feb 22, 2015 16:00:37.806625000 SAST
    [Time shift for this packet: 0.000000000 seconds]
    Epoch Time: 1424613637.806625000 seconds
    [Time delta from previous captured frame: 0.000010000 seconds]
    [Time delta from previous displayed frame: 0.000010000 seconds]
    [Time since reference or first frame: 21.128206000 seconds]
    Frame Number: 3435
    Frame Length: 64 bytes (512 bits)
    Capture Length: 64 bytes (512 bits)
    [Frame is marked: False]
    [Frame is ignored: False]
    [Protocols in frame: usb]
USB URB
    URB id: 0xffff8801c36f8600
    URB type: URB_SUBMIT ('S')
    URB transfer type: URB_BULK (0x03)
    Endpoint: 0x81, Direction: IN
        1... .... = Direction: IN (1)
        .000 0001 = Endpoint value: 1
    Device: 39
    URB bus id: 2
    Device setup request: not relevant ('-')
    Data: not present ('<')
    URB sec: 1424613637
    URB usec: 806625
    URB status: Operation now in progress (-EINPROGRESS) (-115)
    URB length [bytes]: 128
    Data length [bytes]: 0
    [bInterfaceClass: CDC-Data (0x0a)]

0000  00 86 6f c3 01 88 ff ff 53 03 81 27 02 00 2d 3c   ..o.....S..'..-<
0010  05 e1 e9 54 00 00 00 00 e1 4e 0c 00 8d ff ff ff   ...T.....N......
0020  80 00 00 00 00 00 00 00 00 00 00 00 00 00 00 00   ................
0030  00 00 00 00 00 00 00 00 04 02 00 00 00 00 00 00   ................

No.     Time           Source                Destination           Protocol Length Info
   3440 21.491311000   host                  39.1                  Ethernet 65     URB_BULK out[Malformed Packet]

Frame 3440: 65 bytes on wire (520 bits), 65 bytes captured (520 bits) on interface 0
    Interface id: 0
    Encapsulation type: USB packets with Linux header and padding (115)
    Arrival Time: Feb 22, 2015 16:00:38.169730000 SAST
    [Time shift for this packet: 0.000000000 seconds]
    Epoch Time: 1424613638.169730000 seconds
    [Time delta from previous captured frame: 0.002452000 seconds]
    [Time delta from previous displayed frame: 0.363105000 seconds]
    [Time since reference or first frame: 21.491311000 seconds]
    Frame Number: 3440
    Frame Length: 65 bytes (520 bits)
    Capture Length: 65 bytes (520 bits)
    [Frame is marked: False]
    [Frame is ignored: False]
    [Protocols in frame: usb:eth]
USB URB
    URB id: 0xffff8802c1cd1cc0
    URB type: URB_SUBMIT ('S')
    URB transfer type: URB_BULK (0x03)
    Endpoint: 0x01, Direction: OUT
        0... .... = Direction: OUT (0)
        .000 0001 = Endpoint value: 1
    Device: 39
    URB bus id: 2
    Device setup request: not relevant ('-')
    Data: present (0)
    URB sec: 1424613638
    URB usec: 169730
    URB status: Operation now in progress (-EINPROGRESS) (-115)
    URB length [bytes]: 1
    Data length [bytes]: 1
    [Response in: 3442]
    [bInterfaceClass: CDC-Data (0x0a)]
[Malformed Packet: Ethernet]
    [Expert Info (Error/Malformed): Malformed Packet (Exception occurred)]
        [Message: Malformed Packet (Exception occurred)]
        [Severity level: Error]
        [Group: Malformed]

0000  c0 1c cd c1 02 88 ff ff 53 03 01 27 02 00 2d 00   ........S..'..-.
0010  06 e1 e9 54 00 00 00 00 02 97 02 00 8d ff ff ff   ...T............
0020  01 00 00 00 01 00 00 00 00 00 00 00 00 00 00 00   ................
0030  00 00 00 00 00 00 00 00 04 00 00 00 00 00 00 00   ................
0040  2e                                                .

No.     Time           Source                Destination           Protocol Length Info
   3441 21.491410000   39.1                  host                  USB      64     URB_BULK out

Frame 3441: 64 bytes on wire (512 bits), 64 bytes captured (512 bits) on interface 0
    Interface id: 0
    Encapsulation type: USB packets with Linux header and padding (115)
    Arrival Time: Feb 22, 2015 16:00:38.169829000 SAST
    [Time shift for this packet: 0.000000000 seconds]
    Epoch Time: 1424613638.169829000 seconds
    [Time delta from previous captured frame: 0.000099000 seconds]
    [Time delta from previous displayed frame: 0.000099000 seconds]
    [Time since reference or first frame: 21.491410000 seconds]
    Frame Number: 3441
    Frame Length: 64 bytes (512 bits)
    Capture Length: 64 bytes (512 bits)
    [Frame is marked: False]
    [Frame is ignored: False]
    [Protocols in frame: usb]
USB URB
    URB id: 0xffff8802c1cd1cc0
    URB type: URB_COMPLETE ('C')
    URB transfer type: URB_BULK (0x03)
    Endpoint: 0x01, Direction: OUT
        0... .... = Direction: OUT (0)
        .000 0001 = Endpoint value: 1
    Device: 39
    URB bus id: 2
    Device setup request: not relevant ('-')
    Data: not present ('>')
    URB sec: 1424613638
    URB usec: 169829
    URB status: Success (0)
    URB length [bytes]: 1
    Data length [bytes]: 0
    [Request in: 3440]
    [Time from request: 0.000099000 seconds]
    [bInterfaceClass: CDC-Data (0x0a)]

0000  c0 1c cd c1 02 88 ff ff 43 03 01 27 02 00 2d 3e   ........C..'..->
0010  06 e1 e9 54 00 00 00 00 65 97 02 00 00 00 00 00   ...T....e.......
0020  01 00 00 00 00 00 00 00 00 00 00 00 00 00 00 00   ................
0030  00 00 00 00 00 00 00 00 04 00 00 00 00 00 00 00   ................

No.     Time           Source                Destination           Protocol Length Info
   3442 21.494205000   2c:20:32:35:39:0a     30:2c:20:2d:38:39     Ethernet 76     URB_BULK in[Malformed Packet]

Frame 3442: 76 bytes on wire (608 bits), 76 bytes captured (608 bits) on interface 0
    Interface id: 0
    Encapsulation type: USB packets with Linux header and padding (115)
    Arrival Time: Feb 22, 2015 16:00:38.172624000 SAST
    [Time shift for this packet: 0.000000000 seconds]
    Epoch Time: 1424613638.172624000 seconds
    [Time delta from previous captured frame: 0.002795000 seconds]
    [Time delta from previous displayed frame: 0.002795000 seconds]
    [Time since reference or first frame: 21.494205000 seconds]
    Frame Number: 3442
    Frame Length: 76 bytes (608 bits)
    Capture Length: 76 bytes (608 bits)
    [Frame is marked: False]
    [Frame is ignored: False]
    [Protocols in frame: usb:eth]
USB URB
    URB id: 0xffff8801c36f8a80
    URB type: URB_COMPLETE ('C')
    URB transfer type: URB_BULK (0x03)
    Endpoint: 0x81, Direction: IN
        1... .... = Direction: IN (1)
        .000 0001 = Endpoint value: 1
    Device: 39
    URB bus id: 2
    Device setup request: not relevant ('-')
    Data: present (0)
    URB sec: 1424613638
    URB usec: 172624
    URB status: Success (0)
    URB length [bytes]: 12
    Data length [bytes]: 12
    [Request in: 3440]
    [Time from request: 0.002894000 seconds]
    [bInterfaceClass: CDC-Data (0x0a)]
[Malformed Packet: Ethernet]
    [Expert Info (Error/Malformed): Malformed Packet (Exception occurred)]
        [Message: Malformed Packet (Exception occurred)]
        [Severity level: Error]
        [Group: Malformed]

0000  80 8a 6f c3 01 88 ff ff 43 03 81 27 02 00 2d 00   ..o.....C..'..-.
0010  06 e1 e9 54 00 00 00 00 50 a2 02 00 00 00 00 00   ...T....P.......
0020  0c 00 00 00 0c 00 00 00 00 00 00 00 00 00 00 00   ................
0030  00 00 00 00 00 00 00 00 04 02 00 00 00 00 00 00   ................
0040  30 2c 20 2d 38 39 2c 20 32 35 39 0a               0, -89, 259.

No.     Time           Source                Destination           Protocol Length Info
   3443 21.494215000   host                  39.1                  USB      64     URB_BULK in

Frame 3443: 64 bytes on wire (512 bits), 64 bytes captured (512 bits) on interface 0
    Interface id: 0
    Encapsulation type: USB packets with Linux header and padding (115)
    Arrival Time: Feb 22, 2015 16:00:38.172634000 SAST
    [Time shift for this packet: 0.000000000 seconds]
    Epoch Time: 1424613638.172634000 seconds
    [Time delta from previous captured frame: 0.000010000 seconds]
    [Time delta from previous displayed frame: 0.000010000 seconds]
    [Time since reference or first frame: 21.494215000 seconds]
    Frame Number: 3443
    Frame Length: 64 bytes (512 bits)
    Capture Length: 64 bytes (512 bits)
    [Frame is marked: False]
    [Frame is ignored: False]
    [Protocols in frame: usb]
USB URB
    URB id: 0xffff8801c36f8a80
    URB type: URB_SUBMIT ('S')
    URB transfer type: URB_BULK (0x03)
    Endpoint: 0x81, Direction: IN
        1... .... = Direction: IN (1)
        .000 0001 = Endpoint value: 1
    Device: 39
    URB bus id: 2
    Device setup request: not relevant ('-')
    Data: not present ('<')
    URB sec: 1424613638
    URB usec: 172634
    URB status: Operation now in progress (-EINPROGRESS) (-115)
    URB length [bytes]: 128
    Data length [bytes]: 0
    [bInterfaceClass: CDC-Data (0x0a)]

0000  80 8a 6f c3 01 88 ff ff 53 03 81 27 02 00 2d 3c   ..o.....S..'..-<
0010  06 e1 e9 54 00 00 00 00 5a a2 02 00 8d ff ff ff   ...T....Z.......
0020  80 00 00 00 00 00 00 00 00 00 00 00 00 00 00 00   ................
0030  00 00 00 00 00 00 00 00 04 02 00 00 00 00 00 00   ................

No.     Time           Source                Destination           Protocol Length Info
   3520 22.227638000   host                  39.1                  Ethernet 65     URB_BULK out[Malformed Packet]

Frame 3520: 65 bytes on wire (520 bits), 65 bytes captured (520 bits) on interface 0
    Interface id: 0
    Encapsulation type: USB packets with Linux header and padding (115)
    Arrival Time: Feb 22, 2015 16:00:38.906057000 SAST
    [Time shift for this packet: 0.000000000 seconds]
    Epoch Time: 1424613638.906057000 seconds
    [Time delta from previous captured frame: 0.001829000 seconds]
    [Time delta from previous displayed frame: 0.733423000 seconds]
    [Time since reference or first frame: 22.227638000 seconds]
    Frame Number: 3520
    Frame Length: 65 bytes (520 bits)
    Capture Length: 65 bytes (520 bits)
    [Frame is marked: False]
    [Frame is ignored: False]
    [Protocols in frame: usb:eth]
USB URB
    URB id: 0xffff8802c1cd1cc0
    URB type: URB_SUBMIT ('S')
    URB transfer type: URB_BULK (0x03)
    Endpoint: 0x01, Direction: OUT
        0... .... = Direction: OUT (0)
        .000 0001 = Endpoint value: 1
    Device: 39
    URB bus id: 2
    Device setup request: not relevant ('-')
    Data: present (0)
    URB sec: 1424613638
    URB usec: 906057
    URB status: Operation now in progress (-EINPROGRESS) (-115)
    URB length [bytes]: 1
    Data length [bytes]: 1
    [Response in: 3522]
    [bInterfaceClass: CDC-Data (0x0a)]
[Malformed Packet: Ethernet]
    [Expert Info (Error/Malformed): Malformed Packet (Exception occurred)]
        [Message: Malformed Packet (Exception occurred)]
        [Severity level: Error]
        [Group: Malformed]

0000  c0 1c cd c1 02 88 ff ff 53 03 01 27 02 00 2d 00   ........S..'..-.
0010  06 e1 e9 54 00 00 00 00 49 d3 0d 00 8d ff ff ff   ...T....I.......
0020  01 00 00 00 01 00 00 00 00 00 00 00 00 00 00 00   ................
0030  00 00 00 00 00 00 00 00 04 00 00 00 00 00 00 00   ................
0040  2e                                                .

No.     Time           Source                Destination           Protocol Length Info
   3521 22.227814000   39.1                  host                  USB      64     URB_BULK out

Frame 3521: 64 bytes on wire (512 bits), 64 bytes captured (512 bits) on interface 0
    Interface id: 0
    Encapsulation type: USB packets with Linux header and padding (115)
    Arrival Time: Feb 22, 2015 16:00:38.906233000 SAST
    [Time shift for this packet: 0.000000000 seconds]
    Epoch Time: 1424613638.906233000 seconds
    [Time delta from previous captured frame: 0.000176000 seconds]
    [Time delta from previous displayed frame: 0.000176000 seconds]
    [Time since reference or first frame: 22.227814000 seconds]
    Frame Number: 3521
    Frame Length: 64 bytes (512 bits)
    Capture Length: 64 bytes (512 bits)
    [Frame is marked: False]
    [Frame is ignored: False]
    [Protocols in frame: usb]
USB URB
    URB id: 0xffff8802c1cd1cc0
    URB type: URB_COMPLETE ('C')
    URB transfer type: URB_BULK (0x03)
    Endpoint: 0x01, Direction: OUT
        0... .... = Direction: OUT (0)
        .000 0001 = Endpoint value: 1
    Device: 39
    URB bus id: 2
    Device setup request: not relevant ('-')
    Data: not present ('>')
    URB sec: 1424613638
    URB usec: 906233
    URB status: Success (0)
    URB length [bytes]: 1
    Data length [bytes]: 0
    [Request in: 3520]
    [Time from request: 0.000176000 seconds]
    [bInterfaceClass: CDC-Data (0x0a)]

0000  c0 1c cd c1 02 88 ff ff 43 03 01 27 02 00 2d 3e   ........C..'..->
0010  06 e1 e9 54 00 00 00 00 f9 d3 0d 00 00 00 00 00   ...T............
0020  01 00 00 00 00 00 00 00 00 00 00 00 00 00 00 00   ................
0030  00 00 00 00 00 00 00 00 04 00 00 00 00 00 00 00   ................

No.     Time           Source                Destination           Protocol Length Info
   3522 22.232187000   2c:20:32:35:39:0a     30:2c:20:2d:38:39     Ethernet 76     URB_BULK in[Malformed Packet]

Frame 3522: 76 bytes on wire (608 bits), 76 bytes captured (608 bits) on interface 0
    Interface id: 0
    Encapsulation type: USB packets with Linux header and padding (115)
    Arrival Time: Feb 22, 2015 16:00:38.910606000 SAST
    [Time shift for this packet: 0.000000000 seconds]
    Epoch Time: 1424613638.910606000 seconds
    [Time delta from previous captured frame: 0.004373000 seconds]
    [Time delta from previous displayed frame: 0.004373000 seconds]
    [Time since reference or first frame: 22.232187000 seconds]
    Frame Number: 3522
    Frame Length: 76 bytes (608 bits)
    Capture Length: 76 bytes (608 bits)
    [Frame is marked: False]
    [Frame is ignored: False]
    [Protocols in frame: usb:eth]
USB URB
    URB id: 0xffff8801c36f8180
    URB type: URB_COMPLETE ('C')
    URB transfer type: URB_BULK (0x03)
    Endpoint: 0x81, Direction: IN
        1... .... = Direction: IN (1)
        .000 0001 = Endpoint value: 1
    Device: 39
    URB bus id: 2
    Device setup request: not relevant ('-')
    Data: present (0)
    URB sec: 1424613638
    URB usec: 910606
    URB status: Success (0)
    URB length [bytes]: 12
    Data length [bytes]: 12
    [Request in: 3520]
    [Time from request: 0.004549000 seconds]
    [bInterfaceClass: CDC-Data (0x0a)]
[Malformed Packet: Ethernet]
    [Expert Info (Error/Malformed): Malformed Packet (Exception occurred)]
        [Message: Malformed Packet (Exception occurred)]
        [Severity level: Error]
        [Group: Malformed]

0000  80 81 6f c3 01 88 ff ff 43 03 81 27 02 00 2d 00   ..o.....C..'..-.
0010  06 e1 e9 54 00 00 00 00 0e e5 0d 00 00 00 00 00   ...T............
0020  0c 00 00 00 0c 00 00 00 00 00 00 00 00 00 00 00   ................
0030  00 00 00 00 00 00 00 00 04 02 00 00 00 00 00 00   ................
0040  30 2c 20 2d 38 39 2c 20 32 35 39 0a               0, -89, 259.

No.     Time           Source                Destination           Protocol Length Info
   3523 22.232196000   host                  39.1                  USB      64     URB_BULK in

Frame 3523: 64 bytes on wire (512 bits), 64 bytes captured (512 bits) on interface 0
    Interface id: 0
    Encapsulation type: USB packets with Linux header and padding (115)
    Arrival Time: Feb 22, 2015 16:00:38.910615000 SAST
    [Time shift for this packet: 0.000000000 seconds]
    Epoch Time: 1424613638.910615000 seconds
    [Time delta from previous captured frame: 0.000009000 seconds]
    [Time delta from previous displayed frame: 0.000009000 seconds]
    [Time since reference or first frame: 22.232196000 seconds]
    Frame Number: 3523
    Frame Length: 64 bytes (512 bits)
    Capture Length: 64 bytes (512 bits)
    [Frame is marked: False]
    [Frame is ignored: False]
    [Protocols in frame: usb]
USB URB
    URB id: 0xffff8801c36f8180
    URB type: URB_SUBMIT ('S')
    URB transfer type: URB_BULK (0x03)
    Endpoint: 0x81, Direction: IN
        1... .... = Direction: IN (1)
        .000 0001 = Endpoint value: 1
    Device: 39
    URB bus id: 2
    Device setup request: not relevant ('-')
    Data: not present ('<')
    URB sec: 1424613638
    URB usec: 910615
    URB status: Operation now in progress (-EINPROGRESS) (-115)
    URB length [bytes]: 128
    Data length [bytes]: 0
    [bInterfaceClass: CDC-Data (0x0a)]

0000  80 81 6f c3 01 88 ff ff 53 03 81 27 02 00 2d 3c   ..o.....S..'..-<
0010  06 e1 e9 54 00 00 00 00 17 e5 0d 00 8d ff ff ff   ...T............
0020  80 00 00 00 00 00 00 00 00 00 00 00 00 00 00 00   ................
0030  00 00 00 00 00 00 00 00 04 02 00 00 00 00 00 00   ................
